id,user_rating,review_text
1,5/5,The ultimate question posed by LOTR is whether we choose to remain cell-phone enslaved Gollums or become Frodo and cast the One Ring of addictions and attachments into the fire.
2,,Here is an epic with literature's depth and opera's splendor -- and one that could be achieved only in movies. What could be more terrific?
3,C+,"If you liked the first two, by all means, go forth and experience rapture. But for those of us who remain unconvinced, well, The Return of the King feels like an especially slow swim through especially slow mud."
4,A,Fantasy adventure epics don't get any more powerful than this.
5,4/4,"End to end, first film to last, Peter Jackson's The Lord of the Rings is a cinematic event par excellence. He set precedent by filming three movies simultaneously, and he wraps it all up with a magnificent bow."
6,3.5/4,"It turns out that the movie is a worthy heir to the throne. The Return of the King is the darkest and richest film in the trilogy, a morally satisfying epic that redeems the adage that size equals gravity."
7,4/5,"The peaks ensure that Return of the King is a rare beast, both as a second sequel that trounces its predecessors and an event movie that rises to its sense of occasion. Giving credit where it's due, it's also vigorous, briskly epic entertainment."
8,3.5/4,"The Lord of the Rings: The Return of the King is everything the hype says: grand in scale, massive in emotional pitch, and towering in technical achievement."
9,4/5,"Even if you aren't [a fan of the books], and find this quasi-Shakespearean quest way too cosmic for comfort, how can you not admire the artful inventiveness of it all?"
10,,"Taken as a whole, Jackson's trilogy is a staggering achievement, and there will no doubt be those who won't mind the multiple endings, because they won't want to let it go, either."
11,4/4,"The wait is over for Lord of the Rings fans, and The Return of the King has made it all worthwhile."
12,A,"Lord of the Rings: The Return of the King upends all trilogy expectations. It is a spectacular movie, the best of the three, offering both a grand, fight-to-the-death climax and an intimate, emotional summing up of the J.R.R. Tolkien fantasy classic."
13,4/5,"The weakest link in the project. The Lord of the Rings is still a majestic accomplishment, a masterful work of imagination on a grand, mythic scale, and it is carried to a satisfying conclusion by virtue of its momentum alone."
14,A,"Like the first two films in this series, it feels complete in itself. But it also serves as a rousing finale to what will stand as a towering film achievement."
15,,The magnitude of what Jackson and everyone else involved in The Lord of the Rings have accomplished can't be overstated. It's the trilogy to rule them all.
16,A+,"As the lights come up at the end of The Return of the King some three hours and 20 minutes after it began, you are going to sit there in stunned silence with but one word on your lips: Wow."
17,A,"Jackson succumbs to several endings. But after sitting spellbound through three hours of adrenaline-pumping action and suspense, the prolonged resolutions feel like a welcome relief."
18,4/4,"It is the best of the bunch. More important, it's the best picture of the year."
19,3.5/4,"Your jaw drops at the massive and wild spectacle in front of you and your brain bursts with admiration for the craft and audacity of it. As for your heart, that's another matter."
20,A,"The Return of the King is the equal of its predecessors in visual marvels, yet surpasses both The Fellowship of the Ring and The Two Towers in pure storytelling."
21,,"The word epic is much overused in cinema, but with The Return of the King, Peter Jackson has created a true epic which is ultimately about the price of triumph."
22,4/4,"In an age of largely anonymous heroes, many wearing either military of civilian uniforms, The Return of the King vividly reminds us of the larger-than-life qualities we used to demand of our more public role models."
23,A-,"Jackson has covered more territory than anyone could have hoped for or imagined, and he has done so in a series of films that have raised the bar for moviemaking."
24,3/4,You need stamina for long droughts of tedium amid the explosions of enchantment. The movie is three and a half hours long. Mostly it moves. And when it's speeding ahead it does so with witty zest and a visual brilliance that sometimes overpowers.
25,4/4,"Director Peter Jackson, after six years of labor, has crowned the trilogy with a work of majesty and delight."
26,,"If anything, Return of the King makes the first two films in the trilogy even better, simply by giving them the proper ending they never used to have."
27,4/5,"Even if part three, The Return of the King, hasn't quite the satisfying thump one would like of a conclusion, Jackson's trilogy has ascended the summit of the Fantasy premiership from which the likes of Star Wars are a speck in the distance."
28,,"This is mighty, epic cinema and it should be allowed to flow on endlessly, like streams of molten lava from a spectacular volcano that erupted years before."
29,2/4,"Peter Jackson has once again given us an expansive spoof of bombastic, medieval fantasy adventures: the furrowed brows, the swords and sorcery, the creatures, the hair extensions. Oh, that's right, it’s not supposed to be silly."
30,4/5,"To Jackson's credit, Return of the King is not only a jaw-dropping feast for the eyes, but a coherent, rousing narrative that manages to bring emotional closure to the whole project."
31,5/5,"In its own way, it's as thrilling an adventure in storytelling on film as the quest it portrays."
32,,The multiple endings are earned and can go on as long as they like.
33,A,"The mere thought that we’ve seen the last of Frodo, Sam, Aragorn, Legolas, Gimli, Gandalf, Merry, Pippin and Gollum is almost too much. If we must say goodbye, though, it’s best to do it when all involved are at the top of their game."
34,10/10,"For all its titanic technical breakthroughs and iconic moments of spectacle, its thematic resonance and sweeping storytelling have helped maintain its legacy beyond similar blockbusters."
35,,The Lord of the Rings: Return of the King asks us to reckon with death and then heals that emotional wound by reminding us that death isn’t a tragedy but the final passage of life.
36,3/4,"Depictions of true friendship in movies are rare. Depictions of male friendship, even rarer. With The Lord of the Rings, audiences saw trust and affection develop between men brought together by a common purpose."
37,5/5,"It is a film of epic proportions, huge in scale and filled with moments of violence and emotion. But it is also an intimate and emotional experience, in which many viewers will end up shedding several tears. Full review in Spanish."
38,3/4,"The extendedversion of ""The Lord of the Rings: The Return of the King"" doesn't feel any longer than the film everybody saw at the multiplex. There's 50 extra minutes of never-before-seen footage added into the original theatrical release."
39,,Peter Jackson’s Lord of the Rings is one of the most astonishing achievements in the history of film. It is nothing short of magical.
40,4.5/5,"A glorious and satisfactory close to one of the best film trilogies of all time. Peter Jackson's third entry is his biggest in scope, and also his most emotional. For Frodo! [Full review in Spanish]"
41,,"... a blood and thunder finale that takes the viewer into a conflict of (quite literally) Middle-Earth shattering dimensions. If anything, Peter Jackson and his collaborators try to do too much with the final book of J.R.R. Tolkien’s fantasy trilogy."
42,8/10,"The massive scope of this climactic chapter is once again awe-inspiring, entailing exceptional use of computer graphics, prosthetics and makeup, costuming, and sets."
43,A+,For 2004 [the special effects] look great.
44,5/5,"Peter Jackson's place in cinematic history is cemented with The Return of the King and now Star Wars seems like a film made a long time ago in a galaxy far, far away."
45,,The Return of the King is really the heart of this cinematic masterpiece.
46,,"At a whopping, hilarious, 4.20 duration for the extended version, Return of the King is the Oscar-winning, magnum opus of the franchise."
47,,"This atavistic Christians-vs-Moors narrative doesn't belong in the present day, and that's no doubt why so many people are addicted to it: it's so ideologically overstated that it can easily be brushed off as harmlessly quaint escapism."
48,,"The sense of closure is exquisite, but I'm not sure I'm able to forgive Peter Jackson for the three years that he has taken to put it on the screen. The wait has been excruciating."
49,,"[It[ almost needs no review. If you liked, or disliked, either of the first two films, this one offers more of the same, with the emphasis on the ""more."""
50,2/5,"Director Peter Jackson has been all but deified for his work on this particular ring cycle, but there is not much personality behind the camera here, merely rampant enthusiasm."
