id,user_rating,review_title,review_text,author,date
1,9,"Six years later, it hits even harder.","I've always admired this film to a certain extent, but I think the thing that always kept me from loving it was that it never resonated with me emotionally. I would get attached while watching it, but all of those feelings would leave me fairly soon afterward. It had been about five years since I'd seen the film, and in that time I have grown up a lot, fallen in love, had my heart ripped to shreds and fallen back in love again and I think this growth personally has really opened me up to a place in my mind and heart to embrace this film more than most other screen romances that exist. Almost immediately it hit me harder than it had before and after a day since I watched it, the pain and heartache I experienced during it still remains at my core.It's a love film told non-traditionally, but not because it's two men, that doesn't even factor into the depiction of it. It's nontraditional because it's two people fighting against the love and it's accuracy in this is startling. How there are times where you can hate the person you love, hate so many things about them and hate that you are in love with them, but you can't give it up at all. You can't walk away from it because it's like an addiction and I think this film more than any before it captures that remarkably.A lot of this lies in the writing, but of course the performances from Heath Ledger and Jake Gyllenhaal certainly play a key factor in capturing it. Their characters take the love in different forms, Ennis fighting himself over it and Jack fighting the world because of it, but both actors capture exactly what they need to and bring this magnetism that really sparks. Gyllenhaal's openness is beautiful, his determination to make the love work and to just exist the way he wants to, he definitely provides the emotional anchor for the film and gives a heartbreaking portrayal.It's Ledger, of course, who steals the show though, with a kind of transcendent performance that we're treated to maybe once a decade. He becomes this character in such a vivid way that you don't even recognize the actor inside the role anymore. Gyllenhaal is Jack and hits the surface notes expertly, but you can still see Jake Gyllenhaal in there. Heath Ledger is completely gone and from the very beginning of the film we have Ennis and we have him until the very end. This character is an incredibly difficult one to take on, he could have easily been someone who was hard to like or sympathize with due to his internalizing and his refusal to fully embrace the relationship and who he is, but that's what makes it hit even harder, thanks to Ledger's brutal work.You see the pain in this person living a lie in every moment we have with him, with that turned in mouth and speech pattern that always sounds like it's hurting him to let anything out because he's afraid of how people are going to react. It's a performance unlike any other out there and in the end it's one that brings me to my knees. ""Jack, I swear,"" was always a line that floored me when I was watching it but now it's at a point where just thinking of the line and the way that Ledger delivers it brings some water to my eyes.",Rockwell_Cronenberg,N/A
2,9,The Finest Hour for Two Young Actors,"I have viewed Brokeback Mountain a total of three times on a 50 inch plasma. I spaced my views almost six months apart so I could grasp more completely and without prejudice, how I would rate this flick.It is beyond a doubt an American classic and looking back I regret so profoundly the death of Heath, who played Enis. The amount of acting skill and diversity it took to do such a touching and completely honest job, makes this young man, Heath Ledger, a legend.The scenes in the Brokeback were beautiful and allowed me to imagine somehow I was transformed back in time watch these young men.The truth is neither one of the characters was entirely gay, rather bisexual, but they did find each other as their own natural soul mates.Unfortunately cultural prejudice and homophobia prevented them from doing what Jack Twist had dreamed, ranching together on his father's spread.The final scenes are absolutely acted with such depth of character, the viewer is taken to tears. The Brokeback will not have Jack's ashes, since even in death, the culture denies him his final request, his ashes spread upon the Brokeback.Many of the bigots who have posted here on this fine cinema should be ashamed as they bray their ignorance for all to read.A fine film and probably one of the top love stories of all time in film.",mindcat,N/A
3,9,Surprisingly good,9/10Surprisingly goodSpoiler,groovygang118,N/A
4,10,I wish I had known how sad this movie was going to be.,10/10I wish I had known how sad this movie was going to be.Spoiler,fezziwiggs,N/A
5,10,A jewel of a film.,"I love this movie. Really love it. Haunting score, stunning cinematography, gripping performances, timeless tale--everything. People quibble about non-essentials. I'm female, middle-aged, hetero, and I defy you to tell me that the average straight guy is any more expressive than Ennis or any less needy than Jack. Or the average gal, either, straight or gay. Deeper than their sex, their sexuality, their religious, educational, economic or historic backgrounds, Jack and Ennis are two human beings living in the world as they find it--beautiful and indifferent at best, and as they find themselves--beautiful and flawed at best. Desire is desire. The desire for warmth, for connection, for any echo at all in the vastness of time and space, is shared by every human being ever to have lived. For me, the issue is not how repressed or thwarted Ennis and Jack are, but how persistently they turn toward the light, despite all impediment. Brokeback Mountain lyrically retells a story thousands of years old: loss and grief are unavoidable; love is where you find it.",magicmote,N/A
6,10,This movie broke my heart.,"For all of those who are holding back from watching this movie because it is ""gay"" or has love scenes between two men...oh! This movie has nothing to do with sex...and to be honest, I don't feel that it has much to do with homosexuality. This is the most beautiful and profoundly sad love story I have ever come across, and the fact that it is a love between two men is beside the point. It's about a love between two people who cannot be together, but if human beings were better at being human, and if the world was a better place, they would have lived out their lives side by side. I was so, so moved. AMAZING!!!! A must see.",aimeelee76,N/A
7,10,"An Everlasting Gift for those who ""get it"".","10/10An Everlasting Gift for those who ""get it"".Spoiler",whiteoutofthemoon,N/A
8,N/A,Should have won the Oscar (spoilers),Should have won the Oscar (spoilers)Spoiler,Ricky_Roma__,N/A
9,7,Not a publicity stunt,"There was a lot of talk about this film, a lot of publicity because of the gay interest in the script, and like always when there is too much talk, I don't pay for a seat because there are a lot of clever marketing scams around these days.It went away and then it was in my video store. I waited. Then it went on ""3 for a week for a fiver"" and I rented it. Ang Lee did a great job there, not only in shooting a difficult story, but also with exceptional photography (it looks like an ad for a cigarette brand, but I don't remember which) and brilliant acting and bringing us back to the US in the 1960s.The story itself, about a secret love affair, is dealt with cleverly, and with qualities in the script, in the performance, and without cheap and easy voyeurism, which in itself is admirable of Ang Lee. Heterosexual love is the subject of so many films that directors lack practise in treating homosexual love, and with the controversy around Brokeback Mountain managing to get through the minefield was not easy. I felt a bit that only one of the two cowboys was in love with the other - but this is an opinion only, but most importantly it seems to me that Brokeback Mountain deals also with the eternal topic of forbidden love, and in that way manages to send the gay aspect of this love to the background",csagne,N/A
10,10,The Heart Of The Matter,"I didn't believe for a moment that the film could live up to the hype, or to some of the comments posted here, some of them read like love letters to the film, to the director and the actors. Well, now, after seeing the film, I feel like writing a love letter myself. The film took over my senses and transported me. The tragedy that envelopes the lives of Ennis and Jack is caused by an ancestral ignorance that is part of our DNA and if you don't believe me read some of the hateful comments posted here alongside the love letters. That's the heart of the matter. After the summer in Brokeback Mountain, Ennis and Jack go their separate ways and Ennis hits a wall with his fists crying, trying to destroy his longing, self loathing, guilt, horror. Imagine in a world without ignorance and therefore without hatred, Ennis and Jack could have celebrated their love and attempt an honest life together. Imagine also if things were the other way and heterosexuals were the dark minority, imagine falling in love with a girl and having to keep it secret, never been able to tell or to show publicly your love for her. Men like Ennis, and there are many, have to curve their own emotions and conform, entering and developing unhappy marriages and why? Read some of the comments here and you'll understand why. There is one that condemns the movie and what the movie may do for his kid and his vision of cowboys without actually having seen the movie! That's the heart of the matter. I will go and see the film again tomorrow, if I can get tickets, I'm taking with me a group of people that hate the movie already without having seen it. I won a bet so they will have to. I'm taking them to diner later to talk. I intend to report the results if you let me. But for the time being let me tell you, ""Brokeback Mountain"" is an extraordinary film. Jake Gyllenhaal, Ann Hathaway and the magnificent Michelle Williams give superb performances but it's Heath Ledger's film. He gives us something that nobody could possibly have expected because what he gives us is not only, honest and moving and powerful but totally and utterly new.",marcosaguado,N/A
11,7,An opportunity to reflect on our own lives...whichever side of the fence,"Controversial on a number of levels, yet tame by a number of standards, this is a film that will reach its audience in different ways, depending on their own personal journey - whether gay or straight. How we receive this movie - and how we relate - is indicative of where we're at in our own lives - and this is what makes this film brilliant. We follow the story of Ennis Del Mar (Ledger) and Jack Twist (Gyllenhaal) who fall unexpectedly in love during a stint as a pair of sheep herders in Wyoming during the 1960's. What follows is the struggle to keep their desires hidden from a prejudiced society and the agony of remaining committed to their marriages while living double lives. There is a consistent undertone of melancholy throughout this film, from beginning to end, and some viewers will find this heavy. But this doesn't detract from the point conveyed by Ang Lee, its director. The impressive feature of this movie is the fact that every actor puts in a solid performance - in particular some of the ""peripheral"" actors - and this is quite rare in films where quite a number of the performers have very small roles. (Look at Anna Faris 'Lashawn Malone'; Kate Mara 'Alma Del Mar, Jr.', age 19; and Roberta Maxwell 'Jack's mother' for outstanding examples.) In terms of the main actors, Michelle Williams is outstanding, and Anne Hathaway almost steals the show! The only thing that seems to leave the film falling flat is the fact that there doesn't seem to be a positive resolution. Some will take this as an indication that gay men will end up facing tragedy and be confined to a life of loneliness. And we all might need to watch this with English subtitles, because for a majority of the film, we cannot understand what Heath Ledger's mumbled dialogue! This is incredibly disappointing - particularly considering that he delivers the very final line in the film and I am still unable to figure out what it is! (I'll have to get the DVD and throw on the subtitles!!) However, this film certainly does provoke an emotional response. And whether that response is one of anger, disgust, sadness, happiness, elation, denial, self-loathing, confusion, relief, empathy or curiosity, you are alive during those two hours. Highly recommended.",camrik505,N/A
12,10,Brokeback Mountain: a state of mind,"I am only 15, and i just recently saw this movie. I couldn't believe how good it was! After i saw it once, i had to see it again and again, and finally buy it on DVD. The characters in this movie are amazing. Brokeback Mountain isn't a made-up place, it is a state of mind that we all have in us. You just have to find it. It's not just a gay place in a gay movie,as some may want to think. It's a place of love that is not forbidden, and peace, all is equal, and happiness overflows. For those who haven't yet seen this movie, I highly recommend it. For those who have seen it, and loved it as much as i do, i recommend that we keep the story alive, and get others to do the same. I will always keep this movie close to my heart and it has changed me in such a way that i can not describe it. My mind is Brokeback Mountain, and I wish everyone could find that place in their mind, heart, and soul!",hipbabe_sgirl,N/A
13,6,Unexpectedly captivating,"Brokeback Mountain finally premiered in Rochester last night. Before I continue, I just want to say that before I walked into the theater, my conscience was saying not to go, because of my past view on homosexuality. My idea was that it was wrong and immoral.However, I still cleared my mind and gave myself the strength to pay attention. And I'm glad I did.'Cause I wasn't watching another gay-biased film. I wasn't even watching a new work that Ang Lee put out just to say he did something. No, I was watching an engaging, emotional, heart-felt romantic drama. Just with homosexual characters instead of the typical male-female romance.Heath Ledger as Ennis Del Mar deserves not only an Oscar nod, but a win as well. Jake Gyllenhaal was also good as Jack Twist.In the end, I learned that homosexuality should be tolerated, and that it's their own choice and no one else's.ACTING: 10 WRITING: 10 DIRECTION: 10 MUSIC: 10 OVERALL: 10",jacktreese1,N/A
14,5,More than a love story...,"""Brokeback Mountain"" is a Drama movie in which we watch the story of Ennis Del Mar and Jack Twist, two men who form a passionate and complex romantic relationship while working as cowboys in the remote mountains of Wyoming.I found this movie very interesting and beautiful with amazing interpretations of both Heath Ledger who played as Ennis and Jake Gyllenhaal who played as Jack. The chemistry between the two actors is palpable, making their emotional connection more powerful. The cinematography was also a standout, with sweeping shots of the Western landscape that mirrored the vast emotional distance between the characters. It's undeniably a beautiful and tragic story and it can feel emotionally overwhelming at times. In conclusion, I have to say that ""Brokeback Mountain"" is a beautifully crafted movie with exceptional interpretations and a powerful exploration of love and identity. I can understand that it couldn't be for everyone but I suggest you to give it a try because I am sure that it will amaze you.",Thanos_Alfie,N/A
15,10,Simply breathtaking,10/10Simply breathtakingSpoiler,pixie_jem,N/A
16,10,Hauntingly brilliant,10/10Hauntingly brilliantSpoiler,maddiekins,N/A
17,10,Haunts me still,10/10Haunts me stillSpoiler,noonoosis,N/A
18,10,Finally A Film Which Gets it Right,10/10Finally A Film Which Gets it RightSpoiler,nycritic,N/A
19,N/A,One perfect summer and a life of cruel compromises - heartbreaking,"This movie exceeded my already high expectations. It's exceptionally realised - the direction is superb and the acting is excellent. I was entranced by the story from the very outset. I empathised with the characters to the point of actual heartbreak. This is a film of such honesty; tackling a topic that is still a taboo in today's ""liberal"" society. How many movies have you seen that portray gay love in a sensitive, non-judgmental fashion? There are several moments when, even if you find it difficult to deal with the physical depiction of homosexual love (even though it's not at all graphic), viewers who value love won't be able to prevent themselves from empathising with the characters - Ennis' reaction when he has to leave Jack for the first time and when, during their argument at their last meeting, Ennis says something that is heartbreaking in its poignancy.These lovers - the open-hearted Jack and the silent, suffering Ennis - shared one perfect summer and much of the rest of their lives is a cruel compromise - simply because the world won't allow their love.Like all truly good movies, Brokeback Mountain stays with you long after the last image fades from the screen. It makes you question your preconceptions and hopefully makes you want to make the world a place where all people are free to love whom they want as they please.",sharondingle,N/A
20,7,Powerful Love Story,"I made it a point not to read any detailed summaries or reviews of this movie before going to view it. I am so glad I did. The scenery was breathtaking and almost surreal. The cast completed each other almost perfectly. Heath Ledger's performance will be discussed for years to come, as well as Jake Gyllenhaal's. You cannot leave from this work of art without being affected by it. This was a beautiful and extremely touching portrait of a love story between two people that I can only classify as universal. Go see it and form your own opinion; I think you will be profoundly surprised. I honestly feel this movie will change cinema as we know it.",tgantt,N/A
21,10,Love between two men? What the heck! They're two human beings,"Although some time has elapsed between my seeing this movie and today, I've decided to add a little comment just to show the producers, director,actors and writer, how marvelous it is to acknowledge that a certain change is taking place in this old world of ours.I'm a 69 year old grandpa who has always taken a stand against any sort of discrimination. In this case and naturally not by accident, it's about homosexuality.People love nature but they seldom respect human nature. Love is for everyone and not only for those that are socially considered ""politically correct"". Heath Ledger and Jake Gyllenhaal have shown the world that stereotypes have nothing to do with honesty, affection,tenderness and true sorrow. Beautiful, unforgettable performances which have enriched all the viewers' craving to be loved, accepted and regarded as first class citizens. Congratulations.",arthur-saboia,N/A
22,7,good movie ! I like it,"I think this movie is very interesting and exciting.It talks about two men work together.I think gay couple can be accepted because love is free.Although this movie is not accepted by Christians because gay couple is not accepted in the Bible but many people are very interested in this movie. Boy or girl is not a big problem,the most important is your choice. I think we should not care about how other people feel about you because of being gay couple.I think they should not give up. But they should tell their family about that.I think this is the best movie that I haven't seen before and I think I have learnt a lot of things from watching this movie. I like it so much !",gapwong1679,N/A
23,10,Brokeback Mountain,"Finally got to watch the 'Brokeback Mountain' movie on DVD, and I have found it to be one of the most inspiring love stories - especially gay love stories. I have already watched it two times and plan to watch it some more! Heath and Jake did a very great job portraying these characters of Ennis and Jack. I strongly encourage that everyone watch the movie, and I hope that it will help whoever looks down on gay love relationship realize that there are many different kinds of love for everyone in all aspects. Gay love relationship should not be considered as a taboo, but as a pure love beyond imagination. The movie made me think of how gay life must be like in the early 1960's and how it has changed in the last 40 years. More and more societies are starting to accept gay love relationship, and I am sure this movie will make everyone think. Ang Lee did a superb job making this movie, and I hope he and other directors will make more movies like this one in the years to come.",adbabin,N/A
24,6,"Good, but nothing above that.","6/10Good, but nothing above that.Spoiler",moviedude-72,N/A
25,10,Why did I wait for so long to see it?,10/10Why did I wait for so long to see it?Spoiler,diaghilev-1,N/A
