id,user_rating,review_title,review_text,author,date
26,10,The Best of 2005,"Ang Lee's devastatingly beautiful ""Brokeback Mountain"" is a magnificent achievement. Early in production, the film was dubbed ""the gay cowboy movie."" The term is a tragic simplification of what is actually an exquisite love story, gay or straight. ""Brokeback"" is quickly shedding its nickname and breaking down barriers as more and more people actually see it and succumb to its beauty and heartache.The film is small in budget, but epic in scale and vision. It begins in Wyoming in 1963. Nineteen-year-olds Ennis Del Mar (Heath Ledger) and Jack Twist (Jake Gyllenhaal) have been assigned a flock of sheep to guard on Brokeback Mountain. Ennis is a taciturn ranch hand who in one conversation with Jack says more than he has in an entire year. Jack, a part-time bull rider, is the more extroverted of the two. They make an unlikely pair, but Lee handles the developing relationship with great tact so as to make sure it is believable.One night, after a long evening of drinking, Jack and Ennis surprise themselves by having sex. The scene is an awkward experience not only for the characters, but for the audience watching them as well. Had the sex been between a man and a woman, the scene might not have been given a second thought. The fact that it breaks from tradition, presenting a so-called ""forbidden love"" unabashedly up-close and intimate, is part of what makes the film such a cinematic landmark. ""This is a one shot thing we got going' here,"" says Ennis the next day. ""You know I ain't no queer."" ""Me neither,"" replies Jack. Quite the opposite is true, however. That fateful night on the mountainside sets into motion a tumultuous romance that will span two decades.After their summer on Brokeback, both men eventually marry and have children. Ennis finds a loving and devoted wife in Alma (Michelle Williams). Jack meets a real live-wire in Lureen (Anne Hathaway), whose father owns an expensive farm equipment business in Texas. One day a postcard arrives for Ennis postmarked Jack Twist. It is the first word he has heard from him in over four years. The two reunite in a tryst of wild passion, and are once again caught up in what they thought they had left behind on Brokeback Mountain.As the years pass, Ennis and Jack meet only for the occasional ""fishing trip."" During one of these trips, Jack suggests he and Ennis buy a ranch together somewhere in the country. Ennis dismisses the idea as a fantasy. ""Bottom line is, we're around each other and this thing grabs hold of us, at the wrong place, at the wrong time, and we're dead."" Ennis recounts a childhood memory of a man who was tortured and killed because he lived with another man. His father made sure he saw the body.The rest of the story I will not reveal because some events are better left to be experienced in the theater where their power can be fully absorbed and appreciated.""Brokeback Mountain"" would not work half as well as it does if it were not for the multitude of fine performances throughout. The women are uniformly excellent. Michelle Williams, a long way from her days on ""Dawson's Creek,"" gives a performance of somber perfection. One scene in particular in which she confronts Ennis about his fishing trips is almost enough to guarantee her a nomination come Oscar time. Anne Hathaway, best known from Disney's ""The Princess Diaries"" films, shines as well. The extremely talented but often overlooked Randy Quaid, Linda Cardellini, and Anna Farris each have brief but memorable roles that, despite their brevity, are integral parts of the story. Jake Gyllenhaal caps off a great year with his superbly nuanced performance as Jack, a doe-eyed optimist who grows tired of only being able to see Ennis two or three times a year. As Ennis, Heath Ledger delivers the performance of a lifetime. Ennis is a man of few words, but when he does speak, it is as if the words are literally punching to get out. Ledger proves that sometimes less is more as he uses his body to express things that words alone never could. Ledger is, in a word, brilliant.Screenwriters Larry McMurtry and Diana Ossana deserve recognition for adapting the eleven-page short story by Annie Proulx into a two-and-a-quarter hour film. Dialogue in the film is sparse, but it only serves to make each word uttered that much more important. When Ennis says, ""If you can't fix it, you've got to stand it,"" our hearts break because we know there is nothing that should need to be fixed.In addition to being one of the most compellingly acted and written films of the year, ""Brokeback Mountain"" is the most stunningly photographed. The tagline, ""love is a force of nature,"" fits it perfectly. Ang Lee and cinematographer Rodrigo Prieto use every opportunity they have to connect the power and beauty of nature (lakes, streams, clouds, rain, snow, hail, thunder, etc.) to the most raw and complex of human emotions. Brokeback Mountain itself is a symbol of freedom for Jack and Ennis. It is the only place they can go to truly love, and be loved, with no restraints.""Brokeback Mountain"" is a film of limitless possibilities. Its true power lies within its ability to linger and haunt long after the final credits have rolled. It forces us, as any good film should, to ask questions, questions about the world and ourselves. As I sat and watched ""Brokeback"" I couldn't help but wonder what life might have been like for Ennis and Jack had they found each other today. Would their fates be any different? I would like to think so.",Dcap4188,N/A
27,10,Overwhelming and an absolute must see.,10/10Overwhelming and an absolute must see.Spoiler,matt-2044,N/A
28,10,Life Changing,10/10Life ChangingSpoiler,bardgirll,N/A
29,N/A,I attempt from love's sickness to fly in vain,I attempt from love's sickness to fly in vainSpoiler,harry_tk_yung,N/A
30,7,Good movie.,"Good movie. Enjoyed it. I really liked the scenery. I really liked the costumes. I really liked the vehicles. I really liked the animals. I really liked the loving. I really liked the laughing. I really liked the fighting. I really liked the spitting. Curious to see where a sequel would take our 'hero'. Heath and Jake have always been favorite actors of mine. I understand they are really good friends, so I expect we will see them in future movies together. If you haven't already, definitely check out Donny Darko. One of my absolute favorites. Jake is awesome! And who couldn't love Heath in a 'Knights Tale'. Anyway, I got off track here. Brokeback is very good. I only gave it a 7 because I felt it could have been shorter and they could have gone into the impact this had on their marriages a little more.",procyon242,N/A
31,10,Two Men In Love at the Venice Film Festival,"It was a real ordeal to get into the screening. The anticipation was palpable. The film arrived surrounded by a plethora of innuendo. ""A gay western"" ""Heath and Jake's hot scenes"" As soon as the film started every imaginable preconception flew out of the auditorium. This is a remarkable, moving and powerful love story. The setting is that of a modern western ""The Last Picture Show"" comes to mind. Ang Lee's attention to detail verges on science fiction. You can actually smell the place. Extraordinary. I'm not going to reveal anything about the story - Gian Luigi Rondi a legendary Italian film critic, revealed the ending to a television audience, what was he thinking?! - The film will be enjoyed much more allowing the story to unfold without having passages underlined and attention drawn to this or that particular. I felt compelled to write this comment because I'm overwhelmed. It has changed my perception, I must confess, about certain aspect of same sex love because I didn't think of same sex when I was watching it, I saw two human beings (amazing performances by both actors)I have the feeling ""Brokeback Mountain"" will make history, deservedly so.",bethlambert117,N/A
32,7,A slow-burner that lingers long in the mind,"The first mainstream gay western (Warhol's 'Lonesome Cowboys' can only be described as niche or cult), 'Brokeback Mountain' was the surprise hit of 2005, another triumph for the talented director Ang Lee (who also gave us such diverse films as The Ice Storm, Sense and Sensibility, and Crouching Tiger Hidden Dragon).Ennis (Heath Ledger) and Jack (Jake Gyllenhaal) are the cowboys who start working together and find an intense sexual attraction which will continue to burn for twenty years. The film covers those two decades as we watch the idealistic Jack, who dreams of acceptance and a life with Ennis out on the ranch, and the tormented, disturbed Ennis (who remembers gay cowboys being murdered in his youth), who can't connect with anyone and anything other than his lonely soul.Extremely slow in pace, and all the better for it in an age of fast, rushed films for the MTV generation, 'Brokeback Mountain' is a love story just as valid as any other. For a mainstream movie to even address some of the issues looked at here is amazing, and the film benefits from sensitive direction, low-key romantic scenes, and total commitment from the leading actors. Gyllenhaal is better than he was in 'Donnie Darko', but he is overshadowed by Ledger, who shows here what a fantastic actor he was. It is a tragedy that his early death has robbed us from seeing this talent grow. Here in this film he resembles a young James Dean in 'Giant', playing older than his age with ease.Not an easy film to watch, then, but it repays close study and patience, and some of its lines and images will stay with you for a long time after the credits roll. Proof that intelligent cinema can still survive in the age of blockbuster action flicks.",didi-5,N/A
33,10,My Feelings about Brokeback Mountain,"I had no idea what to expect when I saw this film. I had seen the media hype and heard the jokes yet never read the short story it's based upon. What I saw was a movie that had a universal message, a film so powerful that it rips you to bits. The story is terribly sad and bleak and I use the word heartbreak in it's original sense because it does just that: it breaks your heart. Yet its' beauty and simplicity are breathtaking, this film will be ranked as one of the greatest movies ever made. Heath Ledger and Jake Gyllenhaal deserve their nominations, they are brilliant. The film deserves to win Best Picture, as a matter of fact it deserves to win every award it has been nominated for and THAT is something which can rarely be said of ANY film! There is no downside at all to BBM, Ang Lee has created something which will stand the test of time and become a great classic. It is the only film I have ever seen where the entire audience--men, women, gay, straight, young, old--left the theater with their mouths open, and yes, it's effect IS that powerful. I can't recommend it highly enough; I intend to see it again in the theater and buy the DVD in April. Absolutely fantastic.",rememberinbobby,N/A
34,6,Lots Of Emotion And Depression,6/10Lots Of Emotion And DepressionSpoiler,kylehodgdon,N/A
35,10,Too stunned to cry,"After all the hype, i was finally persuaded to see this film. I was prepared for a ""good"" film. What I experienced was overwhelming. The sights, sounds and emotions cascading in front of me caught me totally off guard. I have never been in a theatre full of people where no one would even chew popcorn! The moment that sticks in my mind most is at the end where Ennis is standing at the closet with the two shirts, which he has switched and placed his on the outside, and then does up one last button, lovingly strokes the shirts and then says, ""I swear, Jack."" Those three words seem to hold all the anger, frustration, longing and love that Ennis has gone through in his journey with Jack.I was too stunned to cry.",pec1653,N/A
36,10,Accepting people for who they are,"I watched Brokeback Mountain for the first time 2 weeks ago. Someone gave me a copy about 2 years ago but could not bring myself to watch it. But being Australian I wanted to see Heath Ledger and also have seen a few movies with Jake Gyllenhall who I think is also a great actor.I have read people's comments about how its a beautiful love story and so on, but for me it was all that but more important it was an education about accepting people for who they are and not judge them for their preferances in life. Before Brokeback Mountain I would cringe at 2 guys kissing or even holding hands now I see it as 2 people being in love and that is because of the great performances by Heath Ledger and Jake Gyllenhall.I thank them both for making this great film so believable that has touched me so deeply.",maria-tzintzis,N/A
37,10,movie that may make you weep with grief...,"I thought, when I 1st saw this movie, that this movie is about a sweeping love story between 2 men over a long period of time...the struggles & conflicts they faced (from society & within themselves)...men who could only love each other openly when they were alone together out in the middle of breathtaking nature (with nature symbolizing unlimited freedom from expectations & freedom to explore love openly)... Brokeback Mountain is really not about those issues at all...this movie is about one man's intense loneliness...a man who doomed himself to a lifetime of loneliness despite the love that was given to him... this movie is near perfect... Jake Gyllenhaal was magnificent... I can't get my head around Heath Ledger's absolutely stunning performance...he almost stole the movie...I hope with this movie he never has to act in another empty & shallow movie ever again... I knew some cowboys...Heath was exactly like them...in mannerisms...the way he walked & kinda slouched over...he lived that part...and when his character (Ennis Del Mar) was allowed to be human for a moment instead of a strong & silent cowboy Ledger was achingly real in showing the vulnerability of that character... if this movie doesn't make you weep after an ending that will haunt you forever then nothing can possibly make you cry...",maryhelene90210,N/A
38,10,Why did Heath not win the BAFTA?,10/10Why did Heath not win the BAFTA?Spoiler,Alabama437,N/A
39,N/A,universal love,"I think this movie is universally appealing because it's about an all encompassing love--the love a parent gives and a child needs, the love between partners. It's the love of family these two boys never got until Brokeback Mountain. It's a mutual understanding and empathy they provided for one another. These were just kids who up until Brokeback Mountain, were pretty disposable. They blossomed up there just like all the other living things around them during the summer season. What a perfect setting to deliver that message. This movie was achingly beautiful, poignant. It left me wanting more. It was hard to leave the theater and say good-bye.",ann-hughes,N/A
40,7,A Piece of American Western Heritage which happens to be Gay,7/10A Piece of American Western Heritage which happens to be GaySpoiler,Mitch-38,N/A
41,10,Finally!,"I finally got to see this movie! Had definite plans to travel out-of-town this weekend with hubby to see it, because I didn't think it would ever make it to our little conservative city in Central Illinois, but one of the local theaters finally got it.It was quite delicious, though it left me aching for more between the guys. Granted, there was not room for a lot of tenderness, because the passion was so bottled up, when it got out it often bordered on violence. My favorite scene(s) were two cuddlesone from love and one from passion and frustration (2nd night in the tent, and the clinch during their last meeting at Brokeback).I don't think Jack understood the depth of Ennis' love for him, and the suffering it caused him to resist that lovethough Ennis did everything he could to hide it (including from himself).The women were great. If only Alma could have leveled with Ennis right after she saw him kissing Jack, it might have spared everybody some heartachebut she was just as trapped by ignorance as he wasnot to mention, she loved him and was devastated to find out that he did not feel for her what she felt for him. And more trapped from a cultural standpoint, being a woman in a time when women had very little power.What did Ennis mean, at the very end of the movie, what he said, ""I swear""? I have my idea; I'd like to hear yours. Nice touch that Ennis' light-colored plaid shirt, which was originally inside Jack's denim, showed up in Ennis' ""closet"" on the outside. Not a continuity error, trust me.Did Jack's parents know the score? I say mom definitely did and was pretty sympathetic to the situation. Not sure about dad (though he was not nearly so sympathetic, in any case).I was amused/touched/ vindicated(?) by the amount of surreptitious crying going on in the theater. Granted, mostly women. There was such a load of tissues on the theater floor (and you hardly ever see tissues). I used several, too, but stuffed 'em in my purse.I cried, but I was not disappointed. The movie was very depressing in its depiction of poverty and intolerance, but it salvaged what is really important, and to me ultimately proved to be satisfying. Though love was not triumphant, it was true in, and to, the end.If Ennis could live his life over, he would do it differently. He knows what he has lost, and has learned from the experience, paradoxically proving this by deciding to be present at the wedding of a daughter he lovesand damn the torpedoes. Would that he could have done the same for Jack, while there was still time! I am getting the book, for sure, because I could not catch some of the dialog. Will need to see the movie in the theater again, tooand get the DVD.For the woman who said she wondered if she was weird because two men being loving turned her on, let me say, ""If you are weird, you have lots of company!"" I have been a fan of male/male relationships for 25 years, since the advent of ""slash"" fiction in media fandom (which I believe started with the classic Star Trek and K/S). For me, it is not mainly the sex (though that is by no means excluded!); it is the love and resulting vulnerability.And for you guys who might be thinking, ""Crap, my wife wants to see this thing, but why do I want to watch two guys making goo-goo eyes at each other?"" If for no other reason, because you are about 100% likely to ""get some"" afterwards. Love is love is love--and women like to watch it. I am off to grab hubby, and lead him into the bedroom. Wanna show him how great it feels to be able to love the person you love, without societal recrimination! LJS",normalcpl,N/A
42,7,It wears it's heart up it's sleeve.,7/10It wears it's heart up it's sleeve.Spoiler,ikanboy,N/A
43,10,A masterpiece...,"This was a divine movie! It was just perfect, it was great! Ang Lee deals really skilfully with the fragile theme of homosexuality giving us one of the most moving pictures ever... The marvelous, heart-breaking Annie Proulx story is so tastefully adapted to the screen that it totally enchants you... Heath Ledger and Jake Gyllenhaal were performing in such a spectacular way that really surprised me, with Gyllenhaal giving the best performance for the year 2005 combining love, tenderness and lust, and Ledger giving the best performance of his career creating one of the most tragic figures of cinema... This movie was nothing more than an hymn to pure love, a haunting movie that breaks your heart with its unaffectedly moving ending... and of course one of the biggest Oscar fiascoes ever...",dimitrisjb,N/A
44,7,ONE-OF-A-KIND,"A true cinematic masterpiece. Ang Lee's directing was on-point. The score and the editing was great, too.",jeromesgabilo,N/A
45,4,Grossly over-rated ....,"Grossly over-rated ... but PR is PR. Certainly the gay and artsy communities are happy to see the film made for the groundbreaking it does - but groundbreaking does not equal good film-making.The plot is relatively predictable - think back to Alan Alda and Ellen Burstyn in ""Same Time, Next Year"". Two lovers meet on a regular basis for a number of years while living separate lives the rest of the time. Big deal, this time the two lovers are gay cowboys. Yes, it was a love story - but a poorly done love story that drags on and on and on - then abruptly falls off a cliff and ends too quickly.The acting starts off mediocre and doesn't get much better. Randy Quaid was OK in ""Category 6: Day of Destruction"" (TV) but hasn't had a really decent part since ""Hard Rain"". This was a big step backwards. Jake Gyllenhaal is weak (though the ladies seem to drool a lot when he is around) and heartthrob Heath Ledger plays below his capabilities.If you can ignore the less than stellar acting and look at the scenery, the location in the Canadian Rockies is absolutely spectacular and the cinematography is incredible. Also nice to see Linda Cardellini from ER with a minor part which she handled well - look forward to seeing more of her on the big screen. Look for good things in the future from Kate Mara.I can only suggest the movie's reception was largely a product of all the hype - but as they say in Texas, this one is all hat and no cattle!",Redbreast777,N/A
46,10,"Brokeback got us good, don't it? - Jack Twist","10/10Brokeback got us good, don't it? - Jack TwistSpoiler",Sheyne,N/A
47,10,Brilliant,"Simply one of the most moving films of all time its brilliance lies in its subtle performances awesome performances all round and amazing direction with a great score....simply an amazing movie experience. Heath Ledger soars in the role of his career and both Jake and Michelle Williams turn in power house performances. Ignore all the hype and just soak yourself up in the emotion of it s brilliance. Think Bridges of Madison country with 2 men and Ur halfway there. The setting , up in the mountains where only they can exist together strikes all the right cords, it was a lover that you see in Jacks eyes he so desperately want s Ennis 2 give himself but because of the time he couldn't and the end leaves u devasted",garyalford54,N/A
48,10,changed my life big time,never go out to movies. a gal pal finally convinced me after two bottle of wine. we went to see brokeback mountain...still in shock after a year. its the movie of my life...i had so proudly we hail in 1943....schindlers list...and now broke. didn't want to show emotions in the theatre so i held back. the story wow and please don't call it a gay film...its a forbidden love film...that i dreamt someday would be written. not to many sex scenes...great. the acting...heath ledger mumbles but we understand and his facial expressions are meaningful..the scene where he crumbles on his knees when jack admonishes him...sublime. and jake gyllenhaal...so fresh yet so deserving to be happy. anne..michelle etc..top notch. the music..grabs you forever...the scenery....so cool and relaxing. thank you mr. lee for a movie that changed my life. i just cant quit you anymore. excuse my writing i am french. bye rick del mar...incidentally i did bawl when i got home.....that shirt scene....omg,rick-179,N/A
49,10,a rite of passage for characters and a viewer,"""Words get in a way of communication"", said Exupery in Little Prince. This is how I feel about the film: it is indescribable, it has to be felt. If you get to this review, you probably know what the film is about, but to feel it through is worth much more, so watch it and judge for yourself. We are taken through many different emotions: joy, longing, anger, confusion, despair, and regret are among many. And most people can relate to at least a few of those, no matter what age, gender, race, sex orientation, religion or political views they hold. Here is the impact the film had on me: interestingly, the first night I watched it (at home on DVD) I thought it was a well-made tragic story with superb acting, and so on, I did not cry, I went to sleep... Woke up next day unable to concentrate on anything else, as it was slowly sinking in deeper and deeper, to the core of my humanity. By the daytime I was devastated, replaying parts of it and thinking about my own life and only a handful moments of raw emotions (blissful and aching) that I experienced, emotions unmixed with its' ""yang"" of rationality and logic. Emotions that shake you and take you on a rite of passage, and after you are not the same again. The next night I got up at 2am and saw it again, this time crying over tragedies of human existence (imagine a story being told from Ennis's wife's point of view, or daughter, etc.); and thats the whole thing: it's not a good guys vs. bad guys type of film; If only life was that simple!.. This film became personal. And in fact, I am reluctant of recommending it to my husband, friends, and family, since I know that either negative comments or indifference on their part might shatter my image of THEM. Thank you, cast and crew for this rite of passage.",xdreamfly,N/A
50,N/A,My Take on Jack's Death and other thoughts,My Take on Jack's Death and other thoughtsSpoiler,Olddad,N/A
