id,user_rating,review_title,review_text,author,date
19,10,One of the BEST war movies ever,"If you've never seen this movie then beg, borrow or steal a copy. It'll actually make you admire/feel sympathy for the German Serviceman caught up, in what was the most horrific of wars. Tense, realistic and gripping this one off has yet to be bettered in my opinion. The start doesn't really remind you of a war movie but believe me thats armed forces behaviour all right. As WW2 progressed Hitler drew on ever younger recruits and the historical accuracies are in abundance for a change. This film makes modern junk like the new Pearl harbour look limp wristed.As shocking as the statistics are (30000 out of 40000 never returned) It makes you wonder why so many young men volunteered for the Untersee boot 'Kreigsmarine'. Pride and patriotism counts for everything. Its a 10 out of 10 for me.Don't take my word for it. Watch it.",bigkeeko,N/A
20,10,"Packing, genuinely, overwhelming!","Using the term 'authenticity' in connection with any kind of art is rather difficult and daring as well. Sometimes it looks posed or is by certain purposes manipulated. Referring to Petersen´s ""Das Boot"" however, I consider it justified to call it authentic and true. I think this statement can be strengthened mainly by the fact that Lothar Gunther Buchheim was consulted. He composed the novel this breathtaking movie bases on and he himself was employed as a war correspondent in the Second World War.The entire plot has no weak points. Starting at ""Bar Royal"" at the very night before the forces living journey of the submarine crew begins, the director fittingly manages to confront the audience with the protagonists and their way of dealing with the pounding uncertainty. Once put to sea, the character of the scenes changes abruptly. Every member of the crew and the audience as well comes into very close contact with the tightness of the action space. At this point it is necessary to underline the excellent work of the cameramen. The fast and partial hectic cuts draw an exact picture of the drama on board. Too do not forget the outstanding lighting. However besides this abundance of obvious suspense, there are also a number of moments going into in-depth psychology and thoughtfulness. To outline only a few of them: At ""Bar Royal"", when the chief engineer reflects about the uncertain fate of his family, or when the captain, with a kind of 'Weltschmerz' in his eyes, is astound and proud of the unbelievable efforts of the crew. It would probably be too laborious to refer to the decisive symbols the director uses, therefore I recommend this movie to everybody, especially those who are interested in the Second World War.It presumably sounds pretty weird, yet I suppose that mankind gladly participates on the misfortune of others, without being closely involved with it. This closing notion may account for the huge success of this movie.>",tammolotz,N/A
21,10,Listen up Hollywood - this is how its done,"What can be said about this epic that has not already been said? Peterson has created the grittiest, most realistic war drama ever. It knocks hollywood epics like Saving Private Ryan on their sorry overproduced, oversentimental behinds, it torpedoes other submarine films before they have a chance to shout ""dive!, dive!, dive!"".I first saw this in its original form as a miniseries with english subtitles, and if you can find this version then this should be your first port of call, although the Director's cut I now own is also top notch and doesn't miss much from the series.where to begin? The lurking claustrophobia, the dark humour, the gritty reality of the piece. The excellent acting, the perfect timing, the garotte of suspense tightened with every passing minute in much of the undersea scenes. The lack of any known ""star"" who you know will just save the day and live to tell the tale. The historical accuracy and attention to detail. The lack of a demonised ""other"" figure for the enemy. The lack of any kind of preachy message in the finale other than ""War is Hell"". It has everything you could ask of a TV series or film about the era. 10 out of 10.",everyones-a-critic,N/A
22,6,It's fine,"If you're looking for a realistic submarine movie, this is as close as you're going to get. However, anyone who ranks this as a 10/10 has clearly not seen many movies. The Hunt for Red October is far less realistic, but it's a much better submarine movie and has far more replay value. At least an hour could have been cut from this movie and nothing would have been lost. It's fine, but after seeing it, I have no desire to see it again and I'm only going to give movies 10/10 if I'm willing to watch them again and again.It should also be noted that you'll have to watch subtitles, but most of the dialog is slow so even the slowest readers will be able to follow along without a problem.",ClassicRockFan1,N/A
23,10,German Masterpiece,"In October 1941, the German Capt.-Lt. Henrich Lehmann-Willenbrock (Jürgen Prochnow) of the U-96 U-Boat receives the war correspondent Lt. Werner (Herbert Grönemeyer) to cover the work in the submarine during their mission in the Atlantic Ocean. They sail out of the shipyard La Rochelle and along the next weeks, Werner learns the lives, loves, fear and behavior of the young crew, the veteran Captain and his officers. The skilled captain hunts British vessels to sink and dives to depths below the limit of the boat to escape from the destroyers. Near Christmas, they plan to return to La Rochelle; but out of the blue, Captain Henrich receives an order to cross the Strait of Gibraltar to go to Italy. But the captain knows how protected the area is and plans a means to lure the British Navy. Will the U-96 succeed in crossing the Strait of Gibraltar?""Das Boot"" is a German masterpiece by Wolfgang Petersen with 2h 29 min. The ""Superbit"" director's cut on DVD with one additional hour is a supreme masterpiece of a war (or anti-war) film. It is impressive how a 3h 29 min film is never boring, keeping the viewer on the edge of his or her seat until the very ending. The claustrophobic and tense story increases the drama and the character development in this version, becoming one of the best movies in the cinema history. The German captain, officers and crew are not shown as one-dimension character or sad killing machine like in many war films, but as human beings with families and friends, very efficient in their works but with fear and other feelings. My vote is ten.Title (Brazil): ""O Barco: Inferno no Mar"" (""The Boat: Hell in the Sea"")",claudio_carvalho,N/A
24,6,Claustrophobic,"There have been many good films examining the useless and barbaric reality of war.  For Cannon Fodder 101 I recommend Stanley Kubrick's Paths of Glory and Full Metal Jacket, as well as The Thin Red Line, Gallipoli, the first 30 minutes of Saving Private Ryan, as well as the epic television series by Ken Burns on the American Civil War and the BBC series on The Great War.  Add Dr Strangelove for some light relief.Having just seen Das Boot in 2001 on DVD, I'm very pleased to add it to the list.  What makes this a very good film is: * The depiction of warfare as composing of long periods of boredom and anxiety followed by short bursts of terrifying action.  The Thin Red Line presented similar imagery. * Its reluctance to show people as heroes.  The U-boat crew were well disciplined professionals rather than the individualist risk takers who are so boringly strutted out by Hollywood studios (refer Saving Private Ryan). * Evocation of the claustrophobic world of the submarine which those ""up periscope"" movies of my youth never captured.  [I once started to tour a sub. in Sydney Harbour and just couldn't handle the claustrophobic conditions]. * Attention to the fact that war is a time of rapid technological change. The U-boat war was being lost because the British has developed technologies to better track and destroy them.The film worked well with senses.  I felt I could almost smell the stench of men living in such close proximity; could appreciate the slow asphyxiation of men stalled on the bottom of the sea; the cold wetness of the North Atlantic; the amplification of sound under water; and the limitation of vision from a submarine; the pressure of water on metal at untested depths.It was also good to see Germans as Germans, rather than Nazis.That said I found the ending disappointing (I saw the Director's cut). The final two events stretched credulity. However I understand the book is based on true events.  Perhaps this is a case of truth being stranger than fiction.I read somewhere that 75% of the U-boat men never returned.  This movie shows why.",neilpollock,N/A
25,5,Extraordinary. One of the best submarine movies ever made.,5/10Extraordinary. One of the best submarine movies ever made.Spoiler,michaelRokeefe,N/A
26,10,One of My Top 5 Movies EVER,"I come from a family of submariners. My grandfather commanded a sub in the Pacific during WW2, and my dad went on to do nearly 30 years as crew and finally skipper in a nuke hunter/killer. So I kinda know the history of subs 1st hand. This movie pulls no punches and is stunningly accurate. It is a work of genius from one of the greatest directors of our time.I must qualify that by saying PLEASE don't watch the dubbed English version. This film has to be seen in German with subtitles, and you absolutely have to see the director's cut. Three and a half hours of laughter, terror, claustrophobia, tenderness, and finally a sense of the futility of war. It's just brilliant.Jürgen Prochnow has made some good films in his career, but he will never better this performance. He is the epitome of a sub captain. Steely, yet sensitive to his crew. Determined and sometimes rash, but always in control, and the love of his crew for him is clear throughout. Even I would follow him until the end!!I kinda feel bad about praising Jürgen Prochnow so highly because, seriously, this is one of the few movies I've seen where EVERY member of the cast is just perfect. All credit to the casting people. You would not change anyone. Bernd Tauber as the Chief is just awesome. Erwin Leder as Johann is just so right, and Herbert Grönemeyer as the raw reporter who grows up is amazing.This film should be up there with the greatest war movies of all time. Unfortunately, I think because it's told from the German side, it will never get the recognition it truly deserves. Very sad, as it never glorifies Nazism. It's simply a tale of ordinary people in extraordinary circumstances - which kinda sums up all wars.Incredible film from an incredible director.",romac-2,N/A
27,10,See the original 6 part epic rather than the film,"10/10.8/10 for the cut version.This is a superior war film, and I don't want to add to the reviews praising it. It's one of those films that will make you watch if only you can spare the ten minutes it takes for it to grip you.Being British, I thought it impossible to feel sorry for the U-boat crews, especially after what they did to us - but this film forces you to realise that we are all fragile and emotional (despite what Hitler says).I would recommend people watch the mini-s rather than the film (i.e. German subtitled version) to get the full flavor.As a side note, my grandfather (twice decorated destroyer captain) burst in to tears watching this at two points: One was at Gibralta, the other on the straights :| Says a lot.",Rick_Terminal,N/A
28,9,Review Of The Director's Cut,9/10Review Of The Director's CutSpoiler,Theo Robertson,N/A
29,10,The best WWII movie ever!!!,10/10The best WWII movie ever!!!Spoiler,ytsejamer05,N/A
30,10,Quite possibly the greatest war movie ever made,"Astounding piece of cinema, presenting the horrors of war in a particular powerful way. Amazing use of colour and tone. Unlike other films in this genre, there is a real sense of humanity. Might well be the greatest film I'll only be able to watch once.",Ruskington,N/A
31,10,"""Now it all turns psychological, gentlemen.""","10/10""Now it all turns psychological, gentlemen.""Spoiler",classicsoncall,N/A
32,N/A,"You have to have good men. Good men, all of them.","If I had the time to take this movie door-to-door and sit down with everyone in America to watch this film, I would. Everyone needs to realize that I have a fascination with submarine films. I loved The Hunt for Red October and Crimson Tide. Both of them rank as my top action films. I don't know why I love this genre so much. I think it has to do somewhat with my passion for sci-fi. The ocean is almost like fighting in another world. So many times we have seen wars play out on land, and while there is only so much you can show with a land fight, the war field on the open sea allows for so much more creativity.Director Wolfgang Peterson gives us some great characters. While not much dialogue happens in this film, you can see everyone's expressions on their faces, and those expressions tell better stories than words. You can see their fear, their excitement, their sadness, and their power by just the way that Peterson directs them. With his direction, I felt that I was on this U-Boat with the crew. Peterson perfectly portrays a feeling of crampness and claustrophobia wrapped together as one. I think that during one of the bombing scenes I broke a sweat because of what was happening on screen.Finally, I am also a fan of films that tell a different angle on the story. So many years I have watched war movie after war movie that show the victorious American's beating the classic ""evil-doers"". Now don't get me wrong, these are fun sometimes, but I love to see a different angle. In history class we didn't learn about the casualties of the Germans in WWII. We learn about them as a statistic, and never put these heroes on a human level. This film humanizes the German's conditions during the war. The Germans are human being also, who fought for their country just as valiantly as our soldiers did during WWII. They had families, they had pasts, they had homes that they left to become a part of history. To fight for your beliefs. That is what America teaches us, fight for what we believe in....doesn't it?I could talk about this for hours, but instead I am going to sit back, relax, and tell you how wonderful Das Boot was to watch. I have not been this entertained for a long time. Bravo to everyone involved in this film. I think it IS the best war film ever released (that I have seen). I want everyone to get out of their seats this weekend and go rent this movie. I guarantee that you will not be disappointed.Grade: ***** out of *****",film-critic,N/A
33,7,Intense and claustrophobic,"""Das Boot"" is a very intense movie, and it must surely be one of the best ""war films"" that has ever been made. It is claustrophobic and the men in U96 *radiate* fear and fatigue. The acting is great, as is the directing, and Klaus Doldinger's music is among the best I have ever heard. Great film.",AKS-6,N/A
34,9,Top of the line,When you go to a liquor store to buy Vodka you can purchase one of several brands or you can purchase Stoli. That's what Das Boot is when it comes to Submarine films. You can watch any one of several or you can watch Das Boot. Like Stoli Vodka it's in a class by itself. Superb film either way you see it i.e. subtitles or the dubbed version. See the directors cut if you can. The German crew could be any nationality the film is so well done it doesn't matter. Andy Rooney once said that when you're in a war you live life at 100%. The opening scene of this film demonstrates that. The men are living life at 100%. I never saw any other war movie that captured that like Das Boot.,yenlo,N/A
35,6,Yes!,"I saw this film when I was a freshman in college during a weekend that I later dubbed my ""depressing movie festival."" (The Wall and Apocalypse Now were the other weekend ""entries."") Of these films, it was Das Boot that haunted me--when I laid down at night, I saw Jurgen Proctow's pained blue eyes. When I woke in the morning, I felt as if I were escaping through the hatch of the submarine. I could not shake the images, and now some fifteen years later, I still remember how completely meaningless the movie made everything seem, and the nihilistic message stayed with me for a long, long time. How few films are there which affect the viewers on this level. To say this film is ""powerful"" seems so weak a description.Part of the ""power"" of the film comes, I think, from a certain restraint in the direction. So often, films which aspire to move the audience quickly fall into melodrama, over-acting, and overblown images. Too much. These often succeed in the immediate response (usually crying) but fail to impact the viewer on anything more than a surface level. Here, it is the small moments which fill the screen. Everywhere, all around is War, but for these men as we witness them, war does not begin with a capital ""W"". It is reality, not a grand concept. The director lets the story shock and horrify the audience, not by forcing it, but by letting the story just tell itself. Drama, tension and resolution occur naturally in Das Boot, which contributes to the very real impact of the film.Story is a 10, direction is a 10, acting is a 10 and the cinematography is a 10. One of the all-time greatest films.",aviator-287-783530,N/A
36,4,A 3½ hour long disappointment,4/10A 3½ hour long disappointmentSpoiler,Chrimle,N/A
37,10,The most intense movie I have seen!,10/10The most intense movie I have seen!Spoiler,baseballizgr8,N/A
38,9,Superior submarine movie,"It's the Autumn of 1941. The German U-boat fleet is starting to suffer heavy losses. The Captain (Jürgen Prochnow) shows Naval war correspondent Lt. Werner (Herbert Grönemeyer) around as his men party while on leave. The Captain is a pragmatic veteran. Some are on the verge of a mental breakdown, others are concerned but all respect their captain. They leave port for the dangerous North Atlantic. After a tough tour, they are redirected to pass through the Strait of Gibraltar and go to Italy.This is one of the first movie to show submarine warfare with gritty realism. The setting is claustrophobic. The characters are compelling and specific. Each of the main actors bring life to their characters. The action scenes are exciting. They hit the audience in the gut. This movie doesn't take a stance on the war other than being as real as possible. There is nothing about the holocaust. There is a general sense of war weariness which is the central message. It shows the futility of war in the best submarine movie up to that point. It can be argued that it has yet to be surpassed.",SnoopyStyle,N/A
39,10,Not Your Typical War Movie,"I am not a fan of war movies. I find that war movies, especially American ones, glorify war and portray those who fight as 'heroes'. The typical war movie simplifies war to a struggle between good and evil, though real war is so much more complex. Das Boot is nothing like the typical war movie. It shows World War II for how it was: horrifying, ruthless, and ill-planned. The U-boat crew are ordinary guys, with lives back home in Germany which they long to return to. They are not heroes, they are men who are afraid and are in the line of duty out of self-preservation and patriotism, not because they are psychotic Nazis. (they're not.) It is a story far more complex that good and evil, it is about human decisions and mistakes, and the complex struggle between one's loyalties and one's nature. Watching Das Boot, you forget that the crew is German, which in Western society we are taught is the 'bad team' of WWII, and see them for what they really were: ordinary men. I loved this movie, and I recommend it to anyone who wants to see a film that's really about something, without the warm-fuzzies and Hollywood conventions steeped into most movies. It is gripping and consuming, and once you see Das Boot, you're not likely to forget it.",teenah_mansey,N/A
40,10,Lost men in a lost war,"Das Boot (The Boat) is film-making at its finest. Not only is this the greatest naval film, it is one of the finest statements on war ever filmed.Jurgen Prochnow is the excellent lead as the Captain of a U-Boat faced with impossible odds. A compassionate man, he is a veteran at the age of 30. His performance really ties the film together and gives it a strong human touch.The tension in this film reminded me of Clouzot's Wages of Fear (especially the last 45 minutes). This is a deeply impacting film because the audience really feels the claustrophobia, the filth, the tension and all the other emotions that the 42 crew members of the U-Boat go through.The sentiments of Das Boot are decidedly anti-war. By showing that it consists of bureaucratic senselessness, German officers living in a fantasy world, the despair of the fighting men - it makes for a touching tale.The director's cut is the version to be seen although it is long. Each scene of the movie is a classic and will show you the realities of war.",faraaj-1,N/A
41,10,Where great story telling meets realism!,"My two uncles where submariners in the 2nd WW. Both survived, and I had the opportunity to meet the one that was a commander. Although he would not talk much about his experiences, I was able to extract from him his opinion of the TV Mini-Series when it came out. With the exception of the noise levels that crew members made in the movie (for drama purposes) he told me that it was a very faithful depiction of the life and hardships a submariner lived on a U-Boot.I personally have always admired the film because it depicts war without glorifying any of the participants. You are not guided by the director or the plot to identify with any particular character - you can actually relate to many of them, and therefor immerse yourself in the claustrophobic experience they live.Its an excellent piece of film making that combines drama and action into a very powerful anti-war message. Although I personally prefer the original mini-series, the directors cut with its remastered sound is also a great experience.",baselli,N/A
42,10,A Nutshell Review: Das Boot: The Director's Cut (1981),"This is touted as one of the best WWII submarine films of all time, and it's not difficult to understand why. From the story to the cast, from the cinematography to the sound, everything's top notch on this German film directed by Wolfgang Petersen (who's now helming more Hollywood flicks). I'd rate it above U-571, K19: The Widowmaker, Crimson Tide, and The Hunt for Red October.We follow the exploits of the crew of German U-boat U-96, as it gets sent on its mission to destroy Allied convoys. We learn of the frustrations of inaction, having no targets, and living the lonely life aboard a submarine. We experience the claustrophobic environment, one which is shared amongst crew, where maintaining hygiene and tolerable living conditions is of the utmost importance of staying well. We pick up on the fear of the Captain about his inexperienced crew, most of whom were in their early twenties, and haven't seen much action in the high seas.What's gripping in this film is when things start to pick up. Technology those days aren't as advanced, and we see that U-boats are more likely to be sitting ducks when Allied destroyers hover above them on the water's surface, dropping multiple depth charges to rattle and hopefully destroy their underwater prey. The U-boat is the hunter, but once it has hunted, it becomes the prey.And such is the marvellous depiction of Fear in the crew's eyes, as they huddle in silence each time the enemy lurks above. The suspense literally keeps you at the edge of your seat, the silence, deafening. Many set action pieces bring out the different scenarios and challenges that the crew face in their voyage on the seas, and all these capped by the beautiful soundtrack which accompanies each scene. My favourite was the charge through Gilbratar.Although this movie takes on an Axis power's point of view, one can discard the political aspect of this film, and understand that lives on both ends are similar - each are fathers, brothers, husbands, and are thrown into a senseless political war. It doesn't go preachy on who's right and wrong, but touches on more human and basic issues of survival. Boys become men, and it is this transformation that is most obvious throughout the story.If you've got the chance, you must see the Director's Cut, running at about 209 minutes, just as Wolfgang Petersen envisioned it to be. Excellent stuff!",DICK STEEL,N/A
