id,user_rating,review_title,review_text,author,date
1,7,I would not call it a masterpiece as some did,7/10I would not call it a masterpiece as some didSpoiler,TVpotatoCat,N/A
2,9,Joker Review!,"What did I just watch, this Movie is definitely not what I expected to see out of a Joker Movie at all. I just expected a normal origin story but this Movie is more than that, this Movie is a complex story that's always one step ahead of the viewer. Did all the events of the Movie actually happened or was it all in Arthur's head, who knows? Every single scene of the Movie you wonder is everything that is happening actually real or an illusion inside the head of a madman, from the beginning of the Film where we see Arthur in a white room slamming his head against a door to the ending of the Film where he's in a white room that looks pretty much the same as the white room that he was in at the beginning of the Film it truly makes you wonder what actually happened at the end of this Movie. Joaquin Phoenix as Arthur Fleck is absolutely amazing and his acting performance will send chills down your spine, overall Joker is a brilliant and complex piece of cinema that will absolutely blow your mind away!",Chaosfn,N/A
3,9,Not a spoon feeding of CGI fueled faux drama.,"The movie affects you in a way that makes it physically painful to experience, but in a good way.",brianmlucas,N/A
4,10,Outstanding movie with a haunting performance and best character development ever seen,"Every once in a while a movie comes, that truly makes an impact. Joaquin's performance and scenography in all it's brilliance. Grotesque, haunting and cringy. Hard to watch at times,... but so mesmerizing, you won't blink an eye watching it. Tragic, but with seriously funny moments. Emotional rollercoaster - sometimes, with multiple emotions popping-up at the same time.this is far from a typical action-riddled predictable super-hero movie - it's a proper psychological thriller/drama, with the single best character development I have ever seen.",MihaVrhunc,N/A
5,10,Only certain people can relate,"This is a movie that only those who have felt alone and isolated can truly relate to it. You understand the motive and you feel sorry for the character. A lot of people will see this movie and think that it encourages violence. But truly, this movie should encourage each and every one of us to become a better person, treat everyone with respect and make each other feel like they belong in this world, instead of making them feel isolated.",lesterarnoldpinto,N/A
6,N/A,Perfect in every aspect.,"Truly a masterpiece, The Best Hollywood film of 2019, one of the Best films of the decade... And truly the Best film to bring a comic book so chillingly and realistically to real ife.
Remarkable Direction, Cinematography, Music and the Acting.
Some people are surprised to find it DISTURBING and VIOLENT, but it's a necessity and message.
It's about society and reflects those underappreciated/unrecognized/bullied people, proving they can do something too.
The way it shows class difference, corruption and how rich and talented rule others around them is not exaggerated and that's what makes it different.
It's BELIEVABLE.
There could be multiple JOKERs living in our society that could shake those around them in much bitter way than the film shows making people uncomforting people.
Consider this a wake up call, a message, but first a film. A PERFECT film.",watashinonamaewa,N/A
7,10,MASTERPIECE 😍,"Joaquin Phoenix gives a tour de force performance, fearless and stunning in its emotional depth and physicality. It's impossible to talk about this without referencing Heath Ledger's Oscar-winning performance from The Dark Knight, widely considered the definitive live-action portrayal of the Joker, so let's talk about it. The fact is, everyone is going to be stunned by what Phoenix accomplishes, because it's what many thought impossible - a portrayal that matches and potentially exceeds that of The Dark Knight's Clown Prince of Crime",logical_guy,N/A
8,10,The Hype is real,"Most of the time movies are anticipated like this they end up falling short, way short. Joker is the first time I was more than happy with the hype. Please ignore the complaints of ""pernicious violence"" as they are embarrassing to say the least. We haven't seen a comic movie this real before. If we ever ""deserved"" a better class of criminal - Phillips and Phoenix have delivered. This is dark, Joker IS dark and you will fall in love with the villain as you should. The bad guys are always more romantic anyway.",kdagoulis26,N/A
9,10,JUST AMAZING. How does this movie exist.,"Let me start off by saying if Joaquin Phoneix doesn't get his Oscar for this movie. Then the Oscars should be cancelled. Phoneix is amazing as you might've heard from every review ever! But Todd Phillips. Is at his best here. The story lines he takes and visuals are just breathtaking. The score!! Omg the Score! Every time that score came on, I felt very uncomfortable, like something horrible was about to happen. It was GREAT. The Inspirations from Taxi Driver and King of Comedy are there, and add so much for the movie. And I got to be honest. There are scenes that are very violent. And its disturbing. But I honestly expected it to be WAYYYY more violent from all the controversy going on. Overall this movie was GREAT. Come Oscar season, it needs to be nominated for Best Picture, ScreenPlay, Cinematography, Actor, Score and Director",VallejoDiego,N/A
10,10,Went for a second time to watch,"I get why some people hate this . It's because of the political message and how some people think that you need get empathy for Arthur's madness. But come on that is not the point and it will never be. Enjoy this masterpiece because Joaquin Phoenix and Todd Phillips overdid themselves with this movie . The acting,music and cinematography are just amazing ! Please enjoy the movie without overthinking it.",mariamelkott,N/A
11,7,Between a 7 and an 8,"I thought this film was good but I just don't get the hype personally. The acting was amazing and the film was good overall but I think 'masterpiece' and 'film of the year' are a bit overused throughout the reviews. In no way did I dislike this film, I thought it was really good, just overhyped. I feel as though a lot of the 10/10 reviews are purely based on the fact that it already has amazing reviews and so people want to carry the praise further and that it is about the joker. If this film was released and was about some random guy in the same situation, I don't think the reviews would be as high but maybe that's the point.",romanwatson,N/A
12,10,"A psychological study, rather than a superhero flick","I have seen Joker yesterday at Venice an early ill-fated screening. We had some trouble with audio that lead to a near-hour delay, but it definitely was worth it.Joker deserved to be presented at Venice Film Festival, an event that regards cinema as a form of art, because this film is far from a blockbuster or a mere entertainer movie, as most films in the genre are.It focuses on the psyche of the main character, as it slowly crumbles under the pressure of society. And thus, Joaquin Phoenix does a wonderful performance, earning almost surely a nomination at the oscars at least.
It's a take on the Joker that differs from Ledger's, but I'd say that both are equally as good. The main difference might be that Ledger's joker is a rational that acts insane, while Phoenix's is insane to the root.Despite being a movie about a superhero villain, Joker is much superior to most of the movies of the genre (I'd exclude the Dark Knight Trilogy only, but Joker is easily as good as Nolan's movies, or at least very close). It is a small-scaled film, with a distinct style and cinematography (that cannot but be appreciated) and a set of very cinephile references that however do not feel too forced or overly opressive. (most notable are the similarities to Scorsese's 'Taxi Driver' and his 'The King of Comedy', but also Chaplin's 'Modern Times' is somewhat referenced).I am eager to see more non-comedic efforts by Todd Phillips. This movie was so far probably the best of 2019 (at worst contested so far only by Dolor Y Gloria or Once Upon a Time in Hollywood), and that should be very convincing.",Tviktor212,N/A
13,7,OK film,"Do not really understand all the tens here. Sure, a good movie, good acting, nice shooting. But the plot is not so intriguing. At times it is really long and somewhat boring. I needed to double-check the genre to see if this is a drama or what. Crime, drama, thriller it said. I would put it maybe 90% in the drama and rest in thriller.I miss more dialogue, more depth, more substance. The plot is really not more then a somewhat crazy person becoming a bit crazier. Sure there is an undertone in that it is society and the system and the mean character of people that is bringing him down and creating the evil beast which later wants to destroy everything. Absolutely, but I think it is not intriguing story and plot and dialogue enough to give this a ten.Worthy of watching, yes. But not amazing",harkap,N/A
14,5,Extremely overrated,5/10Extremely overratedSpoiler,piecookie,N/A
15,10,"Joaquin 'OSCAR', Joker = best Dark suspense thriller ... Darker than dark Knight.","It's sad that Joaquin missed Oscar for 'The gladiator' as he was very compelling Villain. But I am quite confident he will win it for the 'Joker'. Damn what a movie !!! Keeps u on the toes all the time. Unpredictable storyline and really a deep interesting plot. Did I forget to mention acting ? Damn Do niro and Joaquin teach u what really is 5 star acting.
To enjoy this movie, get a wine in your hand, close the curtains, turn of ur cellphones and put do not disturb sign on ur door. Best Dark thriller suspense movie you will get to experience.",johnnash-18420,N/A
16,10,Venice 76 review,10/10Venice 76 reviewSpoiler,pejv22,N/A
17,10,"Finally, a REAL movie","This movie causes the audience to consider many topics on morality, particularly the poor choices made by the Joker. The Joker is more relatable in this movie than antagonists usually are. I think this gives a more realistic view of ""bad"" people, who are not usually 100% bad in all ways as society often judges. It is important to know when to sympathize with the Joker (towards the beginning of the movie), and when he needs to be identified as a threat (when he begins making certain bad choices). This movie is only suitable for adults who are willing to pick it apart and think critically about it. It isn't for light amusement. That substance is what makes it so good.If you aren't able to ponder underlying themes on your own, and you have to be handed all your thoughts to you, then this isn't the best movie for you.",davestroud-76036,N/A
18,10,Good lord,"The acting, cinematography, sound design, and the script itself is phenomenal. This movie is a triumph. Joaquin Pheonix deserves an Oscar win for this tbh.",link9933,N/A
19,10,Joker > Endgame,"Need I say more? Everything about this Movie is Masterful in every single way! Joker isn't just an awesome comic book movie, it's an awesome movie, period. It offers no easy answers to the unsettling questions it raises about a cruel society in decline. Joaquin Phoenix's fully committed performance and Todd Phillips' masterful albeit loose reinvention of the DC source material make Joker a film that should leave comic book fans and non-fans alike disturbed and moved in all the right ways.",burkholdermicah,N/A
20,10,Critics are useless!,"I quit relying on critic reviews years ago... I noticed for this movie that the critics ratings were low but viewer ratings were high. That being said, what is the point of a critic when for this movie, they are oh so wrong.
I went and saw this tonite with my mom. I went in skeptical and w some what low expectations. I knew not to expect your typical super hero movie.
What we got was a masterpiece. I went in expecting sheer boredom and I was instead on the edge of my seat the whole time. Not action edge of your seat, it was a fear of what he may do or say next edge of your seat. To see this character evolve into what we all know as the #1 villain of Batman was beyond genius and Joaquin Phoenix is a true master at perfecting the art of consuming himself into this character. I may be all over the place with this but I don't care. This movie, the story, the acting, directing, effects, everyone brought their A game and JP definitely deserves a nod and win for this role. And no, there is no comparison here to Jack Nicholson or Heath Ledger. Each actor took on this character and different levels, different story points and different points in time, so any comparison would just not be feasible or fair to any of the actors as they embraced him and made him come to life in their own genius way!",jennifer_camp28,N/A
21,6,Extremely overrated,"I went into this film expecting an all-time classic based on the reviews I had read & what I ended up watching was just a decent film overall. Phoenix is outstanding...so he definitely did his part. But I feel like if you've seen the trailers you've seen the movie because the best way I can describe this film is it feels like a 2 hour version of the trailer. At 2 hours it's a relatively common runtime, but it felt a lot longer...which isn't good. I'd say this is much more of a rental than a theater movie. Kinda just....eh.",coxlchris,N/A
22,10,Oscar for Phoenix,I will stop watching movies if Joaquin Phoenix is not awarded Oscar for his tremendous acting.,issrafeel,N/A
23,6,Joaquin carries but it doesn't have a point.,6/10Joaquin carries but it doesn't have a point.Spoiler,chrisrich-11778,N/A
24,N/A,No Joke,No JokeSpoiler,villard,N/A
25,5,Acting Cannot Save Mediocre Script,"They say it's all in the writing. And this is a great example of that. Good acting and production values cannot save a script steeped in tiresome stereotypes and a failure to delve into a character's identity. We meet the Joker when already imbalanced and his so-called descent into madness is really a couple weeks away; far from a descent, it's a stroll. This is not a character study, despite claims to the contrary. It's a showcase of a good actor overly contorting his body and laughing manically as a mistaken expression of madness. Where is the past? Where are the influences? Where are the conflicts? What are the seminal moments that create the spiral? Perhaps if he had really had that relationship, and had it gone sour, it would justify a descent. Instead, it's a fait accompli. This is lazy writing, focused more on fancy long shots of Joaquin Phoenix dancing crazily than producing something of value to the franchise.",postofficecb,N/A
26,9,One of the best acting performances I've ever seen,9/10One of the best acting performances I've ever seenSpoiler,g_bake,N/A
27,8,"""That's Life.""","8/10""That's Life.""Spoiler",Nhirscher,N/A
28,10,Society is terrible,10/10Society is terribleSpoiler,saveliydalmatov,N/A
29,10,It's About a Man,"While I've watched many of the superhero movies that have come down the pike,
they are often the same. So the compensation for sensational plots involves great special effects and non-stop action. They are fun and I don't mean to dis them. What is missing is a truly psychological drama. We don't get into the heads of the characters. This film is incredible as we watch a man confront his demons. We see him made fun of, attacked, and beaten. When he responds, he is seen as crazy. He also find that he is diminished in the eye of a counselor, and his mother has kept a secret. I thought it gave us a foundation for the Batman mythos without getting to deeply into it. Acting, atmosphere, and a sophisticated plot makes this a really excellent film.",Hitchcoc,N/A
30,9,The King of Tragedy...,"Arthur Fleck's a guy with lofty aspirations, wants to make you laugh and disturb your foundations, although, he's not really that funny, he ain't going to make much money, so before you start, curtail your expectations; unlike Arthur, you won't be having laughing fits, as he aspires to get some television glitz, dispatches tormentors with glee, it's a substantial, hefty fee, but I guarantee, it won't leave you in bits; although, if schadenfreude's your thing you might just chuckle, but if it's not, the story may just make you buckle, as those on, the lower rungs, tend to not have, that much fun, and quite often, from the day they learned to suckle.",Xstal,N/A
31,10,BELIEVE THE HYPE,"Joaquin Phoenix gives Heath Ledger a run for his money, true story. This is not a popcorn fluff comic book flick. DO NOT TAKE YOUR KIDS TO SEE THIS MOVIE. Shut down all ballots for the Oscar, Joaquin is taking that one home hands down. One of the best origin stories EVER put out. The only downside to this movie, is that it is a stand alone film that will have no sequels or ties to the DC Universe. Todd Philips take on the Joker is one of pure brilliance and Joaquin Phoenix was the Joker we deserved. He didn't steal from Jack or Heath but yet you got a taste of both.",j_bone-43816,N/A
32,7,Is it great? I don't know.,"When I heard everyone saying that this is the film of the year and all the reviews flooding in with 10's, I was quite hyped and excited for this movie. When I walked out of the cinema, I felt hollow and empty.Before I continue writing, let me say this, This is NOT the film of the year nor is it a real masterpiece. The cinematography is excellent and the acting is incredible, that's just it. The side-characters are bland and overly dramatic. The plot heavily relies on plot-twists and the film is so harsh that it actually falls flat on it's face.Are there no good points though? Phoenix is phenomenal and the score is great. The cinematography is also incredible but the plot is not that great at all. It even has plot holes and scenes that left me empty.Film of the year? Nope.",ernestoherreraf,N/A
33,10,Masterpiece.,"The music. The intense. The realism. The performance. The story. Such a perfect combination of everything. I never felt that a character like joker could be real until I saw this. Phoenix shows us what a joker is in our society and shows us how power can be obtained. Philips on the other hand had the perfect choice of music, camera angles, lighting and every important factor. Overall, I did not expect the story to be this perfect. Too many shocking turns happened and it really does represent today's society. If I was in the first screening, I would have applauded for 80 min not 8.",ahakimshashaa,N/A
34,6,"Worthy Acting Performance By Phoenix Worth a Watch, but This Joker is Not Smart Enough to Become the Joker We've Come to Know","6/10Worthy Acting Performance By Phoenix Worth a Watch, but This Joker is Not Smart Enough to Become the Joker We've Come to KnowSpoiler",RayCharles81,N/A
35,5,Beyond overrated,"All hype and no substance. A pretty mediocre movie hyped up for no reason. Worth a watch if you have a few free hours to spare with nothing better to do or watch, but to rate this above 5 is just crazy.",dkoreiva,N/A
36,N/A,Well filmed but empty,"What can I say about it that hasn't already been said? It's not a terrible film, but it's not a great (or even a really good one) either. The technical aspects are great. The score and cinematography are really good. Many individual scenes are also good. But as a whole, it just feels unnecessary. Not just that, but tone deaf as well. What it's trying to say about mental illness is problematic. Why? Because it's not really sure what it's trying to say or if it's even trying to say anything about it at all. Instead, it was added in there because, well, it's easy right? Joaquin Phoenix really does excel in many scenes of the film, but I'm not sure I would want him winning an Oscar for this. Overall, it's also just not that interesting. It's kind of... boring at times. And for a Joker film to be boring? That's a crucial offense. And I guess everyone is entitled to their opinion, but I seriously wonder if those people calling this a ""masterpiece"" have even seen Taxi Driver or The King of Comedy.",Red_Identity,N/A
37,10,Requiem of a broken man,"The perfect portrait of a decline to insanity""
& Joaquin Phoenix portrays this flawlessly in a performance of a lifetime.
Choreographed impeccably by Todd Phillips & is nothing short of breathtaking.
The cinematography & backdrop ideology of such an original film for such a complex character is only complimented by the superb soundtrack & acting. A hauntingly beautiful film & A Definate 10/10.
Edit: Bring on part 2 plssssss!. We all want it!.",andymaranam,N/A
38,10,Movie of the Decade,"The pool does not need the money. They need the dignity and respect, coz that is what it takes to be a human. If you don't have that, money will only be a reminder of them being a ""good boy"". Like some politicians, they feel so frustrated when people from the lower class does not accept their funding champions. In this movie, through joker's life, I begin to get it.",diorboeyoung,N/A
39,10,Brilliant. And best joker I've ever seen,"Phoenix convinces me that he has always meant to be the joker. The movie went beyond my expectations, so many emotions went through me these couple hours. I think because its rated R, Phoenix was able to unlock jokers full psychotic potential as the character he is meant to be. This was an AMAZING story, and it calls for more. And I mean a build up, a second movie, maybe one with batman? My hopes are too high at this point, but nevertheless, brilliant goddamn movie and THE BEST joker ever played hands down.",colimexadrian,N/A
40,9,Probably one of the best comic book movies out there with a performance of Phoenix that will make you speechless at the end #Venice76,9/10Probably one of the best comic book movies out there with a performance of Phoenix that will make you speechless at the end #Venice76Spoiler,dmehic,N/A
41,10,CLOWN PRINCE OF CRIME has arrived,"10/10 Amazing story, Brilliant taking, magnificent cinematography.
Someone had to step out of the safe game played by Superhero movies and Joker movie does just that (also The Boys). Movie is gritty, real, insanely dark and sometime quite disturbing to people who don't want accept what's shown in the movie is a terrible reality we face everyday if refused a proper care.
Normally people start to compare the movie with one of the greatest like The Dark Knight and in acting wise to that of Heath ledger's Potrayal of joker.
I wouldn't say this movie is better that that or otherwise , but it will stand tall amongst the greatest like The Godfather, Taxi Driver, Citizen Kane, The Dark Knight.
Coming to the inevitable comparison of who's the better Joker? Heath or Joaquin. The answer is Both did a phenomenal job and the Joker character itself is fortunate to have being played by two greatest actors.
Definitely a top contender for Oscars. I personally think it would take away
1.Best Actor 2.Cinematography 3.Original score and if Once Upon a time in Hollywood loses in Make-up and hairstyling category it would definitely be to The Joker.",prasadraokodasu,N/A
42,10,Loved it!,"This is just my opinion but I loved the Joker, the performances, cinematography, directing, style, all build a great story. And the acting from Phoenix was incredible, he done a great take for the iconic character, and wow does he commit, with loosing the weight for the role, to developing the laugh.",Clive_JWM,N/A
43,6,Don't go with the hype,"Although Phoenix delivered an outstanding performance, the story is poor. Very long dialogues in the beginning, some action but finally the end is disappointing. This is not worth a 10.",Didier-Dirk-Brackx,N/A
