id,user_rating,review_title,review_text,author,date
44,10,Anyone who rates this movie poorly clearly doesn't appreciate cinema,"While the trailers for this movie have may seemed like there was potential for an action packed movie, this movie, clearly before it came to theaters was intended to be a progressive character study. You shouldn't go into this movie expecting intense action or the joker we know of the past. This is a movie about how Arthur Fleck becomes the Joker.I have seen so many bad reviews about how boring or slow the movie is, but I believe it was utter perfection. The first part of the movie we begin to understand Arthur as a person. All of his interactions with everyone in his life, be it good or bad. The whole point of a character study is evolution. And this is far and away one of the greatest evolutions of a character I have ever seen in a movie.Joaquin Phoenix's performance is by far the best acting I have seen in a movie possibly in the last few decades. We see a challenged person be challenged by society and it completely breaks him down over time. And Joaquin isn't acting, he is evolving all throughout the movie. If anyone thinks he doesn't put on an Oscar winning performance, they're out of their effing mind. Yes, the movie is slow to start, but it has to be. We couldn't just jump into the joker and all the chaos. We need to know where it came from to begin with.The whole compilation of the movie is amazing. The complete Oscar deserving performance of Joaquin, the choreography, the cinematography, the score. Everything is in perfect harmony. While there may have been a lot of controversy surrounding this movie, the team put together a perfect movie and I pity those who can't appreciate the tears and sweat and emotion that went into making this movie.I have always been so one sided in my movie preferences between Marvel and DC. I feel like Marvel is sooo much better overall and most movies DC puts out are trash. But Joker is far and away my favorite comic movie. Even though it takes a completely different spin on comic movies. You have to appreciate the evolution to appreciate this movie. It's not an action movie, but it's really rips and tears at all the emotions in one movie while adding a wild suspenseful kick. No other comic book movie has done that before.",fitchbuster,N/A
45,7,OMG - Am I getting old or are people getting more stupid,"I was so hyped up to see this movie, loved the trailer, only movie I have wanted to watch in the cinema for a very long time.I watched it and was bored. the aesthetics were amazing, music was good, story and execution was meh. the performance of the joker was a good performance but people raving about this are driving me mad. either you have not seen many movies or I have seen too many.this movie was bang average and was actually boring. I was actually thinking about leaving half way through as I was bored out of my mind.I do not regret watching it but it is being so overhyped that I am so confused right now. I think it had a good premise but could have been so much more, so much more.Signs of a great movie is the repeat viewing of it or it moving you, joker did not move me whatsoever and I would not watch it again.I thought maybe people are getting paid to write good review but have actually met people who think it is the best movie ever.... OMGGGThis movie is bang average and way overhyped.phoenix performance is good but as the story and execution is so bad, I feel he never even touched the higher spectrum of performance he could have with the character.I have experienced and seen worse in my life, if this made you feel, you are (i hate this word but have to use it) a snowflake. Please get off social media and live life.there is a real world out there.",HakuMashentay,N/A
46,5,Didn't like it,It was a really slow paced and boring. It was too overhyped in my opinion.,miacoop,N/A
47,N/A,"Truly, if ever there was an overated film it's Joker.","This film is undeserving of the praise it received. Boring and uninteresting in every imaginable way. A failed celebration of derangement culminating in the end with an act of cowardice. There was no depth, only subcutaneous attempts at shock. It was predictable and boring.",thegermanhermit,N/A
48,9,Joker's laughter is no joking matter,"Writer-director Todd Phillips's new movie ""Joker"" appeals to me on multiple levels, primarily by offering an engaging story, strongly rooted in believable reality, related to audiences mainly by opposing protagonist's prevalent dark depressive moods while using often optimistic soundtrack and sound editing, shallow nonetheless rich visuals, angles and framing, theatricality augmented through expressive costumes, props and sets, but most impressively via great principal performances and acting choices made by Joaquin Phoenix in the lead as a title character (under proper fictional name Arthur Fleck), whose sudden uncontrollable and seemingly inappropriate laughter (justified as a medical condition) easily counterpoints the (painful need for) outcry from Gotham (read: any) City masses, hurt and deprived by injustices of their quotidian existence, as well as by Robert De Niro in a quintessential supporting role of a TV-comedy show host Murray Franklin (both worthy of the end-of-the-year acting award considerations), and by setting believable pre-course for the future adventures of the most realistic DC Comics character, the Batman (not a superhero at all, with his extraordinary capabilities rather resulting from his physical fitness and skills combined with high technology employed), who appears here only as a young boy, and whose later adult activities could be understood as largely driven by what has happened to his parents in the final scene of this movie, an event directly inspired by actions of Joker, henceforth his future main nemeses.",Davor_Blazevic_1959,N/A
49,10,Stunning,One of the best movies in these few years and 100% Oscar worthyJoaquin Phoenix delivers one of the best performances I've ever scene,dariafa,N/A
50,10,Saw it tonight and had to make an account so I can tell everyone how good it is,"Seriously, unbelievable. Dare I say better than Heath Ledger? If Joaquin Phoenix doesn't win the Oscar for best actor and 'Joker' doesn't win at the VERY least, best screenplay, it will be one of the biggest Oscar snubs of our time",noahbarber-35968,N/A
