id,user_rating,review_title,review_text,author,date
19,6,Once Upon a Time... in Hollywood,"Once Upon a Time... in Hollywood is maybe proof that Quentin Tarantino ranks alongside Stanley Kubrick. Both started to make overlong movies and were lionised by critics, many who were afraid to be critical of them.This might be Tarantino's most self indulgent film so far despite being a glorious period piece.Set in Los Angeles 1969. The film is an alternate history as it focuses on Rick Dalton (Leonardo DiCaprio) who was once a star of the hit television show Bounty Law. Now Dalton's career is fading. He drinks too much, he does not remember his lines and his regular work is guest starring as the villain of the week.Accompanying Dalton is his stunt double Cliff Booth (Brad Pitt) who acts as his driver and gofer. Booth is also short of work as he has a bad reputation in the stunt industry.Living next door to Dalton in LA is actress Sharon Tate (Margot Robbie) who has just moved in with her director husband Roman Polanski. Life for her is attending parties and going to the cinema to see her latest movie.Dalton wonders if he should take up a suggestion to go and work in Italy and make spaghetti westerns which could kick start his career. Booth gave a pretty hippy a lift to a ranch which is full of strange people belonging to a cult. Booth seemed to have rubbed them up the wrong way.Eventually the various people cross paths in this reimagining of what might have happened on a fateful night in 1969.There is no doubt that that DiCaprio and Pitt give their all in this film as two middle aged men fading away at an uncertain time. Tarantino seems to have given this film a conservative hue, he really dislikes the counterculture. I wonder if he is angry with the #metoo movement which destroyed his friend Harvey Weinstein and raised questions over his own conduct in the past.Clocking in at under 3 hours this film meanders until it reaches its explosive climax. Until then you wonder what exactly is the story. The movie is a series of vignettes that hints at a director/screenwriter who is past his prime and seems to be obsessed with bare feet.",Prismark10,N/A
20,10,A love letter to all that is Hollywood,"Just got out of a screening. This movie was perfection to me! Everything plays a part in the experience. This is some of the best acting I have seen in a long time. I was swept away with the look, music, and story. The best part of this movie is when you are spending time with these characters. Rick Dalton has quickly become on of my favorite characters of all time! Leo lights the screen on fire every time we are with him. He is the ultimate package in this by giving Rick so much depth. Pitt does an amazing job as well. Cliff Booth would be a guy I would want to hang out with. It's nice to see a movie about two guy friends that support one another in different facets of life. It is so much deeper than some sort of average buddy cop affair. Margo Robbie gets a shout out too. She truly embodies Sharon Tate and glows on screen. She is amazing. This is Tarantino at the height of his powers. He gets the best performance out of everyone in every part of this movie. There are a lot of very enjoyable smaller parts in this. It's also great to see him working with the second generation of actors and actresses he has worked with in the past. I was taken on a ride to every part of Hollywood in this. From the glitz and glamour to the dark and twisted. This movie has a really awesome third act that I wouldn't dream of spoiling. I consider it a cherry on top of an already perfect movie. The directing, writing, music, cinematography, acting were all on point. It's a slow burn but all in all this movie is about Hollywood and the different aspects of it. The rising and falling of it's movie stars, and the people that flock to it in hopes of a different life. Go in with an open mind and let the movie take you on it's ride and you won't be disappointed.",Rainbowbeany,N/A
21,6,Once Upon A Time In Hollywood forced me to recall that the golden age of filmmaking was never this tedious.,"Not even Tarantino with his blood-soaked trademark violence can save this year from mediocrity. It's abundantly clear that his ninth film is a passion project, his love letter to 60s Los Angeles when it was deemed cool for the hippie lifestyle to integrate with mainstream America. It's substantially glossy, kaleidoscopic, heck some may even describe this three hour long ""epic"" as, well, epic. The only thing epic about this behemoth is Dalton's beastly flamethrower as he incinerates a group of Nazis. This is, without a doubt in my mind, Tarantino's weakest film to date and another sign of his progressive downfall in quality. An ageing television actor, his swooning stunt double and actress Sharon Tate navigate the alterations of the Hollywood film industry, with the Manson ""Family"" providing a suitably bleak backdrop.Technically, this comedy-drama is good, and I'm not just saying that to ease the scathing hatred that is inevitably flying my way from Tarantino fans. His directorial efforts were effortless. Managing to sustain multiple storylines with a wide array of cameos from his ensemble cast and allowing the lead actors to chew the scenery til it's just mulch. A tribute to the art of filmmaking whilst also providing insight in an actor's mind during vast changes within the industry that made him famous. Tarantino's foot fetish aside, his ability to swoop the camera from high octane tracking shots following a horse to sub-urban houses in Hollywood hills (mostly comprising of single takes) is unprecedented. Even with a simple conversational piece, much like when Dalton meets Fraser for the first time and talks about the novel he's reading and resembling, it's executed with such confidence that it immediately entrances you. Overextended and laborious? Absolutely. Yet witnessing Dalton come to terms with his acting talent, alongside the beautiful creature that is Olyphant playing James Stacy, is oddly engrossing.Of course, only possible due to DiCaprio's electric performance. Purposefully overacting, consistently shouting and harnessing the only developed arc out of all the characters Tarantino shoves into the film. His comedic timing, reminiscent of his venture in Scorsese's 'The Wolf of Wall Street', is impressive and allows a handful of laughs to sneak in, particularly when on the set of 'Lancer'. These characters all residing in a well-designed, precisely replicated and exuberant city that encapsulated the culture at the time. The production was immaculate, accompanied by a signature soundtrack that oozes sophistication and provides a mixtape for golden rock'n'roll.So, like I mentioned, technically this is a very proficient film. Which begs the question ""why was I underwhelmed?"". Well, that's because nothing happens. A near three-hour collage of Cliff Booth driving across Los Angeles, Sharon Tate watching her own film and the Manson ""Family"" walking bare feet on lukewarm sand. It's so self-indulgent with no actual substance that it borders on being pretentious. The multiple storylines rarely mesh. Booth is the exact same character from start to finish and is only present to beat the smack down out of Bruce Lee. Tate has no purpose to the over arcing story whatsoever and diminishes the talent of Robbie who has considerably limited screen time. The entire Manson backdrop is utterly futile in terms of placement, that it seems incredibly forced during the last act (although ridiculously fantastic to watch) just so Tarantino can address the cult's motives. The length that various scenes last for was enough to send anyone to sleep, mostly due to the restrained writing from Tarantino that lacks the punch from his previous efforts. An unaccomplished conclusion that left me questioning the entire purpose of the film. Aside from Dalton being introduced to his neighbours, the start of the story is the exact same as the ending. No one has any development! When Tarantino alludes to something happening, like Booth investigating Spahn Ranch, he deviates and sets the pace back to pedestrian mode. Simply a mish-mash of cameos so that everyone working in Hollywood today can claim they were part of a Tarantino feature.For a film that is designed to be a homage to the golden age of Hollywood, there is a distinct lack of gold to be found in this bejewelled ensemble presentation. Whilst technically proficient and wonderfully acted, the absence of substance and genuine character development makes a three-hour affair feel more like a five hour ordeal. And it pains me to say that, as I wanted Tarantino to be the saving grace of this lacklustre year.",TheMovieDiorama,N/A
22,10,best movie 2019,10/10best movie 2019Spoiler,piro-sachi,N/A
23,6,One of the most boring Tarantino films,6/10One of the most boring Tarantino filmsSpoiler,Haapavuo,N/A
24,2,Pains me to write this,"I LOVE QT films and couldn't see this movie fast enough. All I can say is what was that all about? It was so boring. Did anyone edit this film? Leonardo's character was not likable. The only person tolerable was Brad Pitt. Nothing happened what so ever. The dialogue was not clever. The movie never went anywhere at all. It was just endless scenes of other movies being made. People driving in cars. Bare feet over kill. By the time the ending happened I didn't care anymore. I wanted to LOVE this movie, but I haven't been this bored in a long long time. I wish i felt differently.",angiek-78966,N/A
25,10,A Beautiful Homage to an Era Long Gone,10/10A Beautiful Homage to an Era Long GoneSpoiler,abmtz,N/A
26,10,DELICIOUS,"I'll start by saying that I'm a true Tarantino fangirl. I even have a Hanzo tattoo. Even so, a couple of his movies have left me feeling out of sorts, not because of the campy violence, but because of certain depictions of cruelty. I don't like mean. So, along comes 'HOLLYWOOD' and I know very well that if ever a story had cause to be mean as hell, it's this one. Still, I was stupid excited, as I am before every new Tarantino flick. As is my habit, I avoided all trailers and commercials; I wanted to be surprised, even though I was anxious about how Quentin would handle the tragic ending (don't worry - no spoilers in this review!).As we all know, QT's ego is the size of a planet, so I was concerned that he might botch this heart-breaking historic tale. What if he made light of a very real tragedy? What if he turned a sobering true crime into a cartoon? I mentally and emotionally prepared myself for the potentiality of an epic disappointment. But I needn't have worried. Thank you, Quentin.It's difficult to write about this film without pointing out every. lovely. thing. The streets, the cars, the marquees, the clothes, even the dirt, as a tire rolls to a stop. Chapped lips. Scars. The texture of hair as it moves on the breeze. Dirty feet. The plink of a maraschino cherry in a cocktail. How does QT do it? It's beautiful, this movie. He works his magic with the actors, too. They are transcendent (who is this fascinating man and what has he done with the real Brad Pitt?). In a word, this movie is.. MATURE. Quentin is finally growing up.The film is a meal. Some have described the pace as boring, but I would describe it as delicious. The story takes its sweet-ass time to simmer, then invites the audience to savor every bite, to relish each complex flavor. After seeing it, I couldn't stop thinking about it for days. Bits of dialogue and snapshot images kept floating through my mind, as if they were distant memories from my own life.. maybe because I was born in '65 and the sounds and images from that era so easily transported me back to my childhood. No, it was more than that.. there was a FEELING.. it was a sense memory, a thing indescribable.Remember when you were a kid, when 'going to the movies' was magical? The smell of the theater, the strangers in the surrounding seats, that feeling of excitement about the whole experience. It was like that. I haven't felt that way about a movie since I was a kid. God, it was GREAT. What a ride! Two weeks later, I went back to see it again and it was even better, because I knew what to expect and I wasn't distracted by my own anxiety. Instead, I was able to completely suspend my disbelief and in so doing, I caught a million beautiful details that I'd missed the first time. I'm going back again, before it leaves the theater.",helloevebeck,N/A
27,10,Dream come true.,"Oh what a movie! It was a dream come true for me to see both of my favourite actors together.
And the speed of the movie was absolute perfection. Attention to details were next level of perfection.
The charecter's and their perfect way the role was played by each of the actors were demanded to absolute perfection by Tarantino.It was the best 3 hours of my life. And I didn't even know it was almost 3 hours. I didn't even watch the trailers or teasers or anything related to this movie.Not knowing what it even is about, is the perfect way to watch any movie and this was blowing my brain into pieces since the start.Ohh the acting, the dialogues, the movements everything was crazy crazy good.Apologies for freaking out on the reviews, but very rarely some movies takes me to this kind of happiness.",Faisalbatcha,N/A
28,9,Sharon Tate and the Manson Murders,9/10Sharon Tate and the Manson MurdersSpoiler,coolranchdavidians,N/A
29,6,"Great cinematography and acting, plot left some to be desired.","6/10Great cinematography and acting, plot left some to be desired.Spoiler",jverhappen,N/A
30,10,Just a masterpiece to watch,"Absolutely beautiful, it was a joy to see Dicaprio and Pitt together! Tarantino as always a genius
A well done movie with beautiful techniques and dialogues",kirsismendez,N/A
31,N/A,Reminiscing,ReminiscingSpoiler,solmcneil-80687,N/A
32,7,"Wen't in the cinemas expecting Tarantino's best, but this felt far from it.","Sure you can say the acting was great, the costume and set designs were amazing which they were, even the fact that the film had all the actors they could get their hands on. The main thing missing from this movie was a plot. Just imagine watching nearly a 3hr movie with no plot.. nothing happens, the end scene was super predictable and the main reason for this film was to show off how good the acting and set designs could be. I gave it a 7 because the execution with most elements were really well done quite clearly deserves that. But if you look for a good plot with some twists here and there and good character development don't watch this with high hopes because it offers none of that.",Moviebuffmaster,N/A
33,10,The best,It was so funny I love this film. Tarantino is a genius.,szazad,N/A
34,6,Don't wast you're time,"One of the worst movies that I have seen
You just wait and wait to see what will happen but it doesn't have any story.",mehdirasekh,N/A
35,1,No spoilers,I can't spoil this movie because there's nothing to spoil!!! No plot. Nothing happens. If I submitted this same screenplay to Hollywood it would get rejected.,SuperVillainTX,N/A
36,10,Oooh God! I love this film!,"This is something new in the history of cinema.This film literally turned the current era of films, where senseless action films with a multi-million budget and stupid banal comedies without a soul soar all around, giving us new colors and a newer format. The film takes place in 1969, where we manage to live and plunge into the atmosphere of those times. You do not just watch another movie with a 3-hour duration, but you live, you feel the spirit of that time with every cell and nostalgia does not leave you even after leaving the cinema.You literally breathe the same air with the heroes and after watching the movie you are surprised at the fact that you find yourself sitting on an armchair somewhere in a movie theater in a completely different time. This is so well saturated with the atmosphere of Golden Hollywood that you regret that you were born at the wrong time.",shushaman,N/A
37,8,Gone over a few people's heads,"Not a huge fan of all Tarantino's film but this one I enjoyed. Brad Pitts character is definitely the most entertaining , but Leonardo's is a well played character who I found likeable as the struggling actor . Margot Robbie put in a good turn with her performance too as the young actress.
I do think this film goes over alot of people's heads as you'll see in some of the review .
If you are after non stop action it's not that kind of film but when you do get it it's definitely worth the wait . Brad Pitts end scene had me on stitches .
Yes at times it's a slow burner , but good things come to those that wait...",brodytmurphy,N/A
38,10,Art can be fun!,"Haven't had this much fun since Pulp Fiction. Finally some terrific entertainment that isn't a comic book character or a lot of cgi. I'm rating it 10 because I can't think of a way it could have been better. There wasn't a minute in this film where I wasn't interested, engaged, and eager to keep watching. It's punchy, funny, LA glamourous, colourful yet noir-ish, the violence is gutsy and visual but it's Tarantino, so not just a run of the mill punch up shoot out--always a surprise and enough of a twist that you can't help laughing. The editing is an excellent juxtaposition of scenes and images. Lots of recognizable memories if you're a boomer--you'll be going ""oh yeah, that's right!"" But more than that, it has characters who are interesting, not just cutout action figures, but human beings, from the lead roles to the bit parts. This looks like a movie where the actors sincerely got into the spirit--art can be fun!",parkdaleart-1,N/A
39,10,Why I love Tarantino!!!! And this film!!,10/10Why I love Tarantino!!!! And this film!!Spoiler,natashaacampbell,N/A
40,6,QT resting on his laurels,"Im sorry, i do rate tarantino but OUATIH is missing too much for it to be enjoyable. Tarantino has never worked with linear plot but it never seemed to matter because the artistry, dialogue and individuality carried the films (pulp fiction etc) but this is no longer the case. Yes the cinematography and the mood is great but the rest is just boring. The multitude of irrelevant western scenes last for hours on end (why so many for so long) and so many other scenes do not stand up on their own (why does damian lewis arrive? And the little girl?). Im not being cynical but the film lacks any power or meaning and little enjoyment.",katiesince,N/A
41,10,Tarantino tears 1969 a new one ..!!,Simply magic ! Transports you right to nineteen sixty nine. Tarantino does not miss a beat .Pitt and DiCaprio and the soundtrack are of Tarantino's best ...Buy a pack of Green Apples ...... you'll be glad you did........,NickyLarsh,N/A
42,7,Visually compelling tribute to tinsel town,Tarantino's ninth film is a homage to the tinsel town and all the major events that shaped its history told in a way that we wished it should have happened . It doesn't offer much of a storytelling but it sure will catch your eye as well as your heart.A must watch for all movie lovers who love and has a special place for the art of cinema in their hearts.,agnel_joseph,N/A
43,10,A movie that beautifully captures a different era,10/10A movie that beautifully captures a different eraSpoiler,anemerson,N/A
44,6,Self-indulgent,"Quentin Tarantino is like a self-indulgent author who writes for the pleasure of writing - pens sections not relevant to the book, composes anticlimactic chapters, twists history - readers be damned. This upon a time, despite vivid illustrations, it duds. 6/10",ltejas,N/A
45,3,The Emperor with No Clothes,3/10The Emperor with No ClothesSpoiler,RMS1949,N/A
46,10,Classic wester/60s vibe + Tarantino = amazing,10/10Classic wester/60s vibe + Tarantino = amazingSpoiler,annaanine,N/A
47,8,Enjoyable but you need to understand the back story.,8/10Enjoyable but you need to understand the back story.Spoiler,mark-513-19320,N/A
48,10,Tarantino once again!,"Tarantino does it once again! He proved that he is one of the best directors.
This is the best movie of the year right now, and will definitely be at the oscars.",pepobray,N/A
49,10,The most Tarantino a movie can be,"This film might subvert people's expectations by not really being about the murder on Sharon Tate. It's about a struggling actor and his stunt double and their lives in Hollywood of 1969. The audience follows actor Rick Dalton through his career while presenting his fear of being more and more forgotten. All in all not much plot is happening in a movie that is as long as Django Unchained. And dammed, is it amazing.
The acting, cinematography, dialogue and characters are all as beautiful and outstanding as Tarantino is famous for. I didn't see the story going anywhere and I didn't need to. Every single scene is intriguing and entertaining. I enjoyed it so much that I was actually sad when it was over. A three hour movie felt too short because I wanted more and more. It's like a visit into Quentin Tarantino's office, better yet his mind. A pleasure from beginning to end that I definitely recommend.",finnimel,N/A
50,N/A,"Slickly made in many ways, but the content is unfocused, messy, and too reliant on the delivery in the moment than the bigger picture","I approached this film not knowing too much about it, although I was a little aware of the Manson murders, Sharon Tate, and the fact that this film was loosely set around those events, but very much a fictional version of them (or a total fairy tale as is suggested by the title). Watching the film needed me to invest in that approach from the very start, because it is a nostalgic imagining of a better time without much of a connection to reality. This is made reasonably clear throughout by the insertion of the characters into real shows and films of the era, and of course by significant elements of the ending, which changes history somewhat.What is less clear is 'why' the film is doing this. It produces a reasonably enjoyable film with plenty to enjoy in the moment, in the performances, and in the overall delivery, but in terms of narrative flow it feels so fragmented and unfocused that it is hard to stick with it for such a long running time. Almost all of the scenes are engaging in some way, but as a whole they do not come together; even the extreme revision of history seems like it lacks a specific point or message for the casual viewer. It was a distancing effect on me because I enjoyed all these moments but yet was happy in them without caring really for what came next.The performances are strong. Pitt is good (although I was surprised by his Oscar) but I found DiCaprio to be the stronger performance as he had more character to get his teeth into. Robbie is a cheery presence, but only that - she isn't really a character so much as a frame of reference that we have to like; as such she works, but it doesn't sit well in the film because there is a lot of oddity when it comes to the handling of characters. The women are consistently fawned over, with a particularly weird focus on feet almost every chance it gets. Likewise the female characters bring less to the film, and are much more 'devices' than even some male characters with very little screen time.In the end, it is still a solid movie with plenty to like about it, but this is almost in spite of itself. It has unforced problems, seems rambling and messy, and relies a lot on the sheer force of its talent (cast and crew) to make the film work as well as it does - but this isn't well enough for something this long that doesn't have a strong enough narrative through-line.",bob the moo,N/A
