id,user_rating,review_title,review_text,author,date
1,9,Though about it for days and don't know what to make of it.,9/10Though about it for days and don't know what to make of it.Spoiler,ohenderson-04319,N/A
2,9,The paradox of belonging,9/10The paradox of belongingSpoiler,giuliajeanofficial,N/A
3,9,Absolutely wild!,"I loved this movie from start to finish. Went into it having zero clue what it was about, and only knew Emma Stone was in it. 2 mins in I leaned over to my partner and said ""this movie is absolutely bonkers, and I love it!""What kind of genius is that! All of the acting was on point, the cinematography was A++ the costumes and sets/scenes/CGI, I actually just can't fault it. I laughed so loud, so many times, and I shed a few tears too.Very poignant, and poetic, with fantastic ""morals of the story"" I took away a lot, it had beautiful messages of self growth and discovery. Had the good, the bad and the ugly, all mixed into a weird lil soup.Best movie I have seen in a very long time. Big fan.",shavwp,N/A
4,10,The Weirdest Masterpiece I've Seen in Many Years,10/10The Weirdest Masterpiece I've Seen in Many YearsSpoiler,kjproulx,N/A
5,N/A,Garbage,GarbageSpoiler,mariagscalia-73482,N/A
6,9,Barbie for psychopaths,"""Why do you wish to keep me here if I do not wish to stay?""I thought I was being clever when I turned to my wife as the credits rolled and stated, ""it's exactly like Barbie for psychopaths,"" only to open up the reviews I'd been avoiding a few minutes later and find that that was the top review. And as funny as that comparison is, it's only a half joke. Both are movies with fairy tale production design, with deeply feminist themes that have all the subtlety of a sledgehammer to the face, about a perfect born-yesterday protagonist learning about what it means to be a human, a woman, a woman with ambition, a love interest, a Marxist, what it means to love, to be desired, and to navigate the threat of men who wish to possess you, only Poor Things spares very little time diving straight into the sexual politics of being a woman with sexual desires, one who experiences orgasms, likes experiencing orgasms, and attempts to orgasm every chance she gets. It's Barbie's deranged, perverse, estranged cousin, the second half of Barbie that its PG-13 rating could never allow.But with its wide casting smattering of philosophical discussions, what resonated with me the most (which was also the obvious neon-flashing light message pasted across the entire film) was the way it questions the thrill in legally binding a person to your side, the way one would contractually own a piece of property. And while framing marriage and childbearing as a sort of entrapment isn't a particularly groundbreaking way to deal with the issues of desire and consent (we already had that in Polite Society earlier this year), what makes its questions all the more fascinating in Poor Things, is the vessel through which they're delivered: a woman attempting to understand the answers to that question empirically. And she asks effectively the same question in half a dozen differently worded ways:""Why do you wish to keep me here if I do not wish to stay?""Bella seeks answers to why the men around her don't understand that happiness with a partner can't exist without enthusiastic consent. Where neither party is dependent on the other economically, socially, or contractually, but because it is a conscientious decision both parties are continuously making with no other forces driving them together, free from the delusion that being with somebody else can't be any better no matter how miserable they make you. Where is the thrill in any other kind of relationship? And it's something she plans to discover using the scientific method her mad scientist father figure imparted on to her (by the way, how is this the first time we've seen Willem Dafoe play a mad scientist? Why has nobody else thought to cast him as one before?)",bulgerpaul,N/A
7,6,A child in a women's body has tons of sex,6/10A child in a women's body has tons of sexSpoiler,mcdonaldparis-83809,N/A
8,8,Woman's condition,"The movie explores the women's condition in our society trough the story of a girl who comes back to life. All her experience are a metaphore of real life, it makes you think what it is happening around us. Emma Stone is superlative in her role, Willem Defoe and Mark Ruffalo are the perfect supporting cast. The last point is about the director: he is able to show the story in a brilliant way passing from the back comedy (Tim Burton's style) to some dramatic scenes. The photography is changing during the movie, scenes are shown from different point of views. Also the music is perfect, it creates the atmosphere. The final result is an original movie, which analyses deeply our current.",kygian,N/A
9,6,A reminder that ratings are subjective. Warning: DON't watch it with your parents!,6/10A reminder that ratings are subjective. Warning: DON't watch it with your parents!Spoiler,yj-c-70356,N/A
10,9,"One of the most strange films I have ever seen, and I loved it!","Where to begin with this one....First off, the performances presented here are top of their class. Absolutely phenomenal! In a film with characters as strange as these, you need a strong cast and every player here was up to the task and more! Just brilliant!Secondly, the story is insane. I mean padded room, straight jacket type of insane. When reading the synopsis, I was thinking about how wild of a concept it was and did not think they could pull off such an audacious plot. However, Yorgos and company had a specific vision for this film and it shows in the amount of detail in both the screenplay and the visionary artistic decisions. I can say, they completely nailed it!Thirdly, exploring the human condition through sexuality, in all emotional forms, has been done before. Though, never quite like this. It was refreshing to see it through the eyes of someone reborn and ready for everything life had to throw her, as opposed to the usual timid youthful eyes.Lastly, the cinematography is wonderfully done. Mixing between black and white to full color, with wild scenery and beautifully detailed architecture. Sometimes the film felt like a dream captured within a painting. It was quite beautiful.Overall, I would highly recommend it. I don't think it will be everyone's cup of tea. It is very artsy, very sexually uncomfortable, and very strange. However, if you enjoy great storytelling and truly original visions on film, better see this on the big screen.4.5 surgerys out of 5.",nicolasroop,N/A
11,6,Poor Thing,"I'm a fan of Lanthimos but this film was ironically the ""poorest"" of his among those i've watched. I thought of the idea and the style to be very interesting from the trailers and inevitably i was very excited to see this film in the theater after a long wait (thanks to the great marketing efforts). Yet, i was very disappointed to find myself disliking it throughout the viewing.I don't have much to say about the production design and cinematography other than I found those parts of the film mesmerizing and unique, as expected. What I didn't expect was the writing and storytelling to be so cheap and at some points annoying. I understand that there is an intent to create wittiness and absurdness to give a light tone to the movie but it really felt forced and predictable to me most of the time. Honestly, i didn't laugh more than 2 or 3 scenes in the movie and they weren't even that memorable.I also found Bella's character development rushed and out of nowhere at the ending bits of the film. I really don't want to get into the other characters because non of them i found to be interesting nor well written sadly. Also, the topics this film takes on and the themes it tries to delve into were stayed on the surface in my opinion. About what it is like to become an adult from a child's perspective, about choices of women and how they are treated in the society, about the poor and the rich, about being a human in the modern world, and many more.Moreover, I would've loved delving deeper into the sensitive sides of Bella and her connection with her mother. Maybe we could've seen some parts of what ignited and caused her mother's suicide rather than seeing a maniac ex-husband holding a gun all the time and then we say ""Aha! It makes sense now about her mother jumping from the bridge"". Maybe it could've been a cliche but i think i would've rather seeing Bella to realize who she was at the end of the movie rather than in the beginning, just for the sake of witnessing her realization and reaction when she grew up as her surgery would be kept as a secret from her would be more emotional in my opinion.Sorry for this long review but there were many thoughts i wanted to let it out. Maybe among the points i made, some were a glimpse of positive things, but sadly and mostly it was more about the poor things...",jalapenochili,N/A
12,4,Not for me,"Poor Things simply just wasn't for me. I really don't like to say I hate a movie... so we'll just go with ""it wasn't for me"". I did appreciate the production design and performances, but a lot of the cinematography and writing/directing choices just didn't work for me. Just a little too weird for my tastes. And felt way too long. I wanted to like it so bad, and was so disappointed to find myself disliking it so much.I know it's been getting good reviews from most people - I'm in the minority here! So if you're interested, definitely check it out! I'm a huge supporter of going to see a film if you are interested in it and deciding for yourself how you feel!",parksiet,N/A
13,N/A,I regret watching this,"Clearly a lot of people enjoyed this grotesque movie, but it wasn't for me. Some of the scenes in it made me feel sick, and maybe they were supposed to, but it seemed unnecessary. Don't even get me started on how pretentious the movie was.I also found this movie very frustrating because the acting was good, the sets and costuming were good, and some scenes used striking cinematography. These things all made me feel like I should've liked the movie, but I don't. It could have been put to much better use.The sex and nudity is beyond gratuitous. I'm usually not bothered by sex scenes in movies, but for this particular film it felt perverted. Maybe the director has a weird fetish.Ultimately, this film made me want to crack my own head open and pour bleach over my brain. It's one of those movies I'd like to block out. I don't think I'll ever watch anything else by Lanthimos.",awagne-29536,N/A
14,8,"Odd, very interesting, uncomfortable to some, misunderstood by many","This is a very unusual movie. I enjoyed watching it, even though it felt awkward at times (as promised by the creators and many reviewers). In my opinion, many users who gave it a 1/10, missed the point. For sure, it is a movie for very mature and sophisticated audiences. It contains a lot of ugly truths about the world, so don't watch it if those bother you. (Don't watch it with teenagers, either, wait until they are 20 or 21.) I appreciated the creative direction, cinematography, and Emma Stone's acting talent. The plot covers multiple aspects of privilege and abuse in thought-provoking ways. On a very high level, you could say that it has some similarities to Barbie, but a very different approach. It is almost the anti-Barbie. The contrast between these two 2023 movies is definitely worth a class discussion in some graduate course of film criticism.",nickevangelopoulos,N/A
15,8,strange,"Poor Things is a very, very strange and peculiar film. This film is about the freedom that every person must have, interpreted by the new life of Bella Baxter, a woman who is already physically adult but mentally child: a plot that I like. In this film we see the evolution that Bella gets and how she gets her psychological maturity, especially through lots of sex. In this film, in fact, there is a high dose of nudity with many very explicit scenes, of which I think at some point they could cut the amount. It's also quite a fantascentific film because a lot of the topics are impossible to find in real life. Lanthimos' direction is excellent, with many beautiful and extravagant filmmakers who keep the spectator on the piece. The image quality is gorgeous with so many amazing colors. Emma Stone does an incredible job and in fact her Oscar is ultra deserved: one thing that makes her performance perfect is also the fact of her courage in facing a film so sexually explicit, performing it at the top! Mark Ruffalo also does an excellent job like all the other actors. The characters are good and the costumes amazing, every detail of clothing is noticed and makes the idea of the setting, which is also amazing. The negative notes are in my opinion: the rhythm and duration of the film, in my opinion it could last even less than 2 hours cutting some scene too much, in fact sometimes I got very bored, and writing, sometimes in my opinion repetitive. The film also makes me laugh with extravagant jokes, as if the whole movie. The ending hasn't convinced me, even this good level. Poor Things is a movie that I will want to watch again..
Rating: 8.4/10.",montanaromichael,N/A
16,8,"A Review of Whimsy, Weirdness, and Wonder","Yorgos Lanthimos's latest offering, ""Poor Things,"" is a cinematic rollercoaster that throws absurdity, social commentary, and dark humor into a blender and hits puree. It's a film that will leave you bewildered, amused, and maybe a little bit grossed out, but undeniably entertained.The story centers around Bella Baxter (played with delightful naiveté by Emma Stone), a Frankensteinian creation brought to life by the eccentric Dr. Godwin (Mark Rylance). Reborn with the brain of a drowned child and the body of a young woman, Bella is thrust into a world that both fascinates and confuses her. Her childlike innocence clashes hilariously with the societal mores of the 19th century, leading to a series of outrageous situations that push the boundaries of good taste and propriety.Lanthimos, known for his penchant for the bizarre, doesn't shy away from the grotesque in ""Poor Things."" Bodily fluids flow freely, sexual encounters are depicted with a bluntness that borders on the pornographic, and violence erupts with unexpected ferocity. Yet, amidst the chaos, there's a darkly comedic undercurrent that keeps the film from becoming merely shocking. Lanthimos uses humor to highlight the absurdity of social norms and the hypocrisy of those who uphold them.The film's visuals are equally striking. Robbie Ryan's cinematography blends dreamlike beauty with unsettling distortions, creating a world that feels both familiar and alien. The production design is sumptuous, with meticulously crafted sets and costumes that transport us to a fantastical version of Victorian England.""Poor Things"" is not a film for everyone. Its offbeat humor, graphic content, and unconventional narrative will likely alienate some viewers. However, for those willing to embrace its strangeness, the film offers a unique and thought-provoking experience. It's a wild ride, but one that ultimately leaves you pondering the nature of humanity, the meaning of life, and the absurdity of the world we live in.**Here are some additional points to consider:*** The film has been praised for its performances, with particular acclaim for Emma Stone's portrayal of Bella.* Some critics have found the film's humor to be too crass or mean-spirited.* The film's pacing can be uneven, with some scenes dragging and others feeling rushed.* Despite its flaws, ""Poor Things"" is a visually stunning and intellectually stimulating film that is sure to spark conversation.**Overall, I recommend ""Poor Things"" to fans of Yorgos Lanthimos's work and those who enjoy offbeat comedies with a dark edge. Just be prepared for a wild ride.**",byordanov-48174,N/A
17,9,Frankenstein's daughter,"Yorgos Lanthimos once again presents us with an excerpt from a distorted fantasy world, which, however, has more parallels with ours than one would initially expect. The story is focused on Bella, who was brought back to life after death by a peculiar scientist, after which she learns about the world with the brain of a child and gradually develops in all directions, even those that could be described as taboo. Emma Stone gives a masterful acting performance and her character adds more and more layers as the minutes of the film go by until the triumphant finale.Transforming from Bella the toddler into a socially conscious woman, she surpasses all her previous roles. Whether it's her walk, thoughts, facial expressions, or body games, she leaves us in no doubt as to what mental stage she's currently in, and with Mark Ruffalo seconding her, there's no shortage of bizarre moments.Intelligent dialogues, thoughtful concept, topical theme, visually intoxicating images, captivating performances, devilishly morbid ideas, lots of nudity, art film, Oscar nominations are inevitable.",petrxpp,N/A
18,6,What am I watching?,"So I'm sure that people might be judging people who are giving this movie low scores for being prudes, or those who are predisposed to under appreciate artistic movies. This is absolutely not true. I adore strange and artistic films, but this one just seem gratuitously repulsive. I really like something with more of a plot or profound plots and a movie that does not rely solely on nudity or sex, or the abuse of the female body. It was very difficult to watch the scenes. The only reason I graciously gave this movie or four was because Mark Ruffalo. He was absolutely fantastic in this movie, but beyond that, I really didn't see any stand out actors. Emma always does a good job. It won awards for being original, because what other movie would actually be like this? None. What other movies would have constant nonstop sex and nudity? None. I guess people are hungry for this vacuous type of plot, but I just personally did not like it as a woman. Yes, the cinematography was great, yes, the acting by the main characters was amazing. But that's where it ends. I am still, however, trying to trudge to the end of it. We need more movies like this move these like pans labyrinth that are aesthetically, beautiful and where the plot is very different or even oriented around science, fiction or fantasy, but this one fell short. The movie did get better near the end, so I upped the score to 6.",Lolarobot,N/A
19,9,A Bizarre Masterpiece,9/10A Bizarre MasterpieceSpoiler,aciessi,N/A
20,6,6.5/10. Overrated,"1) The misandry is strong in this one. Not surprising though, seems that this is the Holywood way from now on : Every man is dumb or pathetic or disgusting or criminal or childish. Condemning toxic masculinity is one thing. Condemning masculinity in its entirety, is another.2) Seems also that in order to achieve Enlightment, you have to be a sex worker. It's so obvious i wonder why noone thought about this in the entire Human History. I guess Lanthimos is a pioneer. A Marco Polo of Wisdom. It made me so uncomfortable watching Stone's character dealing with this disgusting debauchery (I mean the ""Paris"" segment). But i guess it's a sign of toxic masculinity if you don't like watching a woman get humiliated. Lanthimos is beloved in Holywood because obviously he preaches Women empowerment. I didn't know that Humiliation/Depression = Empowerment. Happy to find out.3) Sarcasm aside, this could ve a very good movie. I am a man but i would gladly watch a movie showing a woman's path to Self Actualization. Until the PARIS segment, i thought that this movie is something like that. And i was enjoying it. A very good dark fairy tale/comedy drama fantasy. Not just funny but even hilarious at times. German Expressionism meets Terry Gilliam or something like that. A visually stunning movie with GREAT acting. Stone was magnificent but the other actors were amazing too (Dafoe, Ruffalo, Carmichael etc). Not a brilliant movie but a clever one. I wish that Jerrod Carmichael had more screen time, his character was very interesting. But i don't wanna nitpick it, it was a good movie overall. Even with the misandry element.However, the PARIS segment ruined this movie. Literally, one of the most unnecessary parts of all time. Meaningless, empty, vulgar. Even misogynistic i'd say.And, of course, the ending. A ridiculously simplistic and naive ending for all brain dead people to enjoy.",athanasiosze,N/A
21,6,Artistic Ambitions: A Missed Connection,"Despite its modest budget, the dedication of the cast and crew behind the film is praiseworthy. However, the film struggles to deliver a cohesive experience. In an effort to break the mold in every possible way, it unfortunately misses the mark.There is much to say but, for example, the use of unique wide-angle lenses gives the film a distinct visual style that's hard to ignore. Yet, the constant, almost futuristic, camera movements are obviously distracting and ruin the overall effect. A balance between innovative and traditional techniques could have provided a steadier and more impactful visual narrative.Opting for an exaggerated color palette begs the question: why then dedicate a fifth of the film to black and white? Furthermore, if this stylistic choice was intentional, the rationale behind it was not sufficiently communicated to the audience, leaving them puzzled over the decision.The film's approach to depicting nudity, intended to symbolise the Bella's journey, ends up feeling excessive and unnecessary in many scenes. A more nuanced and restrained portrayal could have conveyed the same message with greater dignity and impact.Echoing sentiments found in several other reviews, this story is deeply rooted in women's experiences and carries a potent feminist message. Yet, the film's execution seems distinctly male-oriented, with every creative decision reflecting a perspective that may not fully align with the story's core essence.Although the story at the heart of the film is genuinely compelling and the acting is admirable, the way it's told detracts from its potential impact. The ambition to stand out in every aspect resulted in a fragmented presentation, diluting the emotional connection and leaving a sense of disjointedness. Ultimately, the film feels like a series of bold experiments that, while individually interesting, fail to come together into a harmonious whole, resulting in a viewing experience that's more bewildering than engaging.",nde_man,N/A
22,3,I shall try to erase this one from my memory,"While I am loathe to criticise a fairly original story and something quite different from the norm, this film was definitely not for me. I'm a big fan of Stone, Ruffalo and Defoe so it pains me even more to be negative but I did not like this at all and feel tricked by the high review scores, to the point where I feel the need to leave a low score to balance it out a bit.I was left thinking suddenly I no longer understand film for this to have scored so high.I'm not sure why this is deemed a comedy, it is much more a horror in the conventional sense. Frequently grotesque and music designed to make you want to hit the mute button. I tried to like the style and cinematography but I just found the whole story so unpleasant as to be completely distracting.The one thing I did find funny was the first frame saying 'CONTAINS TOBACCO REFERENCES', which is then proceeded by the opening shot of a suicide. What a bizarre world we are living in.",Billybobble1,N/A
23,10,Nothing less but an absolute masterpiece,"The best of Lanthimos yet, it is amazing how each one of his movies is so much better than the previous one.The movie can't be characterised anything else but an absolute masterpiece. Where to start, cinematography is absolutely stunning, plot, meanings, performances... Everything outstanding, if the movie does't win Best Picture this year it will be a huge surprise. In leading actress there is no competition.Nudity is ample in the movie, if you have watched other Lanthimos movies (particularly Dogtooth and The alps it will come as no surprise).If you are not familiar with his perspective some of the scenes might be hard to digest.",Kaa1111,N/A
24,10,Best Movie of 2023,"""Poor Things"" is undoubtedly my top pick for the best film of 2023. Its plot is extraordinarily elaborate, delving into life through the perspective of Bella Baxter, a young woman brought back to life by the brilliant and unorthodox scientist Dr. Godwin Baxter. The direction is astounding, and the music, texture, and imagery, along with the actors' performances, combine masterfully to deliver a final work of unparalleled excellence.Emma Stone proves herself as one of the finest actresses of our generation in this film. Her ability to authentically portray a character's journey from childhood through development into adulthood in such a perceptive and distinctive manner within a single film is truly brilliant. Her comedic timing and choices are also hilarious, consistently entertaining the audience while simultaneously imparting lessons on various topics ranging from sexism and prostitution to slavery.It's a film with both substance and wit, managing to evoke laughter while also touching on deeper emotional notes. ""Poor Things"" encapsulates the complexities of human life and our profound philosophies.",gersontv,N/A
