id,user_rating,review_title,review_text,author,date
25,9,Magnificent gothic tale,"""Poor things"" and ""The Favourite"" are by far the best movies I have seen by Lanthimos. The performances are all extraordinary. Emma Stone was amazing, but for me the surprise was Mark Ruffalo, he delivers his best performance. The script is brilliant, couldn't help but laugh all the time. Above all, it was very interesting to see the evolution of Bella's character, from childhood to adolescence and adulthood. Also from the complete disregard for other people to.empathy. Such a beautiful gothic tale, such an amazing world created by Lanthimos full of beautiful vivid colours and sceneries. A must see.",marinakoraki,N/A
26,9,Fantastically Imaginative,"I adore imaginative creativity that is original. This film has it all for me. The set designs were excellent, the acting is superb, the music is perfection. Very quirky and beautiful.Kudos to Emma Stone who deserves buckets of accolades for her performance. Actually everyone involved in making this film has my high regard.There are few movies that are brave and can stand alone and Poor Things is exactly that.Yes, I can understand criticisms regarding the sexuality in scenes however I did not react with disgust, I found them honest and amusing.Beautiful movie that I will add to my library and enjoy many more times to come!!",missreneb,N/A
27,6,Same old from this director,"I always feel like this director is the Johnny Depp of directors. Hides himself in weirdness so no one notices he isn't that good at his craft. This movie is like when you go to the art gallery and there is a painting of something a 10 year old could do but it has an expensive price tag so everyone sits around gushing over the garbage, all afraid to be the one who says this sucks.That is this director. Throw weird on the screen to such a level that people are afraid to say I don't get it or that wasn't very good. So people pretend it is great. This won't make much money, will be forgotten in a year except for the nudity and at the same time the critics will fall over themselves trying to look smart by saying it is great cinema.",scotty-51640,N/A
28,9,Deeply creative master stroke,"I loved every bit of Poor Things. The cinematography was absolutely astounding. The crazy wide angle, even fish eye, lens add a claustrophobic feeling all while exhibiting the amazing art department. The use of color was thematic and was used 100% for the story. Making the whole world fantastic and supernatural. Absolutely beautiful movie.The acting was top notch. Emma Stone gets the chance to create Bella Baxter and runs wild with it. Ruffalo gives one of his most entertaining turns. Willem Dafoe is always amazing. Lanthimos gets to the most direct vein of a character with a dark wit that his films are always interesting to watch.The most impactful aspect of this movie is the direction of the whole thing. Tony McNamara and Alasdair Gray have created a monster of a story and Yorgos Lanthimos gets to teach it how to speak. His vision of each film he makes is so uniquely Lanthimos-ian (sp?) and a real treasure to watch.It did feel a bit long though.",mrrydge91-1,N/A
29,7,Stunning Cinematography but Pushes Boundaries,"I'd love to rate this one a lot higher since it's a visual masterpiece but it pushed me out of my comfort zone of an enjoyable film experience. The use of color, lighting, and unique camera angles made this mesmerizing to see and I was hooked the entire time. Going from black and white to color during Bella's new journey to experience the world was fascinating to watch. The acting in this one is top-notch with Emma Stone doing an amazing job of transitioning from a toddler-like mentality to a sophisticated woman. It's still tough to give this a good score because her experience with men with a childlike brain is borderline appalling to take in. Maybe that was the point the entire time but it's hard to balance a beautifully shot movie with a disturbing concept. 3.5/5 stars.",maddmaxx46,N/A
30,9,"Warnings aside, just enjoy the ride!","High rating, I know, but keep in mind this movie is not for everyone. Nudity, profanity, quirkiness - and then a scene with Emma Stone and Mark Ruffalo that made me decide to stop being nervous about the situation it seemed to be making fun of, and just accept whatever was thrown at me. So funny, smart and ultimately a full arch of characters. Several great performances, and a cast that put a lot of faith into the production. Everyone is going for broke - and if nothing else, you have to love their fearlessness. Emma Stone continues to impress me so much, and even Willem Dafoe can surprise you after all these years. One of the best movies I've seen in a decade!",jeff-gibson-835-273379,N/A
31,6,"Great acting. Great visuals. But, pointless.","A great movie should be measured by the impact it has on you and how memorable it is. With this one, every ten minutes I kept asking myself why I was still watching. The only things that kept me going were the strong acting and impressive visuals. But once it was over, I realized it left no lasting impression at all. The storyline felt strange and ultimately pointless.",JonnyS-764,N/A
32,3,Ridiculous and so disappointing,"I am a huge fan of The Favourite, The Lobster, and The Killing of a Sacred Deer. Those movies were thoughtful, clever, and just truly stunning and original. This movie was pointless and boring. It wasn't empowering in the least. It tried. Really, really hard. It wasn't deep, every moment of it was clearly for shock value. Does having a ton of sex with different men make you a liberated woman? Ridiculous and heavy handed. I guess those of us who don't like it don't *get it*...it's art after all! It shouldn't make sense!The cinematography was gorgeous, I'll give it that. And I was happy to see Ramy Youssef in a big movie because he's fantastic. Mark Ruffalo should never attempt any accents, ever, and I think he's wonderful otherwise. Oof. So bad. Emma is better than this. So so disappointing!My favorite characters were the animals roaming the property. They should've given more lines to the chicken dog.",ccd-172-366308,N/A
33,9,curiouser and curioriser,"Such a strange and Gothic film! I saw the curious costumes displayed in the Barbican. That hinted at what the film would be like. I really enjoyed it. Great costumes, top class actors, engrossing narrative, special effects, a proper plot with no plot holes, and a proper ending. Strangely enough it was convincing and I was absorbed in the story.The cinematography is wonderful. Sometimes the film felt like a beautiful dream captured within a painting.One teeny -; the BOOK was set in Victorian Glasgow and I would have liked them to have Scottish accents.Overall, I would highly recommend it.",leroyatone,N/A
34,9,A gorgeous movie,"This is one of the best movies I've watched recently. Visually stunning, it has a good plot, fine humour in the dialogue, brilliant acting. Some people may find it unpleasant, obsessed with sex, or even empty of meaning and interest: the fact that we have different tastes and react differently to a given object is just one of the features that make reality interesting. ""Poor Things"" reinvents people, animals, chariots, boats and places, and it does it dazzlingly. The objects it portrays are scenically improved versions of the real ones: Lisbon and Paris, for example, appear surprisingly engaging while allowing you to recognize the respective originals. It should be mentioned in addition that the score is fabulous: it should be heard until the last piece of sound that closes this cinematographic ceremony.",lino_reis,N/A
35,9,Weirdly Exquisite,9/10Weirdly ExquisiteSpoiler,iomike101,N/A
36,9,"captivating, visually-pleasing","Truly a cinematic masterpiece. Entertaining from start to finish, poor things is a story filled with peculiar characters, odd but beautiful sets that remind me of my strange but vivid dreams about places that don't exist. It's hilarious, it's whimsical, it's madness. It's like Wes Anderson and Tim Burton got married and had a baby. It's brilliant.When watching the movie, I was reminded of the feelings I had when I first watched Wes Anderson's The Grand Budapest Hotel. It was a liberating feeling, and I found myself smiling after the movie ended.Friendly reminder to look up the content warnings first as it is rated-R.",khairanie,N/A
37,7,extra pretentious,"This is the most pretentious movie i have seen in ages. Weord angles, weird super wide lenses, YOU SEE IT IS ART!!!! Weird movement, black and white YOU SEE IT IS ART!!!! Directed by...., actors names..... upside down YOU SEE IT IS ART!!!!Constantly reminding you how artsy it is and i must admit the creators were successful. Look at all the nominations!!! Why? BECAUSE YOU SEE IT IS ART!!!!YOU SEE IT IS ART!!!!I still consider direstors early movie Kynodontas to be hard hitting masterpiece. That is the reason why i endured this ""YOU SEE IT IS ART"" movie. But it looks his early days are gone.",hola-kevel,N/A
38,9,Emma Stone at her Best,"I had high hopes knowing that this was a Yorgos film, but was also hesitant because not all of his films I loved... However, this might have been the best film he's done so far. Emma Stone is a scene stealer. If she doesn't get at least an Oscar nomination for this role, I'd be stunned. Stunning set design, cinematography, use of colors, and overall, fantastic story on feminism. Highly recommend this to anyone, though I feel most people would either love this or hate this. Plenty of laughs, but also plenty of endearing moments that truly make you think. Yorgos is an auteur, and I look forward to his future films.",audtothepod,N/A
39,6,Highly pretentious,"I believe this is a watchable movie, with some good cinematography and bits of decent humor. What is irritating though, is its pretentious nature. One cannot get rid of the feeling that the movie is made with a single purpose of winning the prizes, and potentially land Emma Stone an Oscar. Her acting is good, don't get me wrong, but it is so forced and just like - Look at me! I can do this and that, and I will do everything, just notice me and give me that Oscar!The plot (or absence of it), characters, philosophy and ideology of the movie are all superficial and pretentious. Its purpose is to appeal to a 'ticket buyer' by making them feel they came into contact with a masterpiece, while not be deep enough to have a real meaning, which would alienate most of the today's movie-going audience. I guess, in this sense it is a movie of the current times - stupid.",ruslankhoroshvili,N/A
40,8,Poor Things: Weirdly Wonderful (But Maybe Not for Everyone),"""Poor Things"" is a film that definitely lives up to its title. Adapted from the novel by Alasdair Gray, it's a bizarre blend of science fiction, dark comedy, and feminist critique.The ""weird"" factor starts right at the beginning. We meet Dr. Godwin Baxter (Willem Dafoe), a mad scientist obsessed with reviving the dead. His latest project: a beautiful young woman named Bella (Emma Stone) who, thanks to some unconventional brain surgery, possesses both childlike innocence and uninhibited desires. Throw in a menagerie of hybrid animals, quirky characters, and a darkly comedic Victorian setting, and you've got a recipe for something truly strange.But is it good weird, or just plain weird?Fans of director Yorgos Lanthimos (known for his offbeat films like ""The Lobster"" and ""The Favourite"") will likely find themselves right at home. He delivers his signature brand of absurdist humor and unsettling social commentary. The film is visually striking, with a dreamlike quality that perfectly complements the bizarre narrative.However, those who prefer a more conventional story might be left scratching their heads. The plot takes some unexpected turns, and the humor is definitely on the dry, deadpan side.So, should you see ""Poor Things""?If you're looking for a unique and thought-provoking film experience, then definitely give it a shot. Just be prepared for something a little out there.Here's a quick breakdown:Pros: Visually stunning, great performances (especially Stone and Dafoe), clever dark humor, unique story
Cons: Very strange (might not be for everyone), unconventional plot, dry humor
Ultimately, ""Poor Things"" is a film that will stay with you long after the credits roll. Whether you love it or hate it, there's no denying it's a memorable experience.",jwwiseman,N/A
41,7,Objectification of women?,"The film has some entertaining moments, but my biggest problem with this movie is what has also been mentioned here in some reviews. In fact, I think that the message that the movie wanted to send out ended up being the opposite. Most of all, it gives the idea that the person who wrote this has some perverse fantasies about little girls.I can't find much meaning in this movie. I can deal with the idea of the woman who committed suicide and put her daughter's brain in her mother's body, but it's really in the sense of a black comedy, not very deep. It was the premise they came up with to try to explain Bella's story, but deep down, the woman ends up being completely objectified throughout the movie, and it ends up being too long in terms of the number of times the film repeats itself in its message.Overall, the movie was entertaining for me (more at the beginning), the filming and scenery are interesting, and the dialogues too, but it's impossible not to criticize the wrong aspects of it. As I said, the movie is very long, and I made a huge effort to stay awake, because little by little I started to lose interest.",lhvoliveira,N/A
42,1,Horrible Film,"This is the worst film I have ever seen. I regretted not turning it off. I only kept watching since I thought there would be some redeeming value since it was nominated for best film. It was so disturbing to me, it gave me insomnia. The objectification of women in this film is shocking. The fact that the Bella character had the mind of the child does point to pedophilia. The scene with the father bringing his young sons to watch his encounter with a prostitute is disgusting grooming. I was shocked this porn film was not rated NC-17/X. It is sickening Hollywood embraced this film. It has forever changed my view of the film industry. This film is harmful and unforgivable on so many fronts.",mrogfilm,N/A
43,9,Unique and inspired,9/10Unique and inspiredSpoiler,sathwikch,N/A
44,9,"A different universe, a different style.","9/10A different universe, a different style.Spoiler",kguler,N/A
45,9,Best film of 2023!,"Yorgos Lanthimos outdoes himself in 'Poor Things,' crafting what might just be hailed as the cinematic jewel of 2023. This film isn't just watched; it's experienced. Every frame is a mesmerizing work of art, pulling us into a world seen through the eyes of Bella, masterfully portrayed by Emma Stone. Bella, the brainchild of a scientist with godlike eccentricity (a role Willem Dafoe was born to play), embarks on an extraordinary journey. From an innocent, almost childlike being, she evolves into an intellectually awakened force, challenging the norms of a stilted society with her bold exploration of sexuality and intellect. This evolution is not just compelling; it's a breathtaking spectacle of character transformation.The storyline weaves through themes of vulnerability, particularly in the male characters who see themselves as Bella's guardians, only to spiral into madness as they grapple with her enigmatic nature. The film masterfully balances elements of comedy with poignant tragedy, creating an atmosphere that's both hauntingly beautiful and irresistibly engaging. Emma Stone's performance is nothing short of revolutionary, with Dafoe's portrayal of the mad scientist being a stroke of genius. Let's not overlook Mark Ruffalo, whose role in this film might just be the pinnacle of his career.For those who've dipped their toes in Lanthimos's surreal cinematic universe, 'Poor Things' is a mind-bending escalation of his artistic vision. And for those unacquainted, strap in for an exhilarating, boundary-pushing ride. In my eyes, 'Poor Things' isn't just a film; it's a groundbreaking, awe-inspiring masterpiece that stands unrivaled as the film of the year.",masood-bazai,N/A
46,8,Very delightful with a peach of dark humor,8/10Very delightful with a peach of dark humorSpoiler,JuanAsilo,N/A
47,8,Visually stunning,8/10Visually stunningSpoiler,katyrowland,N/A
48,7,"Male fantasy of ""What would I do if were a woman?""","The new film by the visionary director Yo-yo Langostinos is the story of Bella Baxter a young, beautiful woman that has been created by a deranged surgeon by process of transplanting into the corpse of a pregant woman who committed suicide the brain of her unborn fetus and then reanimating the corpse. Bella must now learn how to play the piano, eat, swallow, talk, and, most difficult of all, walk.But that's just the beginning.Ultimately, this film directed by a middle-aged Greek man, written by a middle-aged Australian man, and based on a novel written by a middle-aged Scottish man, is about the empowering story of a young, independent woman who, reborn without social inhibitions, embarks on a journey of self-discovery through fingering, playing with elongated vegetables, sugar dating, sex work, and, finally, bi-curious oral.Edit: It's also a great movie for a first date! Although chances are that you won't get to see your date naked as many times as you've seen Emma Stone.",drebaque,N/A
49,8,"Weird Things: An Unconventional, Bizarre, Intriguing Film","The film Poor Things (2023) stands out as a unique yet very peculiar jewel in Hollywood cinema, marked by its creative storytelling and striking visual aesthetics. The film immediately grabs your attention with its very unusual and weird artistic elements.The cinematography is nothing short of amazing, introducing a blend of black and white scenes that add a layer of complexity and depth and colored scenes. The cinematography is consistently innovative, with techniques that often repeat, for instance, 360 degree shots (fisheye shot), fast zoom-ins and zoom-outs, medium full shots, overhead shots, and Scorsese-like quick pans from left to right. This type of cinematography added more dynamism to the visual experience. The film's use of CGI added an extra layer of surrealism as per its theme. The dance scenes are even more captivating.One of the film's most striking features is its unusual yet compelling use of sound and music. The vintage lo-fi, bending, peculiar vibe of the soundtrack complements the visual narrative perfectly, while the experimental use of musical instruments like the oboe as a bass element in certain scenes is nothing short of innovative. Moreover, the violin orchestra music with Interstellar-like organs plays a pivotal role in enhancing the storytelling. I really liked how the film handled the climactic moments, especially with the powerful use of a single, sustained music note. This technique, like a scene from the film 'Tenet' (2020), brings a distinct and dramatic impact to the crucial moments of the movie.The narrative structure of 'Poor Things' is intriguingly unconventional. Emma Stone's performance is a standout, bringing depth and nuance to her character. Bella's character, living in a patriarchal world, adds a feminist perspective to the film, infused with humor and wit. Her unique accent and quirky personality greatly enhance the charm of the film. The dialogue, while peculiar, is engaging and often humorous. This type of humor in the cinema theater resonated well with audiences. And of course, the rest of the cast like Mark Ruffalo, Willem Dafoe and others made a meaningful contribution to the film that tells the very peculiar and unconventional story.In terms of thematic elements, 'Poor Things' shares similarities with Scorsese's 'The Wolf of Wall Street,' particularly with its more frequent and explicit use of sex scenes.Throughout the film, the initially strange elements gradually become ""the new normal"", demonstrating the film's power to shift the viewer's perception. The film's direction is effectively balanced, allowing for the unique elements without being too overwhelming for the viewer.In summary, 'Poor Things' is a film that pushes the boundaries of conventional visual storytelling. Its originality, combined with a strong cast, innovative cinematography, and a bizarre, out of the box narrative, makes it a remarkable cinematic achievement. However, from the emotional impact, it did not resonate with me.",sinscopefilms,N/A
50,7,Intriguing but difficult to watch,"Interesting concept with great performances and beautiful sets. Definitely not for everyone and at times this is very difficult to watch (for example, when a grown man is sexually touching a girl he knows to be only a toddler, despite appearing as an adult - how is that not repulsive to everyone?!).Nevertheless, some interesting themes explored: the right of women to use men for sex, in a world that generally expects this only from men; the balance between encouraging our children to be curious and have adventures, and being caring and protective. Even the god complexes of science and humans, enabling experimentation with and exploitation of animals (or even other humans...).All in all, a confronting film, with enjoyable performances by (some of) the leads, a couple of funny scenes, but mostly an exercise in pushing boundaries and making viewers uncomfortable, presumably to provoke reactions and debate.",vanessaclark-87160,N/A
