id,user_rating,review_title,review_text,author,date
21,6,The Daily Life of a Maid in the 70´s in Mexico,"The boring daily life of a maid in the 70´s in Mexico is the storyline of ""Roma"". The screenplay follows the life of Cleo, the maid of an upper middle-class family. This is a typical film for professional critics and viewers from the First World. For a Third World viewer, the situations shown in ""Roma"" happen everywhere and every time and are part of the dailylife. The beautiful black-and-white cinematography and the excellent camerawork are the great parts of this average and overrated film. My vote is six.Title (Brazil): ""Roma""",claudio_carvalho,N/A
22,9,A Personal Masterpiece For Cuaron,"I knew very little about Roma before the week it dropped on Netflix. Most of the information I had heard about it was from articles about Netflix trying to get it to play in theaters. I know that there were reports of the company trying to buy out theaters to show this as big as they could. Most film people were talking about it as this epic film from Alfonso Cuaron (Gravity, Children of Men). I was intrigued by the fact alone he was having a new film debut. He's a fantastic artist who does some very interesting things camera wise and storytelling wise with simple stories. I didn't want to read too much into what Roma, only glossing over a byline and hear minor details.This film is his masterpiece. It's also intimate, autobiography tale of a time in his life. But he's never really mentioned by name. The story follows a maid and the family she cares for in the early '70s of Mexico City. The story spans a year in her life. As the saying goes a lot can happen in a year. The film does start off slow. There is some excellent camera work and a lot of one takes that immerse the viewer in the story. About the 30 minutes in the story picks up. Cuaron does a magnificent job of investing you in these characters. IT doesn't feel like a film, it feels like watching these characters in their everyday lives. We go a window into what it's like to live in this era. He fully takes advantage of that.It would be a shame if lead actress Yalitza Aparicio who plays Cleo doesn't get some award recognition. The film is full no stars, just many actors and they all are on their game. Aparicio stands out above all. You feel for her, are scared and happy for her. The emotional range and depth she brings to the Cleo is astounding. If by the end of the film you are cheering for her and shedding tears then you might need to seek help. But the entire cast feels real, not like they are just playing parts. My favorite of them all is the youngest son who tells some fun stories to Cleo in their interactions.Cuaron proves that he is the Oscar-winning director that still has much to show us. His camera work is so good here. The long takes, tracking shots, it all fits so perfectly with the story he is telling. He even shot this film himself. Not collaborating with longtime partner Emmanuel Lubezki. It is a beautiful looking film entirely in black and white. I couldn't see this film in any other way. There is a scene during the holiday season where a group of people is trying to put out a fire in the woods, it's gorgeous. I'd be shocked if he didn't win the best cinematography award at the Oscars.Roma is all around a masterclass in filmmaking and storytelling. The cast is excellent, the story is simple but will suck you in. It's beautifully shot, heartwarming, endearing and hopefully. I would be shocked if this film didn't take home multiple Academy Awards in 2019. For sure it should win for best cinematography and best director. I would hate for this film to get relegated to the best foreign film category. This film should win for Best picture easily. And if I was on the committee it would have my vote.",TheJohnnyPHreak,N/A
23,7,Piece of Art,"Not exactly my flavor of movie, but wow was this a piece of art. The cinematography, blocking, and story was very carefully and beautifully crafted. Amazing homage and story. It's slow paced and a slice of life, but everyone should watch this.",chrisjw-01026,N/A
24,5,Stunning cinematography mixed with pathos and a boring story line,"For the most part, watching Roma was about as interesting as watching paint dry...but not just *any* paint, but the most perfect, precious, beautifully applied paint imaginable. And not just paint in any room, but a room designed to be the best room with the best lighting and the best layout...and, oh, this was paint drying under high humidity conditions so you needed to watch the paint dry in a single, long-flowing take to appreciate the reflective nuances of the paint in all its evolving glory and often from unusually low angles of perspective since that yields special visual treats. Best Director. Best Cinematography. Best Paint Job. Ultimately not engaging.",ilikeimdb,N/A
25,9,Eyegasmic,"I'll confesss, I was hyped for this movie and watched with all the intention to love it. Turns out, that wasn't required.The first thing I noticed and the thing I loved the most about Roma, is the way it's shot. Any other director would have preferred a more vintage black and white look. But Alfonso Cuarón decided to go with a 65 mm lens, giving the movie a pristine, non-grainy look, like a modern day memory of a past. The soft contrast and the bright highlights look beautiful. The fixed camera and slow pans are add to the aesthetics of the beautiful imagery. The framing and composition are meticulous. It is a beautiful looking movie.Next up, the characters. The central character is the maid, Chleo played by first time actress Yalitza Aparicio. She's awesome. She is a silent character. Not that she's mute or that she talks rarely, it's just when you look at her in her maid clothes, doing away the dishes, she'll strike you as a sweet and silent person. I really cared about her character, I was invested. I was scared when she was scared, happy when she was happy and sad when she was sad. That's the movie's biggest achievement in my opinion. The other characters are nicely fleshed out as well, especially the mother's character. The child actors were surprisingly good, too.The story of Roma is a deeply emotional and personal one. But not everyone can relate to it. As of me, I could relate to it and I loved each moment of it.Bottom line, Roma is a visual masterpiece. The plot isn't something groundbreaking, but the presentation more than makes up for it. Don't miss it.",sarthaksash,N/A
26,8,A slow burn which draws you in,"This film starts as if in slow motion and very little seems to happen as we observe the mundane actions of a young woman. I did wonder if I was going to stay the course. Gradually the pace picks up and draws you in to the daily life of the young woman who we learn is the maid, and the life of the family she works for. The ups and downs of life are in this chaotic city are well conveyed with the ordinary and the dramatic side by side. Beautifully shot with every frame counting it has heart and soul and is very moving at times. If it has a weakness it is a lack of narrative drive, it is essentially anecdotal but gripping none the less if you allow yourself to be drawn into this world.",sberridge77,N/A
27,9,Didn't expect to like it.,"Seemed slow and boring. Then I caught the movies pace, felt the warmth of the air just by the striking cinematography, dogs barking, birds chirping. When I find myself talking and thinking about a movie often I realize it had a great impact on me. The love of family including the hired help and genuine real time portrayal of daily life of this family in Mexico impressed me. Thank you for creating a thoughtful movie that varied from the chaotic, action, animated, mindless, typical movie out there these days.",dscarabino,N/A
28,9,Emotional and Beautiful,"This movie is absolutely beautiful. It's full of raw emotions, and although it's just a simple story about a simple family it brought me to tears twice. This is one of the best movies of 2018 hands down. Although the storyline may seem a bit slow, it is overall a masterpiece.",namigalil,N/A
29,N/A,Visually stunning and thought provoking.,Visually stunning and thought provoking.Spoiler,kate_321,N/A
30,7,well made but boring,"I liked how realistic the movie was and that the love the family showed for Cleo was unique comparing to other movies . However, despite most movies this one had no particular challenge or story line . It was like a page torn from someone's diary with no interesting events which might be boring for some people including myself.",ghazaleftekharian,N/A
31,10,A movie for (almost?) everyone,"Apparently there´s a lot of things people agree on. Cinematography, acting, setting. All great. But some IMDb users voiced that it has no story and is a movie for snobs. But is it really?I don´t think so. We follow a young maid who is struggling with her place in society. She loves the kids, is usually not treated that bad, but still, she is their maid and doesn´t have her ""own"" family. She also likes a guy, but doesn't quite seem to be in love. She generally seems unsure about her future. Meanwhile the family she works for struggles itself, as the father spends less and less time at home. These two story arcs intertwine while being set in front of historical events in Mexico.So prepare for some dramatic scenes, some heavy tragedies. Maybe even bring a tissue. You really feel for all characters at the end of the movie, but without it being cheesy, tearjerky or being forced down your throat. Sure, Roma doesn´t follow a tradional storytelling-formula, but how is that a problem?
If that´s not a captivating and emotional story, I don´t know what is.It took me some time to get fully involved with the story and the black and white made some interior shots just a little too grey, confusing and too much to digest.But yeah, since that was my only complaint, that´s as close as its gets to a 10. This should be strong contender for all the upcoming awards.",Kugelausholz,N/A
32,6,Great cinematography but easily forgettable,6/10Great cinematography but easily forgettableSpoiler,darren-153-890810,N/A
33,9,Perfect but not for everyone,"No matter what someone tells you, women are always on their own"".. this line sums up the whole movie; a beautiful movie about women; normal, not so successful or special and yet strong and independent women. this movie is full of beauty whenever it comes to filming techniques or the characters and if you think it's boring or meaningless I won't really tell you anything except, watch it and use your mind because it's not the kind of movie that offers itself to you easily it's not that banal or shallow, it needs some reflexion. but if your goal in watching movies is to put your mind on off mode then this movie isn't for you.",willeasyer,N/A
34,7,This is an exceptional movie,You allow the movie's sights and smells to envelop you in a world surrounded by turmoil and tragedy but held together by love and loyalty.,punchvv,N/A
35,5,I tried,I sincerely tried to get into this movie. I was honestly bored throughout the film. I loved the camera work and get what this was going for. I just could not get invested as much as I wanted to. Not a bad movie. Just not keeping me tuned in. Although I do say again Cinematography was very nice throughout the film.,scoops35,N/A
36,8,An Art,"I really do not remember the last time we had such an art in the theaters, apart from the story line which could be stronger but the production, editing, screenplay and directing such an art is really fantastic. I highly suggest it. True passion, undeniable life facts, pain and challenge.",ashatashkar,N/A
37,10,Really a masterpiece,"Very real and painful.
The best critic is the one you do for yourself so, go and watch it.",sheylapreve,N/A
38,10,A real movie.,10/10A real movie.Spoiler,trollerbrendan,N/A
39,10,"Your most tragic day, is just another day.","This movie shows you life. It shows you that everything goes on, even if you don't. It doesn't matter if you are rich, or you are poor, tragedy hits us all",streetskate,N/A
40,N/A,Not worth it.,"After sitting patiently through mop water and car tires navigating. I was just relieved it was over, and I wish I could get my time back. Artsy, but it ruined our night. The plot comes to a surprisingly uneventful ending that left us wondering what just happened. The answer is, nothing. I'm not sure which movie the critics were watching to give it such a high rating.",bradm-01979,N/A
41,6,Imitation of Art,"Rome has the particularity of being a meticulously crafted movie, with great cinematographic moments, but it lacks essential elements: a good story to tell and interesting characters. It's a film made by someone who knows the technique of cinematographic works of art very well but is incapable of bringing interest to the events or giving a deep dimension to the characters. In fact, it's frustrating how blurry the image we have of the family is, there's virtually no close-up or any emotional or revealing dialogue. The maid's character barely stands out, although due to her natural introversion and submission, her role does not grow in importance. It's not a bad film, but it lacks the artistic and intellectual honesty that the Italian films of the 50s and 60s had, to which it refers openly or veiled on several occasions. Having said that, there remain some anthological scenes, of great cinematographic power, but which are small treasures hidden in a rather conventional and scarcely entertaining story. It is enough to review a film like Pasolini's Accatone to notice the enormous difference in intensity, honesty and artistic level of the cinema to which Cuarón pays tribute.",jhmb2003,N/A
42,9,Totally captivating,"This movie is not for the impatient or the unfocused. If you are in one of those categories, don't even bother. Not all movies are supposed to be easily digestible.I've never watched a movie that felt so real and it's a long time since I've been glued to the screen like this one, not out of suspense, but out of identification and synchronicity.Others have described the stunning cinematography; it is not only beautiful, it tells half the story as well and gives presence. The synthesis of all elements in this movie came together so seamless, there was nothing to do but to give myself away completely for the duration.",Rhov23,N/A
43,6,Needed more of story plot to follow,While the movie wasn't bad it wasn't that good either. The story plot in some instances became boring and uninteresting causing me to lose the story. But to give credit where credit is due the acting was quite good. The Mexican actress who played the part of Cleo did a good job considering she never acted in movies before but was a teacher. The ending was some left to be desired and was a big disappointment. It would have been nice to see the ending go more into depth but sadly didnt.,awesomechefdood-63939,N/A
44,10,Stunning slice of life,"Have a lot of admiration for Alfonso Cuaron as a director. Also really like to love almost all of his films (having been mixed on 'Great Expectations'), though 'Gravity' is one of those more appreciate than love divisive films that also boasted some of the best cinematography and direction of that year. Of his previous films am especially fond of 'Children of Men' and 'A Little Princess' (the film that introduced me to his work and is a personal favourite) in their own way for different reasons.Was really excited in seeing 'Roma', with talks of it being one of the highlights of 2018, one of Cuaron's best films and trusted friends saying how emotional it was and especially praising the cinematography, direction and sound mixing. Nothing was going to stop me from seeing 'Roma' with the praise being as high as that, despite the (from personal opinion) rather condescending detractors being quite vocal, including making ignorant and off-base paid reviews allegations that says more about themselves than it says those they're criticising. After seeing 'Roma', and this is a genuine opinion here, am going to join those praising the film. Praise that 'Roma' deserves every ounce of and more. One of my favourite films of 2018 definitely, and it has been a variable year so that is saying quite a bit, and quite possibly Cuaron's best film.'Roma', being a semi-autobiographical film, is Cuaron at his most personal, both the writing and the direction. One of the main reasons why 'Roma' did such a lot for me was the emotion, with such brutal thought-provoking realism and poignant, without being over-sentimental, pathos it was the film that connected with me the most emotionally. It also was him at his most thought-provoking and there was no sugar-coating, in fact what was also admirable was the not holding anything back pulls no punches approach. It depicted real life situations and struggles and in a way that was relatable and hard not to get nostalgic or moved over.The pacing has been criticised for being slow, it is deliberate but personally was caught up in the emotion and the compelling realism of the very personal story-telling to care. Plus since when has a film being slow ever always being a bad thing? It only is a problem when there's no reason to be and with the subject to me it came over that the deliberate pace for 'Roma' was not an accidental choice. Sure, finding its rhythm is not immediate but it is very rewarding when stuck with (rather than stopping watching after a ridiculously short period of time and then bragging about doing it). The script is sincere and thoughtful, not written or delivered heavy-handedly.Now we get onto what is especially great about 'Roma'. It is a visually stunning film, have not seen cinematography this amazing, varied or clever in a long time and it complements the evocative setting and the strikingly effortless and atmospheric lighting so brilliantly one is truly immersed. Another major star is Cuaron's direction, showing a visual master of his craft and a person clearly passionate and in love with the story he's telling. Both wholly deserving of major awards attention. Same with the sound-mixing which has all three of the qualities that the cinematography has been described has, so appropriate to the mood and enhances it in a way that few other films this year have done so well. As well as the astonishing and very moving breakthrough lead performance from Yalitza Aparicio, as the most compellingly real and rootable character in a film full of them and strong performances.In conclusion, absolutely loved it. 10/10 Bethany Cox",TheLittleSongbird,N/A
45,6,A Visually Beautiful Day,"Roma is mainly focused on the life of a maid to a wealthy family in Mexico City. All shot in black and white the cinematography is quite beautiful and it is interestingly directed . All of the cast are wonderful character representations. The are a couple of compelling scenes that work quite well and are highly effective, but beyond those specific segments of Roma that I am thinking of, I felt that it was unable to maintain or build upon those highlights into the strong narrative that apparently many others seemed to feel. Good for those who loved Roma because I think it was lovingly made. For those who have not yet seen it, check it out and see for yourself.",daoldiges,N/A
46,1,"Boring, Nothing film","After forcing myself to watch this film to the end I just cannot understand the positive comments concerning the film. The film had no interest for me, I felt no emotion, I felt nothing. Someone mentioned the Emperor's New Clothes !!!. After seeing the BAFTA awards and some of the comments I think I have to admit to myself that I know nothing about film art and must be a complete moron on the subject. Some excellent nominations this year and they pick this film. I cannot remember watching a film that had so little interest for me. I have studied the positive comments and still cannot understand why it is claimed to be so good.
Please someone agree with me.",pjaycuk,N/A
47,9,Stunning,"Roma is a breathtaking masterpiece. I had been waiting to watch this movie for two reasons: the first was that I've been following the award season coverage and knew that Roma would be a mayor player this season; the second was that Alfonso Cuarón is one of the leading Mexican directors in the industry and me being Mexican I was dying to see a film that reflected the culture of this country.
The movie follows the life of a Mexican domestic helper who has a special bond with the family she works with. The main thing about the movie is how beautiful and cinematic it is. This is a deeply personal and intimate story, and the cinematography by Alfonso Cuarón captures that and more. I was a little worried the film being black and white, but the end result I can only continue to describes as beautiful.
The story itself was slow pacing, but that's the reason why the movie works so well. It's a slow burn that just keeps going until you realize you deeply care for our main character. The way the story builds is a really great way of Alfonso Cuarón showcasing how perfectly he can construct a story.
Unfortunately, the city where I live in had no theatre showings so I saw it on my tv. This is quality filmmaking at its best, and if your have the chance to see it on a theatre you definitely should grab the chance. Alfonso Cuarón has continued to show how much of a master he is with a camera and I can't wait to see what he does next.",diegojosmer,N/A
48,10,Best movie of 2018,"Every single thing about this movie is arts. Each scene is just painting.
The story will get you I promise. Watch it without any doubt.",sxs1157,N/A
49,9,You will fall in love in Roma,"The most stunning and poetic-beautiful film I have ever seen. Every single shot of the film feels like a character. The continuously-long shots show so much is going on in the backgrounds from the sounds and images of crowds of people, dogs barking, birds chirping to even planes flying by. These don't feel like distractions because the way Cuaron shoots them (also as his own cinematographer this time) makes them feel like they are these moving pieces of art. As the camera slowly pans through the inside of the family's house and the outside of the city and landscapes of the Mexican country, Cuaron's ability to show-not-tell immerses you into family's daily routines but also into the political climate where it reaches a boiling point in a very climatic scene. The digitally-shot black and white imaginery makes Roma feel like you step into old photograph get re-mastered and then was turned into a moving picture.But it is what's in the foreground that is what really captures our attention in the main character Cleo (a great breakout performance from Yalitza Aparicio). She is the maid to this family that lives next door and takes of their house and children. She has become so accustomed to her work routine that she practically cares and looks after the kids as if they were here own family. And family is definitely the theme to best described this film. Throughout the story the father is rarely ever there as though he does not exist. And the lack of one parental figure has certain affects on Cleo's relationship with the kids and the mother, for better and worse. As the audience watches Cleo and become more invested in her personal life throughout the story, the changes in her emotional state begins to affect you.Roma is a film packed with so many tones and emotions. There are many moments that are awkward, funny and quirky. These moments allow these characters to feel comfortable enough to show their spontaneous and optimistic sides. And then there are some where the story takes dark turns that deliver one hell of an emotional gut-punch. And by the end you feel just went through rollercoaster of emotions.I saw this film at TIFF this month and while this film is produced by Netflix to be part of their streaming service, I highly recommend you see it in theatres first, if it gets a wide theatrical release this year, because it deserves to be seen on the biggest screen with great sound quality enveloping a large room. Don't let the first time you watch Roma be on your phone or tablet.",GODZILLA_Alpha_Predator,N/A
50,10,THIS IS AN AUTHENTIC STORY,"The story is genius, I will hardly forget the movie, being a Mexican, it taught me so much, made me cry and so made me happy to know that such a story deserves my tears, no shame, not at all. Congrats Cuaron, I think that this movie is the perfect example on how to do a beautiful piece of art and help a whole country to get motivated to make progress.",memodurans,N/A
