id,author,date,user_rating,review_title,review_text
39,maka12,N/A,10,One of the best movies,"The actors, the script, the scenery make it one of the best movies I have ever seen. The best-played character of the joker is amazing. That's how I imagined him. In the film, he is portrayed as an ultra-intelligent person with a psychopathic ""brain"". Honestly, I was very surprised that someone known for their niche productions would play such a good role as one of the most important characters in the Batman series. Unfortunately, we will probably never see the joker so well again, because Heath Ledger, from unknown circumstances, died. This is sad news. However, back to the movie. The main character, Batman, played by Christian Bale, also shows the character very well. Therefore, my rating for this movie is 10/10."
40,SnoopyStyle,N/A,9,Heath Ledger makes this great,"Batman takes on the crime lords with the help of Lieutenant Jim Gordon and District Attorney Harvey Dent. However an even bigger evil rises to terrorize Gotham.Maggie Gyllenhaal is an improvement over Katie Holmes as Rachel Dawes. Aaron Eckhart adds a good performance as Harvey Dent. In the end, this is Heath Ledger's movie. He overpowers everybody. His early death may have immortalized him, but my opinion isn't inflated. His presence is electric. It helps that his character is so ridiculously crazy. His motivation has nothing to do with power or money which is so mundane. He wants chaos and that is so much more fascinating. Heath Ledger makes this movie great. And it surpasses the series reboot 'Batman Begins'."
41,EVON1TY,N/A,8,Really good but not as 4th best movie of all time. That's just clear.,"In my opinion, this movie a bit over-hyped and a bit over-rated actually. Is this movie better than 12 Angry Men or Schindler's List or The Return Of The King? Absoulutely not. Amazing acting and amazing cinematography and a very good screenplay but not good as the movies that I counted. This is a Nolan movie this can't be bad for real, this is very good actually. But I'm saying it is just not good as Godfather Part II. It's common Comic movies are over-rated sometimes but this is over-rated more with death of Heath Ledger. I think it could be highest rated super-hero movie, I'm truly okey with it, I'm just saying this should be on Top 30~ not in Top 5."
42,big_poppa_hnoudis,N/A,8,The Dark Knight ---- Best Batman Movie Ever.,8/10The Dark Knight ---- Best Batman Movie Ever.Spoiler
43,SimonZW,N/A,9,The Dark Knight Movie Review,"Fantastic, that is the only word i can use to describe how well this movie was made. This movie has everything from dark humor, action to the most dark and horrifying scenes, it is an amazing movie and i have to give credit to the amazing actor Heath Ledger, he did an amazing job in this movie and absolutely nailed the joker, he is definitely the best joker i've ever seen he did it so on point it's fantastic. Overall i think this movie is definitely Oscar worthy and it's without a doubt the best batman movie ever made!!!"
44,airfoyle,N/A,6,"Oh, come on, people, this is not one of the 250 great movies of all time","I will say up front that I have never seen a movie based on a comic book that I really liked, except the animated ones, or the quasi-animated, like _Sin City_. You would think the graphic novel and film would have a lot in common, but in the end they're trading in different kinds of images.This is basically just another Batman movie. Same silly premise, that a super-rich hero battles --- over the shrinking remnants of Gotham city --- villains with seemingly unlimited resources in personnel and explosives.I will agree that Heath Ledger's performance is amazing. Can this be the same guy who played the gay cowboy in that other movie? It is a real pity that he died. I can't help but thinking that if he were still alive, and we were wondering what he would do next with his great talent, this movie would not have an average rating of 9.0 (as of this writing).There are a lot of other fine actors (Morgan Freeman and Michael Caine, for crying out loud) who are basically wasted pretending to take their characters seriously.I did like the heist sequence at the beginning, including the Joker's first few lines and the bit with the bus. Really very droll; gets your hopes up. But, from then on, it's just a lot of people being blown up while the survivors emote angst --- dark, brooding, comic-book angst."
45,Kefka_8203,N/A,5,A most personal opinion. May contain spoilers and cute fuzzy ponies.,5/10A most personal opinion. May contain spoilers and cute fuzzy ponies.Spoiler
46,miscellaneous411,N/A,10,The Dark Knight Delivers,10/10The Dark Knight DeliversSpoiler
47,jeremypbarry,N/A,10,The most spectacular out of dark knight trilogy,"Heath ledger was the main thing here, perfect fit for joker, absolute crazy, yet so tricky . Best acting so far and deserved those oscar !"
48,rakshu-66770,N/A,10,The best comic book movie in existence,There are few movies where you just feel privileged because you get to watch them and are honoured to. This is one of them.
49,yarden-malka14,N/A,10,Undescribable Perfection,10/10Undescribable PerfectionSpoiler
50,Xstal,N/A,8,"Knock, Knock...","There's a villain, full of colour, takes to the stage, a double crossing trickster seeks to enrage, a Mafioso kind of broker, it's the one and only Joker, hands of torment, turmoil, torture's what he'll rage. A triumvirate of Gotham forms a cordon, The Batman, Harvey Dent, Lieutenant Gordon, but they're seduced by the performance, limited by laws conformance, the playmaker relishing, all the destruction. It's not too long before their weaknesses are found, as hostages are taken to compound, ultimatums are presented, prominent profiles are demented, and our hero runs for cover, goes underground."
