id,user_rating,review_title,review_text,author,date
22,10,One Of My Favorite Movies Of The Year,"""The Shape Of Water"" is the new project from writer/director Guillermo Del Toro who brought us Pan's Labyrinth, Pacific Rim, The Hellboy Movies and to an extent The Hobbit trilogy (which gets to much hate). I wasn't a huge fan of Crimson peak, but the Shape Of Water really looked intriguing from the trailers. I sat there blown away by what I was seeing. This is one of my favorite films of 2017. It is unique, original, interesting, intriguing, and weird all at the same time.Sally Hawkins gives a really great performance in one of the most inspirational performances I have ever seen. her character is mute and has no lines of dialogue aside from a dream sequence, but man does she play this character with confidence. The supporting cast also does a really great job, Michael Shannon of course being the next standout, and no one phone sin a performance at all.This film has that old school vibe to it. There is a use of a lot of practical effects, and the makeup and hairstyling is some of the best I've seen on film this year. The amphibian creature, if it is motion captured, is seamlessly integrated into the movie that the use of practical effects looks so appealing.The set designs are also really great. Lots of little details that you have to pay attention to that you wouldn't normally pay attention to. The lighting in these scenes also adds a lot of depth to the movie. There are scenes that are dim for a reason, and some with more lighting for a reason. It is really a great way to use lighting to convey the details of the environment.This is a story that grabbed me from the beginning. Not once was I bored watching this movie. It kept me engaged and there is so much character development that it ended up making me care at the end. Out of all of the characters that you root for, there is not one single character that you end up not liking.And if my memory serves me correctly, there is not one scene of exposition in this film. Not one. There are some ""hints"" here and there as to what is going on in the background, but from what I remember it's not explicitly stated. It leaves it up to you to put together all of the clues and I really like that about this film.I'm happy we got something original in Hollywood. Everyone craves for something original, and then everyone hates it when something original comes out. It was a nice breath to just see something so refreshing instead of plot threads being retreaded and following clichés that we see in movies nowadays. This is one of my favorite films of the year.I am going to give ""The Shape Of Water"" an A+.",TheJediWay9,N/A
23,7,Seeks it's Own Level,"I like a good story and here we have a good story being told. It helps if you are a fan of the Creature From the Black Lagoon and the sequels. Hey, the guy only wanted some company and was willing to do what it takes to get some. In this movie, we are introduced to a sort of fairy tale telling of the world of what if and what could be which exceeds our thoughts but feeds the imaginations. There were a couple of sex scenes that I thought were not necessary at all and one wonders why they are in this? With them gone, this could have taken its place with Beauty and the Beast and brought the lessons to children more. It also ran a little long but for those that like a good build-up they wont' be disappointed. When watching this movie, if one believes there are no accidents, that the heart can prevail by its own rules and not giving up allows it to do so then a treat awaits. The bad guy in this movie was a little over the top and the premise of what to do with the ""creature"" doesn't pass common sense but it doesn't have to either. The movie still prevails. The shape of this water....",Richie-67-485852,N/A
24,1,"She falls in love with a fish, the end.","I usually love Del Toro's movies, his weird gothic fantasy style usually impresses me. But i dont see the hype around this movie, not only is it a boring love story, i cant seem to escape the fact that she falls in love with a fish man, forget that she is a weird confused sad little girl who lives a mundane life, i doubt thats reason enough to fall in love with a fish that communicates like a family pet, i thought it was silly and most definitely out there, the fact it won oscars baffles me, these critics giving their artistic veiws to us mere mortals, its like those pompous art goers who try to justify paying millions for something that looks like a 4 year old doodled while painting at nursery.",ryanmclaughlin-09165,N/A
25,N/A,True love knows no bounds,"12/24/17. Saw this in the theater today and it was worth the price of admission. For those who remember the Creature from the Black Lagoon, then this one's for you. It's a sequel that was well worth the wait. Well, it's not exactly a sequel, it's more like a theme in variation. It's a love story of strange proportions, that is worthy of del Toro's imagination. Hawkins is a sad woman of a certain age, who does janitorial duty at an oceanic research facility. She does not speak, but she can hear. She falls in love with a creature dragged in my Shannon's character. And, typical of sci-fi/creature features of the '50s, anything that is not human deserves to die. Hawkins makes it her mission to save the creature while falling in love with it. Implausible? Sure. Romantic? Absolutely. Catch it for Hawkins's star turn. Let's hope she wins something for this role.",bettycjung,N/A
26,7,Unique and enjoyable,The Shape of Water is definitely unlike any film I've seen this year.It is unique yet set in an older time which adds to its mystery and intrigue. A lonely mute cleaner forms an unusual bond with a different creature with unique abilities. Throughout the film we see the two grow closer and face obstacles from a ruthless agent.The film excels in being unique and pushing the boundaries of what is possible. There are also some unnecessary scenes showing her normal morning routine. Her neighbours character could have been developed as could Octavia Spencer's character.Still an enjoyable experience at the movies. 7/10,Kingslaay,N/A
27,9,Real love under unreal circumstances.,"To communicate or not to communicate. Sometimes is just out of fear that we don't come close to the ones who can give us exactly what we need. They're different, let's stay away. Sally Hawkins in a magical but beautifully real performance invites us to try, to dare. Guillermo del Toro takes us through the paces with extraordinary delicacy and clarity of vision. Thank you.",damian-fuller,N/A
28,7,Beautiful and enchanting,"Only Guillermo Del Toro could pitch, ""It's a monster romance picture that feels like Free Willy meets Amelie in the Cold War era."" But you know what? It works...mostly. (You know, other than the central romantic relationship.) Regardless, it is absolutely beautiful and enchanting. There were points where I felt like this story tried a wee bit too hard, but it never strayed far from what it was. It was an un-apologetically monster fairy tale. If you want it to be something else, you will be disappointed. If you let it be what it is, you will enjoy every minute.",cliftonofun,N/A
29,10,Well well well,My mind has changed since I saw so many pompous critics.Ten stars for the most beautiful romance I've ever seen.,v-55852,N/A
30,7,I fell in love with an amorphous amphibian creature,"This was the first film by del Toro that I have seen, and I believe that he has made a very good impression on me. He has crafted here a tale of magical realism, with a wondrous amphibian-like creature (Doug Jones) who falls in love with a mute human girl, Elisa (Sally Hawkins). In many ways, it really feels kind of like a fairy tale, with a narrator (who is introduced at the beginning and disappears and comes back at the end - it felt kind of slapped on however), a mystical and godly creature and its lover, and the evil antagonist, Dick Strickland (Michael Shannon), rife with selfishness and hatred. Each of the characters are intricately written and detailed, and are each characterized in a unique and interesting way, very unlike most anything I have ever seen, but done so well and obviously it makes me wonder why it hasn't been done that way before. And to fill these characters are actors that give some of the best performances of the year, especially Hawkins and Shannon. Hawkins doesn't speak a single word throughout this film and conveys every bit of dialogue she needs through her face alone, aided by her signing which was so fluid it seemed like she learned American Sign Language in its entirety in order to play this part. Shannon does so well playing the villain that I would have been satisfied if it ended with him winning. These are some characters that you can really get behind and root for, no matter what side they're on. The creature was beautiful. I couldn't tell if it was done practically or with CGI and I think that attests to how well it was produced. And to sum it up, the dialogue and story were held with care and each felt finely crafted. Oh, and I want to praise the film for being ballsy as well, there was a full nudity masturbation scene in the first five minutes that totally caught me by surprise.
But, I don't feel that everything about this story was so finely told - mainly the attempt to humanize the creature. He eats eggs like us, he listens to music like us, and he has sex like us? What? They don't exactly bridge this conclusion all that well and it's never really explained why Elisa is attracted to the creature in the first place, aside from the fact she might relate to it emotionally. This kind of makes the love aspect of the story feel a little shotty. I could understand wanting to protect and care for this beast, but Frenching it? Idk del Toro. It felt like some sort of furry/bestiality porn to me, and everything up to this point was some really elaborate foreplay. Maybe it wasn't that intense, but I still got that feeling at points. Also, the pacing felt kind of weird between the climax halfway through the film and the climax at the end. Everything slows down super quickly and it feels like it's The Shape of Molasses. But the ending I will admit does kind of make up for that. It's safe to say that this is one of the best of the year and I am sure that it'll be nominated for some Oscars in at least some regard.",aaronlbacks,N/A
31,10,Clever and beautiful,"A sweet and beautiful fairy tale for a modern world. So thoughtful and lovingly made! Very clever, it's a shame so many people have lost the patience and understanding to really appreciate how great this movie actually is.",itspinkandfluffy,N/A
32,7,"Beautiful, a sight to behold.","Briefly, a beautiful piece of work. Gorgeous sets, costumes colors, monsters and music. The relationships are interesting and the chemistry is wonderful however, the story is so predictable. Regardless of that it is a sight to behold and worth a watch.",iraxmas,N/A
33,10,Another visually stunning masterpiece from Guillermo del Toro.,"The Shape of Water tells the story of Elisa Esposito(Sally Hawkins). Elisa works as a janitor, at a classified research facility in America, during the Cold War. At the facility Elisa comes across a unique creature(Doug Jones), with whom she forms a strong bond.The Shape of Water is an awe-inspiring film. Director Guillermo del Toro has given us another unforgettable, unique & predominantly visual movie, after Pacific Rim(2013) & Crimson Peak(2015). del Toro is worthy of all the 'Best Director awards, he has been winning non-stop. The visual effects are flawless. Costume designer Luis Sequeira has done a fantastic job with Doug Jones'(who plays the Amphibian Man) body suit. The hauntingly beautiful score by Alexandre Desplat, deserves all the accolades it's receiving. The cinematography by Dan Laustsen & the production design by Paul D. Austerberry are two other strong points of the film. The performances are the highlight of the movie. Sally Hawkins is spectacular as Elisa Esposito. Hawkins masterfully portrays varied emotions, without uttering a single word. Michael Shannon gives the performance of a lifetime, as Richard Strickland. Richard Jenkins is amazing as Giles. Octavia Spencer is outstanding as Zelda Fuller. Michael Stuhlbarg is brilliant as Dr. Robert Hoffstetler. Doug Jones is awesome as the Amphibian Man. The supporting cast is great. The Shape of Water is a must watch. Go & believe in true love again!",Anurag-Shetty,N/A
34,7,"A plethora of old themes and movies updated and put in an adult, creative and nostalgic form.","The movie is a surrealistic, romantic and sometime satirical film which takes the old grade Z ""creature from the black lagoon"" flicks of the 50s and brings them into modern concerns (albeit in a 1962 setting) and adult themes. A Cold War setting, a picture of early 60s racism and the struggles of loneliness are sub-themes that actually blend well.",drrealitycheck,N/A
35,2,"Guillermo Del Toro does ""Amelie"" meets ""Creature from the Black Lagoon""","2/10Guillermo Del Toro does ""Amelie"" meets ""Creature from the Black Lagoon""Spoiler",malcolja,N/A
36,N/A,"Riveting story, great visuals, and emotionally evocative execution","At first glance, the pace of the film seems to move far too quickly. Within the first fifteen minutes, we meet the main characters, the main setting of the movie, the tantalizing merman himself, and start to see the plot developing already. It turns out, rather than being rushed, the film soars through these parts so quickly because it still has so much more to say and show.First off, the film's visual effects, setting, and overall world-building for a sense of Cold War era like technology and culture are very comprehensively developed. From the cars we see, to the casual smoking, to plenty of chauvinism, sexism, racism, fear of the Russians, and pious male self-righteousness, everything fits the time period like a glove. At many points the historical accuracy serves as a stark reminder of the many ways our society was once much more openly bigoted and imposing.My only issue with the visuals would be the merman himself. Seeing him for the first time on screen is jarring, in how low-budget his appearance seems. The merman himself looks like a costume from a movie made in the 60s, very easily a person in a suit rather than an other-worldy creature. With time, the merman's various movements and actions dispel this disbelief, and the immersion of the film comes in to compensate.Most importantly, the story and its execution are absolutely riveting. The phenomenal acting done by the cast, the pacing of the film, the shots, and the musical scores combine in such a way to evoke exactly what the film wants you to be feeling, even if you're aware of the fact. You cringe viscerally when you see characters act villanously. You shout with anger and disbelief at other moments. You feel uncomfortable and weird at other parts. You're tense with suspense and fear and trepidation as the drama develops. The film had me literally on the edge of my seat, almost too much to handle. Some of the best moments of the film get drawn on, seemingly deliberately, before giving the audience a sense of satisfying resolution, hinting at both the film's effect on the audience and how easily the plot could have taken another turn.Overall, I would highly recommend The Shape of Water for its story, its cinematography (and acting), and for the experience.",robertryszewski,N/A
37,7,Guillermo del Toro remembers what ART is,"There are all sorts of different movies going on in cinemas: documentaries, true stories, thrillers, detectives, dramas, fairytales, animation, etc.. What genre would you characterize The Shape of Water to be? I would say it's a work of art.Most of the things we watch lately are ""based on a true story"" and as helpful and educational as it is, it defeats the purpose of art. Art is about expanding your imagination, going above your limits. Exploring ideas that are unreal but yet create real emotions and reactions.I have seen decent amount of movies and one thing that will make me always appreciate the work is the artistic side of it. How innovative was the technique director used? How were the scenes shot? What angle did the camera men take?The story itself plays certain role - it's the main idea that the whole movie is circled around, but HOW you tell a story is equally if not more important for a storyteller. Think about it in a conventional way - we all have friends who can tell the most boring story with enthusiasm and make people laugh, while others can bore you even while talking about intriguing concepts. Same happens with cinematography - talent to tell a story is what cinematography is about, if we look at it at it's very origin.For that, I have to say that Guillermo del Toro remembers what is ART, it's purpose and tricks of great storytelling.I don't want to go into a deep analyse of the movie as it was not made to be thought through million times. It was made to be watched and enjoyed as you watch it. If I were to judge HOW it's made I'd give it a firm 10. The story itself is where I lost 3 points. The story is not original, ""Beauty and the Beast"" variation with more hardcore characters and grimy dark turns along the way that give this green movie a beautiful red contrast (the movie is shot in green-ish tones with a lot of blood in scenes)It definitely triggers some questions about our tolerance to each other. Where do we really draw the line between human and inhuman. How and WHY do we get to decide what lives and what dies?So if you really want some food for your brain, you can find it as well. But I wouldn't recommend taking this movie too deep. Guillermo did an incredible job on creating this beautiful world, that you can watch 2 or 3 times and still don't catch all the details of, so, for the art's sake, dive in with open eyes and ears, take in the whole experience and breath out when you leave the theater. It's quite a magical journey.",bushilomaria,N/A
38,10,"A beautiful adult fairy tale by the brilliant director of ""Pan's Labyrinth""","Guillermo del Toro is today's master of fantasy, having been a childhood lover of monsters growing up in Guadalajara, Mexico, before making some of the finest films of recent years -- from the ghostly horror of ""The Devil's Backbone"" in 2001 to his gothic horror/romance, ""Crimson Peak"" in 2015. Indubitably, however, his greatest film is ""Pan's Labyrinth"", the 2006 film many of us consider the finest fantasy film ever made. Now he's broken new ground with ""The Shape of Water"", one of 2017's most beautiful films.Set in Baltimore in the year 1962 at the height of the Cold War, the plot follows a mute janitor at a secret government laboratory who forms a bond with a captured amphibian of the ""Creature of the Black Lagoon"" variety. Her name is Elisa, and Sally Hawkins plays her with an artistry that seems to reach back to the silent days of Chaplin and Keaton. Michael Shannon, with devoted viciousness, plays the right-wing Colonel Strickland, someone more interested in dissecting the creature for exploitation purposes than he is concerned over the space race with the Soviets. There are also elements of religious allegory (""We're created in the Lord's image. You don't think that's what the Lord looks like, do you?"").Del Toro saw ""The Creature from the Black Lagoon"" on TV at 7 years old and it changed his life. Wishing a different ending for it in which the Gill Man and co-star Julie Adams would consummate their romance and live 'happily ever after', he wrote various scripts of a remake through the years that Universal studio executives wound up rejecting. ""The Shape of Water"" is the result of del Toro's dream, and now today, with more permissive filmmaking allowable, he's able to deal with the previously verboten issue between fish and human. The resulting film is a worthy accomplishment not only for its production design (embodying various shades of green) and its special effects, but also for attaining the level of a genuine adult fairy tale that deals with issues of trust, tolerance, and love in the human condition -- but most of all what it's like to be an outsider (whether a lonely mute woman, gay man, overweight black woman, or an amphibious sea creature). ""This is a healing movie for me,"" del Toro states; one likes to think it would be for viewers as well.",rblenheim,N/A
39,7,Love at the interface between water and air,7/10Love at the interface between water and airSpoiler,RNDorrell,N/A
40,9,Sensational director Guillermo del Toro is back to his roots with The Shape of Water. And it's making a serious splash,"Sensational director Guillermo del Toro is back to his roots with The Shape of Water. And it's making a serious splash.The Shape of Water takes audiences back to the fairy-tale style of earlier movies. The story explores the relationship between mute cleaner Elsa and the creature at the government facility where she works. The premise and plot are a little bizarre, but comfortably so. The plot seems interwoven around some deeper message, as is the case with most of his movies. But there is no explicit social commentary. It is the audience's job to fill that gap.The cold war backdrops The Shape of Water, but it never delves too deep into the background conflict. The cold war element of the movie serves more as a cinematic backdrop than a scathing social commentary, like in Pan's Labyrinth.Del Toro uses a generous amount of tropes, especially regarding Michael Shannon's classic bad- guy role. But with the lighter tone, the movie is freer to explore other themes: love, unity, oneness. Or rather, we are freer to explore the themes within the film.The Shape of Water is at heart a love story, although it feels abstracted enough as to be universally symbolic.Neither the creature or Elsa can speak, and it is through this commonality that they transcend differences of species. And symbolically, other boundaries like race, class, gender, and sexuality. But it's difficult to entirely indulge in the symbolism when the couple grows more intimate with each other. Things get a little strange then, but it's all light-hearted.The creature design was also the best we've seen yet from del Toro. He has always favoured physical costume design over post-production. The amphibian man is no different. He looks all the more real for his physical design. This feels homelier amidst the huge shift towards digital effects in modern cinema. There is still some digital effects, but they aren't noticeable. The amphibian man is of course played by long-time collaborator, Doug Jones, who plays nearly all of del Toro's monsters. His acting is impeccable, as is lead actress Sally Hawkins's.The relationships between other characters is excellently written and performed. The one-sided dialogue between Elsa and every other character is surprisingly evocative. This puts all the more emphasis on Elsa and the amphibian man's relationship.The colour scheme of the movie really sets it out visually. The vast majority of the sets are coloured entirely in varying shades of blue and green: a kind of teal. This reflects the coldness of the outside world, the coldness of water, and also the historical context.",edwardjones-23192,N/A
41,7,I'm in love with the Shape of you.,7/10I'm in love with the Shape of you.Spoiler,aciessi,N/A
42,9,A story about a mute girl and a fish man wanting to smash,"Honestly it was a really good movie. It has a very childish theme to it, but in an adult content setting. Something you wouldn't expect to work, but it did.I don't get the bad reviews. It was a different kind of movie with a happy ending that delivered a pretty good message that love knows no bounds. Yeah the fish man wasn't the most attractive, but the main character didn't care about that. They were both lacking something and they gave each other what the other was missing.It was a super sweet movie and I even got to laugh a couple of times. It deserves the Oscars it got and everyone who disagrees honestly just needs to get their heads out of their butts. This isn't a movie that goes ""YAY BEASTIALITY"" it's a movie that promotes love past looks.",ollaroncool,N/A
43,7,The return of Del toro,7/10The return of Del toroSpoiler,Andres-Camara,N/A
44,9,"An Update of the ""Other"" in our time: Sadly, it is even worse than before.","I am not going to go over all the different aspects of this movie which I hold in high esteem. But I have not seen reviewers really dig into the theme of the monster, an update of The Creature from the Black Lagoon. A fearful society projects its anxieties onto others, particularly those that cannot defend themselves. The period after WW2, were filled with ""monsters"", particularly those that were created from atomic experiments and blasts. ""Them"", the story of the giant ants, in my mind, encapsulates the fear of American society. The little girl in the movie, the last survivor, is so stunned after the mobile home park she lives in, is destroyed can only say, ""Them"" to the authorities asking what happened. But ""Them"" is the other;Them are the communists of the 40's and 50's'""Them"" are the anti-war protestors of the 60's, and ""Them"" is the reaction of a black president elected and then immediately rejected being an ""other"" part of the ""Them"". I have seen criticism of this movie for its treatment of the disabled. That makes no sense. This movie is symbolic and metaphorical,poetry, from a different tradition, a Spanish one, and surreal.",szajagottlieb,N/A
45,7,A Different Kind Of Love Story!,7/10A Different Kind Of Love Story!Spoiler,gwnightscream,N/A
46,1,Really weird and the director is probably a perv,1/10Really weird and the director is probably a pervSpoiler,pd-19490,N/A
