id,author,date,user_rating,review_title,review_text
15,Stevendcravens,N/A,10,Fincher's best since Fight Club,"I have been a fan of David Fincher ever since I saw Se7en when I was 13. I saw all of his films the following week and not one of them disappointed me. That was back in 2003. I loved Zodiac and The Curious Case of Benjamin Button as well, but he really knocked it out of the park with this one. I was fortunate enough to see The Social Network at a screening on 9/16/10 for my college. Eisenberg, Hammer and Sorkin were there and did a Q and A after the film. It was a GREAT experience. All of them seemed excited about the film and rightfully so. The film brilliantly tells the story of college students who go through hell with each other over the credit for Facebook and the damage that comes to all of them because of it. The acting and dialogue were flawless. Eisenberg, Garfield and even Timberlake churn out performances that should get them serious attention come award time. Fincher's direction is also perfect. you can always tell a Fincher film when you see it because his visual style is so striking and The Social Network is no exception. When this is released, please go see it and watch a film that defines a generation and what the world has become."
16,joesiegel,N/A,10,"As complex as a David Fincher movie can be, and probably the movie that defined this decade.","When this movie ends tells us that Facebook has 500 million users, this was the figure in 2010, 10 years later this figure was tripled and now there are more than 2 billion people registered in this social network, it can be said that this film talks about the theme that defined this decade of 10s ""social networks"" although its height began in the 2000s, it is obvious that its frenetic growth happened during this decade, it could also be said that The Social Network defined the decade, as Fight Club defined the decade of the 90s, touching issues of importance and relevance of the time, both making an accurate and deep portrait of their respective generations.David Fincher creates a film as intelligent and cold as his main character, although the story can be reliable and not yet, since Mark Zuckerberg himself has said that the most accurate of this film is the use of his character's clothes , the other characters in the story and even Sorkin and Fincher indicate otherwise, The Social Network is not a documentary, it can be taken as a work of fiction that recreates a situation of betrayals and pure frivolity, does not give us information that we should take as totally correct since it has a certain tone of the famous Rashomon effect; which is that several people testify to a fact until the original version is so eclipsed that it is impossible to find a truth among so many points of view.This movie is undermined by pure irony; Harvard's least associative boy with no knowledge about human relationships creates the greatest source of communication between people today, and the film ends with the creator of Facebook himself waiting that his friend's request to be answered. The direction of Fincher and the script of Sorkin make this film look like a thriller, a dark thriller, when in one of its many layers it is a film about envy and teenage immaturity, one of the greatest qualities of the films of Fincher is that they are very complex, and can cover as many topics as they want.The Social Network with Se7en, Fight Club and Zodiac joins the list of masterpieces created by the hand of David Fincher, one of the artists more prolific of the seventh art.Although I almost never talk about such repetitive themes as the interpretations in my reviews, since it is obvious when the performances are good and not, and most of the reviews say the same about that, but this time the young actors who keep this movie afloat deserve a line of recognition or more."
17,dfranzen70,N/A,6,Over-hyped,"he Social Network, about the intrigue surrounding the founding of the fantastically popular website Facebook (perhaps you've heard of it), is a fine film – but not a great one. That's a little disappointing, considering that David Fincher (Seven, Zodiac, Fight Club) is the director, but the movie isn't much more than a run-of-the-mill history movie about a subject matter – websites – that's not particularly compelling.In 2003, Harvard undergrad Mark Zuckerberg (Jesse Eisenberg, Zombieland) creates a quickie site called Facemash, which takes head shots of female coeds and puts them side by side, allowing male users to rate which one is more attractive. This crashes the Harvard network and brings him to the attention of one of the many posh elite clubs on campus, whose leaders (the Winklevoss twins) ask Mark to create a social networking site for them, but open only to Harvard students.This in turn leads Mark to create Facebook itself, rather than the Harvard-oriented site. It also sets off a chain of events that would eventually make Mark a billionaire, albeit one sued by not only the twins but by his own best friend, Eduardo Saverin (Andrew Garfield), the company's CFO.The movie's how-it-all-came-together theme is interspersed with legal proceedings – both sets – that put everything into a sort of current context. What caused Eduardo and Mark to be at odds? Do the twins have a chance of defeating Mark? And how does Sean Parker of Napster (Justin Timberlake) fit into all of this?More than 500 million people use Facebook presently. It's no longer a haven limited to college students. My mom's on it. If my grandparents were alive, they'd be on it as well. It's a hugely successful tool in so many ways – small businesses can use it to keep in touch with their customers, friends can find their friends anywhere in the world, people can catch up with old classmates, and so on. It's highly intuitive and very user friendly, and it's all free.Making a movie about a website can't be easy. A website isn't three dimensional; it's not exhilarating to watch someone create one. The Social Network is simply not an exciting movie, although it tries really hard to be one. It attempts to show that the intrigue and back stabbing that occurred behind the scenes of its rapid rise into the zeitgeist is riveting, fascinating stuff. But when the movie was over, I didn't know much more about Mark Zuckerberg than I did going in to the theater, and what I learned about Facebook itself was just trivia.On top of that, the legal stuff that's always in the background is just dull, no matter how many snide answers Zuckerberg gives to opposing counsel. We're not talking about the Scopes monkey trial here.On the plus side, we do get a terrific performance from Eisenberg, who shows he's not just another schlubby always-a-victim actor; the role has some real heft to it, and he's amazingly up to the challenge, particularly with the rapid patter that always seems to be coming from Zuckerberg's mouth.Other than that, though, this is almost a generic origin story about a subject that's really not interesting enough to warrant a full-length movie."
18,tarekshabana,N/A,9,"It's less about Facebook, more about Humans.","9/10It's less about Facebook, more about Humans.Spoiler"
19,TruthSpeaks,N/A,6,"Overrated, But It Stays With You","6/10Overrated, But It Stays With YouSpoiler"
20,tsquared226,N/A,10,"Can the ""Facebook movie"" be one of the best of the year? Yep, it sure can...","""The Social Network"" was an incredibly engaging film that, while mainly revolving around the invention of Facebook (and all the problems that the creators encountered both before and after all was said and done), really focused in on ideas and feelings that can be (and are) universally felt through all people, the primary example being trying to fit in. Everyone wants to be accepted (I for one have never met a single human being that has wanted to be a loner), and some will do whatever it takes to get that sort of attention (which tends to lead into bad consequences). In a year where movies have received some of the lowest critical ratings (as well as box office earnings) in recent memory, ""The Social Network"" was, while haunting, truly refreshing and ultimately a triumph in all aspects, whether it be considering the acting, script, or directing. It was a fantastic movie that shouldn't just be among the best of the year; it's so much more important than that. It defines the entire social networking generation, and that is one hell of an accomplishment. Everyone can relate to it one way or another, and that makes it one of the must-see pictures of the year."
21,Smells_Like_Cheese,N/A,7,"I'm thinking of deleting my facebook account, don't know if that's what the movie was aiming for","7/10I'm thinking of deleting my facebook account, don't know if that's what the movie was aiming forSpoiler"
22,iquine,N/A,9,I'll tell you why this is so re-watchable,(Flash Review)Editing and Dialog.The intelligently-written script is machine gunned out at as brisk a rate as the film's pacing echoes the mind of Zuckerberg and the hockey stick growth of Facebook. The chronology flows together with perfection and is complimented by Fincher's slick and glossy atmosphere. The story is spliced between the startup phase of Facebook and the legal battle between the twins and his co-founder. Not sure how accurate the portrayal of the characters are but it makes for an entertaining story which could have easily been boring. Yet another great Fincher film.
23,claudio_carvalho,N/A,7,Geniality and Arrogance Associated to an Absolute Lack of Ethics and Respect,"In the Harvard University, in the Fall of 2003, the arrogant nerd Mark Zuckerberg (Jesse Eisenberg) is an outcast student that shares his room in the Kirkland House with his only friend, the Brazilian Eduardo Saverin (Andrew Garfield). When Mark's girlfriend Erica Albright (Rooney Mara) breaks with him, he blogs infamies about her in his Facematch and breaches the security and hacks the files of the female students of Harvard in a competition of who would be the hottest. His blog has 22,000 accesses and Mark is loathed by the students and gets six months of academic probation. However, he calls the attention of the twin students Cameron and Tyler Winklevoss (Armie Hammer) and their partner Divya Narendra (Max Minghella) that are preparing a social network and need a programmer. Mark steals their idea and invites Eduardo to be his partner in the social network Facebook. Sooner Mark becomes a millionaire, betrays Eduardo and faces law suits from his former friend, Cameron and Tyler Winklevoss and Divya Narendra.""The Social Network"" is the true story of the creation of the Facebook, by Mark Zuckerberg, who is described as an arrogant, unethical, outcast, douchebag nerd. His geniality and arrogance associated to an absolute lack of Ethics and respect makes him an unbearable and despicable character. Fortunately I do not have Facebook. My vote is seven.Title (Brazil): ""A Rede Social"" (""The Social Network"")"
24,Michael-70,N/A,5,"Like The Lead Character, The Social Network Misses The Important Ideas","5/10Like The Lead Character, The Social Network Misses The Important IdeasSpoiler"
25,kindigth,N/A,N/A,The Social Network,"Let's start with the script. It's great. Written by soon-to-be-best- adapted-screenplay-nominee/winner Aaron Sorkin, The Social Network's writing is intelligent and demanding on multiple levels: most obviously, the story is cleverly structured across dual lawsuits, but there's an equal amount of sophistication to Sorkin's character work--Zuckerberg is never quite capable of maintaining a dialog, Eduardo always stops just short of explicating his emotions.Those two characters are wonderfully played by inevitable acting award nominees Jesse Eisenberg and Andrew Garfield--Eisenberg owns the brisk pace of the film while Garfield brings most of the humanity--who anchor a terrific ensemble--SAG best ensemble, perhaps? The film's score is a perfectly atmospheric concoction of electronica from edgy dark horse best original score nominees Trent Reznor and Atticus Ross, and it's all united under the name and vision of David Fincher, who did not win an Oscar for Fight Club or Zodiac or Benjamin Button.All of this is to say two things: this is a really great movie from a phenomenal creative team, and also there are times when the film feels somewhat calculated for accolades--never in the repugnantly safe, crowd- pleasing, middle-brow Benjamin Button sense, but in the sweetly transparent sense of a kid who did all his chores and is suggesting that he might deserve a cookie.You know what? Give David Fincher a cookie. The Social Network is thoroughly intelligent and engaging as a modern biopic and as an examination of evolving cultural currency, and it's also one of my favorite films this year. -TK 10/1/10"
26,daoldiges,N/A,8,I Like the Film More Than I Do Facebook,"I was slow to see The Social Network, with the cast and subject matter it just didn't interest me. I'm glad that I did finally give it a viewing because I found it quite entertaining. It's a solid ensemble cast and Eisenberg is particularly strong. He successfully creates a truly unique character that is nerdy, insecure, selfish, condescending, smug, and a total jerk, and yet one that we want to watch. The scene where his girlfriend (Rooney Mara) simply and deftly explains why girls don't like him is pure gold. I'm curious to see how The Social Network will stand up to the test of time, but for now I found it very engaging and worth checking out."
27,genie-sammons,N/A,7,Undecided,"I have mixed emotions about this movie. I can't say that it was bad. It was well written, well directed, and the acting was much better than I expected. I can't zero in on any huge flaws in that respect. However, I didn't find it entertaining. Interesting, yes, but I was bored. There is no one to root for. All of the characters are assholes and douche bags, so it makes it hard to care while watching the movie.I take that back. I liked Rashida Jones' character, but her role was too small for that to matter.A random tidbit...Justin Timberlake's performance was great. I didn't like his character, but he was definitely a scene stealer. I liked that the previews did not reveal who he was. The reveal was a bit of a wow moment."
28,moviewizguy,N/A,10,You don't get to 500 million friends without making a few enemies.,"On a fall night in 2003, Harvard undergrad and computer programming genius Mark Zuckerberg sits down at his computer and heatedly begins working on a new idea. In a fury of blogging and programming, what begins in his dorm room soon becomes a global social network and a revolution in communication. A mere six years and 500 million friends later, Mark Zuckerberg is the youngest billionaire in history...but for this entrepreneur, success leads to both personal and legal complications. (Sony Pictures)THE SOCIAL NETWORK is not about Facebook. It's about Mark Zuckerberg and the people associated with him and the consequences that arise with the evolution of Facebook. In an even broader sense, it's about friends being driven apart due to money and betrayal. Because of this, it's no surprise that many have already compared this to CITIZEN KANE. And it's not just the similarities in themes that are astounding, it's the quality as well.What makes THE SOCIAL NETWORK so good is the masterfully written script by Aaron Sorkin. The film is filled with impeccable dialog that just sucks you in. It would be no surprise if the film won an Oscar for Best Adapted Screenplay. Director David Fincher also does a great job keeping the audience captivated through and through with a consistently fast pace. Really, you'll probably be drawn to the film's opening argument between two characters than any other scene this year. All right, I'm exaggerating, but you get the point. It's not Fincher's best work, but it's in the top 3.Jesse Eisenberg and co-star Andrew Garfield are the driving force behind this film. Eisenberg does a terrific job delivering the lines as he did while Garfield brings in an emotional aspect to the film. Although both are quite excellent, Garfield's performance is Oscar worthy. Rooney Mara is quickly getting up the ladder after having last seen her in the remake of A NIGHTMARE ON ELM STREET in the beginning of the year. She's just in a few scenes, but she's great in them. I would have like to see her more in the film, though. Apparently, Armie Hammer played two characters as twins in the film, which really blew me away when I found out because I thought they were two different actors. He really distinguished the characters really well. Oh, and if you're worried about Justin Timberlake, don't be. He's really good in here. I also loved Rashida Jones in the few scenes she was in.With terrific performances from the cast all around, a brilliant script, some fine directing by Fincher, and an engaging score by Trent Reznor, it should be no surprise that THE SOCIAL NETWORK succeeded the way it did. Although it's a 2-hour dialog driven film, it absolutely engrossing to watch. If anything, this is probably the closest modern version of CITIZEN KANE that we will ever get in a long time. THE SOCIAL NETWORK is easily one of the best films of the year."
29,caser22,N/A,7,Not My Favorite (spoilers),7/10Not My Favorite (spoilers)Spoiler
30,lyndalfannigan,N/A,9,Wow,"Who would have thought this was the history of Facebook? well - I'm sure it's heavily dramatized. The director did an amazing job here as did the main cast. The music by Trent Reznor and Atticus Ross set the tone so well (and is great music to work out to, incidentally). As I'm sure facebook will be around for a long time, so too will the legacy of this movie."
31,secondtake,N/A,7,"This history of Facebook is exciting--for a awhile. Lots of filler here & great script, great acting.","The Social Network (2010)The rise of Facebook is so sensational in terms of money and culture, a movie about it was inevitable, and it came early in the game. Appropriately. Everything is speeded up in this world, and who knows why turn might make Facebook the next AOL or Nokia.And so it is quite the story. I don't think it's such a great movie in movie-making terms, however, and this flies in the face of a lot of critical acclaim. Beyond the main story line, there are lots of party and social scenes that are meant to display the changing lifestyles of the main characters (much of which is openly inaccurate). These are prolonged enough to lose their point, and after a few of them, they lose their initial interest, too. They are really meant to serve as interesting ways to have dialog about the stellar rise in members and money involved with Facebook.Because of course there is no action in a movie like this. It's mostly dialog. It's about ideas and numbers and watching computer screens. We are led through the initial moments of inspiration, possible intellectual theft, and good luck at the beginning of Zuckerberg's rise. But there are only so many aspects to this rise that can hold interest for us. It is pinned together through a more recent scene in a well appointed briefing room, as a couple of the leading characters give testimony about who really started Facebook. Flashbacks fill up the rest of the film.What to miss? The long and overly filmic rowing scenes (part of which were partly scale models, actually). What not to miss? The lead, deadpan performance by Jesse Eisenberg and the really moving performance that steals every scene he's in by Andrew Garfield. Justin Timberlake is good, too, and will be a separate draw for some. The twins turn out to not be twins--quite incredibly, a body double was the second twin and the face of the first actor was digitally inserted into the second one. Crazy stuff.The writing is superb. Aaron Sorkin is key here, making some of the dialog really virtuosic (including the first scene, a dialog in a bar between Zuckerberg and his would be never will be girlfriend, which took 99 takes, all shot with the legendary digital Red camera). The filming, as such, is really good in a functional way, and with the experienced Jeff Cronenweth in charge (he did minor flicks like ""Fight Club"" and the American ""Girl with the Dragon Tattoo""). And Cronenweth is one of director's David Fincher's big reasons for success.Fincher is a terrific director, and you might say he made the most of a story with little real substance. But I'm not sure that's true. I just saw ""Moneyball"" a second time last week and it holds up really well even though it generally lacks what you would call action, too, and was written in part by Aaron Sorkin as well. I think Moneyball, whatever its defects, is a better movie. Both movies are about contemporary society and the changing way we use computers, and the way people behind the scenes have made this true.Facebook is a story we are all destined to be affected by, whether you learn of it through the movie or elsewhere. Many people are just totally gaga about the crazy amount of money involved, the movie clicks. The title of the book this was based on is perfect--The Accidental Billionaires. So true. For me, though, I'm like Zuckerberg himself. I just don't care about money, and so the main draw in scene after scene was missing. Judge for yourself."
32,isaiahjjohnson,N/A,10,The modern citizen kane,"Same moral, same character arch. It feels lazy to reuse this plot but it's mind bending how well it works."
33,buffingtondakota,N/A,7,Andrew Garfield is Brilliant in this Role,"Wonderful performances from actors. Great storytelling. Honestly, the only reason I don't want to rate the movie higher it because I would have preferred a truer diversity in casting. Andrew Garfield was the heart of this movie and made it special, I would have preferred an actor true to the ethnicity of the character/person. Besides that, Jesse Eisenberg was hatable, which is good since I don't think your supposed to like Mark Zuckerberg. All of the acting performances are great. Would recommend this film to anyone who like learning about ""real life"" events. Armie Hammer playing twins is fantastic, he does a great job of giving each twin their own identity and character with character development. Justin Timberlake is incredible unlikable, but provides a full performance."
34,tas22,N/A,3,Incredibly over-hyped,3/10Incredibly over-hypedSpoiler
35,KennethWasHere,N/A,N/A,"Just as Fincher gave us the definitive Generation X film with ""Fight Club"", he and Aaron Sorkin give us a definitive Generation Y film...","...and that's ""The Social Network"".It joins the ranks of his best, and just like many of his his previous works, has been reviled before it was properly understood.For months before it came out, it was the laughing stock of people who were off-put by the idea of a ""movie about Facebook"" (even though it's easy to look and see that it's about the founding of Facebook and the people behind it), just like ""Fight Club"" is dismissed as a violent film about people fighting, or that ""Se7en"" is just a serial killer movie.Not to get sidetracked, though.""The Social Network"" is filmmaking and storytelling of a high order, that shows the grand irony of a socially inept Harvard student named Mark Zuckerberg who ended up creating one of the largest social phenomena of the twenty-first century (and love Facebook or hate it, it most certainly is that). The story works as an engaging, fascinating character study; at the beginning of the story, Mark is a socially maladjusted reject, and even after several million 'friends' and a few billion dollars later, he remains pretty much the same.The outstanding acting, style and direction, as well as the great script armed to the teeth with sharp dialogue is what people are likely to miss by dismissing it as a mere 'Facebook movie'.Even if it were just a ""movie about Facebook"", why is such subject matter off-limits? Things that have become a large part of our culture shouldn't be reflected in our art? Or, is it because of that? That technology is such a scary thing and needs to be dismissed? The indisputable fact is that everything that's going on with social networking and the world of the Internet is incorporated into the ideas of a certain corner of history, this one, which will be remembered as such, and ""The Social Network"" may very well be remembered as a film to define that era.So please, this is one of the films to see this year. Don't get hung up on the idea that it's just a silly ""Facebook movie"", or else you'll be missing out on an excellent picture."
36,flatearthsunset,N/A,10,Nerdfood,10/10NerdfoodSpoiler
37,michaelRokeefe,N/A,8,Does greed overshadow better judgment?,8/10Does greed overshadow better judgment?Spoiler
38,lambchopnixon,N/A,6,Only the best it could be with such a limited structure,6/10Only the best it could be with such a limited structureSpoiler
