id,user_rating,review_title,review_text,author,date
25,1,Good story... for a porno,"This movie is essentially just a very well-written pornographic film, and there's no reason for it to be. If you remove the unquestionably excessive scenes, it becomes a thrilling tale of deception and cunning, with dialogue and acting that deeply convinced me the actor's truly felt their characters' emotions. But the continuous bombardment of pornography makes it very clear that director Park had no intentions of making a respectable film. Perhaps his intention was to see if he could persuade critics that an overtly explicit work could somehow be considered art rather than pornography? Whatever his motives may be, I now firmly believe that he is a dirtier old man than the dirty old man in his story, and this movie that had so much potential only leaves me feeling dirty too.",JakeBrinkman,N/A
26,10,An exciting mystery,"Park goes back to the origins, with its cinema full of mystery, brutal but mostly exuberant. In his new film, Park, brings surely one of his best works, the plot is set in Korea in the thirties, in a time of Japanese occupation, and focuses on four main characters, Hideko, a Japanese heiress who lives isolated in the camp with Kouzuki, his domineering uncle, Sook-Hee, a newly hired maid, and a con artist who presents himself as Count Fujiwara to teach painting to Hideko. Being divided into 3 parts of lies and betrayals, the film has a huge camera work, abusing well-designed plans and space, both indoors and out, traveling through a mixture of English and Japanese architecture, the film is a breeze in the eyes of so beautiful, from the very accurate track, immersion in the beauty of Japanese erotic literature, the film explores well-developed characters, and of course, returns plot twist on plot twist, as the director knows well how to do, no doubt one of the best films of the year.",kiosilveira,N/A
27,9,Maid in Heaven...,"It's a slightly sordid affair, with plenty of flesh that's flayed and bare, but it is worth a look, it deploys quite a hook, to entice, to entangle, ensnare.A magical and mesmerising story that elegantly delivers and bestows; wraps, engulfs, smoothly flows; charms, chastises and glows - all the attributes your most adoring handmaiden should show.",Xstal,N/A
28,10,Outstanding masterpiece.,"The Handmaiden was an outstanding masterpiece, a pure work of art. It covered the whole spectrum of human emotion: Lust, love, hate, vicious moral decay, and all matters of perversion. And all presented in such a raw and passionate intensity, always keeping you on your toes. And I haven't even stared gushing about the cinematography - simply breathtaking, from start to finish. I quite liked Stoker, but not as much as Oldboy, which was fantastic. But Handmaiden has been my favorite work from visionary director Park Chank-Wook so far. Cannot wait to see what he will baffle us with next.",majasmile,N/A
29,9,Handmaids tale,"I watched the longer Directors Cut of the movie and it is something to behold. A very interesting story, that might have intrigued someone like M. Night Shyamalan too (I always have to think if I wrote that correctly - would be nice if imdb had a feature where it recognized names and helped one out). The story and its pace are fairly easy and slow to follow. There is nudity and adult situations (not sure if they are cut in the theatrical release), but that is not something that should be disturbing the viewer at all. If it does, maybe the movie is not something you should watch (or read up on if there is less nudity in the other cut).Having concenterated way too much on that aspect (it is what it is as someone recently said in a way worse context), the movie is well told and may reprise certain moments to give the viewer a fuller picture of what he experienced - which overall is a nice thing, but some may find redundant. Park Chan Wook is more than Old Boy, if you are still stuck on that (great movie no doubt), and he more than proves it here",kosmasp,N/A
30,10,"Beautiful, sensual, & provocative on many levels","10/10Beautiful, sensual, & provocative on many levelsSpoiler",kriskaiser420,N/A
31,10,there are places that you can't truly understand,"You may have heard Park Chan-wook's ""Ah-gah-si"" (""The Handmaiden"" in English) called an erotic psychological thriller. That's true, but the movie is more. It addresses relationships and abuse. Very well, I might add. I'm not sure how much of it I can describe without giving a lot away. I can just say that you have probably never seen anything like this. There's plenty of sex, but none of it gratuitous.The only other Park movie that I've seen is the bland ""Stoker"", so I'm impressed. I would definitely like to see the rest of his movies. Moreover, I would like to see more movies set in Korea under Japanese colonial rule (a part of history too often overlooked). Not a masterpiece, but one that I recommend.",lee_eisenberg,N/A
32,6,Confusingly both a bad story and great movie?,"This movie left me speechless, both for the quality that's woven into every second of it, and for the wattpad-dy story that it has. I have never seen a movie manage to be simultaneously both of those.Circle of betrayal, abuse, heavy sexual content, a charged love story- this movie has it all. Every single second of the movie your eyes are stuck on the screen, it's every scene is incredibly attractive. The casting is nothing short of perfect.However, the entire story feels like a work of a fanfiction writer, and it also feels like it was written by someone very young and inexperienced. I am not sure if it was intentional, though, the movie has left me very puzzled about that.One warning: the movie is very erotic, so be careful with the setting should you decide to watch it.",xykatexy,N/A
33,10,"An Excellent, Liberating Film","""The Handmaiden"" is a fiercely original bit of erotica that changes the setting of the novel on which it is based from England to 1930s Korea. In an example of narrative sleight of hand that would make Quentin Tarantino proud, director Chan-wook Park tells his story in three parts, each one upending the perspective of the one before and forcing his audience to re-process everything it has just seen.The first part tells the story of a young pickpocket, Sook-Hee, who is roped into a scheme concocted by a sleazy thief posing as a rich count to rob a rich heiress, lady Hideko, of her fortune. The second part tells things from the heiress's point of view, and we find out that she and the ""count"" are actually in cahoots and it's Sook-Hee who's the dupe. Then the third part details the efforts of the two women, who have fallen in love, to double cross everyone and escape to make a life together.""The Handmaiden"" is largely about what happens when women tire of playing the role assigned to them by men and decide to write their own narrative. Storytelling is a running theme in the film, but the stories being told are all about women being sexually used by men at best but almost always suffering in some way, either physically or emotionally, at their hands. When Sook-Hee and Lady Hideko decide they don't like the parts written for them and take matters into their own hands, it's like watching a weary character in a book jump out of the pages and run away from the reader. The women are liberated, and the viewer likewise feels liberated watching them, enjoying the rare film where women are about more than what men do to them.Grade: A+",evanston_dad,N/A
34,7,"The Korean legend returns; more debauched than ever, but funnier too.","I saw this tonight at London Film Festival and Park Chan Wook was there, to answer Q&A. A very special moment to me.I would advise anyone new to Park Chan-Wook's filmography to first explore his vampire flick 'Thirst' which has a similar style. 'Oldboy' is a cult classic, but more of an opium-filled, octopus eating thrill-ride, which this film is NOT, so be advised. I also think having SOME knowledge of Japanese rule in Korea is essential for understanding this film, or it will be above your head. Do some surface-level research on Japanese annexation of Korea and specifically the infamous 'comfort women'.Completed that? OK now you're ready for this journey.Now let's focus on the best part. The villain. This IS the best villain in recent memory. Seriously as far back as Hannibal Lecter. Uncle Kouzuki, is more creepy than Burton's Penguin. Compulsory viewing. I cannot mention anymore out of fear for spoiling the intricate plot. Highly recommended.",jvanhuys1988,N/A
35,4,Pornography and an Over-the-top Plot,"It's pornography (including sadism) interwoven with an intricate, silly plot--if this intrigues you, fine! I had trouble with the absurd set-up to the film, which is (and feels) way too long because the graphic sex scenes are virtually endless. There are three points-of-view, and the film invariably slips out of POV from time to time. That said, the settings, costumes and cinematography. are absolutely gorgeous, as are the female actors. Except for a twist or two, the film goes nowhere and is about nothing. The Korean and Japanese dialogue (as translated) often sounds like a cross between what one would find in a romance novel and hard-core pornography--breathless, over-the-top, no pretense of being remotely realistic. Nevertheless, the reviews have been extremely positive and the people in the audience when I attended seemed really to like this film--I am hard-pressed to understand why. While the characters in the movie are lusting for each other, and making an all-out effort to titillate viewers, I hunger for a story that has character development and a journey worth traveling.",clg238,N/A
36,9,A Sensual and Intricate Masterpiece,"Directed by Park Chan-wook, ""The Handmaiden"" is a 2016 South Korean film that redefines the art of storytelling through its exquisite blend of romance, deception, and psychological intrigue. Based on Sarah Waters' novel ""Fingersmith,"" this cinematic gem captivates viewers with its lush visuals, compelling characters, and a twisty narrative that keeps you guessing until the very end.Set in the 1930s during the Japanese occupation of Korea, the story centers on Sook-hee, a young Korean woman hired as a handmaiden to a wealthy Japanese heiress, Lady Izumi. As Sook-hee becomes entwined in the intricate plot devised by a conman aimed at swindling Lady Izumi, the film delves into themes of trust, betrayal, and the complexities of love.""The Handmaiden"" is a feast for the eyes. Park Chan-wook's direction is stunning, using rich, vibrant colors and meticulous framing to create a lush, immersive world. The film's cinematography provides a sense of intimacy that enhances the emotional depth of the characters' relationships. Each frame is carefully crafted, making it a true visual masterpiece.The performances are outstanding, with Kim Tae-ri delivering a captivating portrayal of Sook-hee, balancing innocence and cunning. Conversely, Kim Min-hee, as Lady Izumi, is both vulnerable and strong, creating a compelling dynamic between the two characters. The depth of their relationship unfolds beautifully, filled with unexpected twists that keep viewers invested in their journey.The screenplay is intricately woven, presented in a nonlinear format that expertly reveals different perspectives and layers of the plot. As the story progresses, secrets and hidden motives are unveiled, challenging audience perceptions and expectations. This narrative complexity is one of the film's greatest strengths, inviting repeated viewings to fully appreciate its intricacy.""The Handmaiden"" is a captivating exploration of love, deceit, and the power dynamics between its characters. With its stunning visuals, powerful performances, and a gripping plot that offers both sensuality and suspense, Park Chan-wook has created a film that transcends genres and resonates deeply with viewers. This is a cinematic experience that should not be missed-a true modern classic that highlights the artistry of filmmaking.",chiragrathod09,N/A
37,9,Burn down all porn!!,"As the Bene Gesserit adage goes:""I must not watch pornography.Porn is the mind-killer.Porn is the little-death that brings total obliteration.I will face my horniness.I will permit it to pass over me and through me.And when it has gone past, I will turn the inner eye to see its path.Where the urge to watch porn has gone, there will be nothing. Only a self-realized individual seeking to have a real relationship will remain.""This movie tackles on a serious problem of Japan and Korea (and weeaboos), two countries dangerously drenched in pornography and childlessness, and this second problem worldwide that is this mental illness of trying to become something they were not really born as.It is a shame this movie itself is hypocritical by having lots of ero/exploitation sex scenes of very questionable necessity though.And worst of all, taking the viewer/reader for stupid by one very incoherent character conclusion for a certain character, by forcefully turning them into a villain, via a misunderstanding that could simply having been avoided by another character informing said ""villain"" (previously neutral at least) of a decision change, since it wasn't even the idea of this ""bad guy"" to begin with.So this plot which could have been perfect, but it decided to go the melodrama path of forced miscommunication to justify itself.",gabriellbraga,N/A
38,10,"Original, daring, fascinating","Not to mention beautifully and cleverly directed.This is the first of Chan-wook Park's films I've seen and if the others are half as good as ""The Handmaiden"" I'm going to see them all. Min-hee Kim stars as Lady Hikeko, a young Japanese woman of wealth and beauty living in an isolated estate with her sadistic uncle in Japanese-occupied Korea in the 1930s. A gaggle of Korean thieves and con artists dream up a scheme to separate Hikeko from her fortune. The idea is for one of them to pose as a Count Fujiwara, seduce Hikeko and then marry her. Aiding this scheme is a pretty little pickpocket named Sook-Hee (played with great skill and charm by Tae-ri Kim).That's all I can tell you about the plot. Rest assured it is fascinating with some very surprising twists and turns. This is also one of the sexiest movies I've ever seen. It is billed as a crime thriller but actually it is the story of a beautiful love affair. Again I will not elaborate since any more information might spoil the film for many viewers.Bottom line: I plan on seeing this again and I seldom watch films more than once, only the great ones.--Dennis Littrell, author of the movie review book, ""Cut to the Chaise Lounge or I Can't Believe I Swallowed the Remote""",DennisLittrell,N/A
39,9,A beautiful and groundbreaking film.,"The Handmaiden (2016) follows a woman who is hired as a handmaiden to a heiress, but is secretly involved in a plan to defraud her. However, not all goes to plan. This was another amazing film from Park Chan-wook. His films are always brilliant and this was no exception! It was such a beautiful LGBTQ story and I'm happy to have watched it.The cinematography was stunning and artistic, with bleak yet beautiful colour palettes, it was always pleasing to the eye. There was some really good shot transitions and I loved the camera tracking too. Overall, the film was just very well shot!I loved the characters and really felt for them, this was helped by phenomenal acting from everyone involved. The dialogue was sharp and witty too. The two main actresses had amazing on-screen chemistry and their characters felt so different in interesting ways, it was beautiful to see them come together.The music and score were equally as amazing, and only added to the beauty and emotion of the film. Also, the sound mixing was effective and the lack of score nearer the end made it so much more powerful and impactful!The film was paced steadily and slowly, with interesting structure as it's split into parts. The tone is mostly very sensual and beautiful, but the film includes some intense twists and turns that dramatic change the tone at times which I liked, this kept me hooked. It was all super unexpected. In addition, it actually gets quite disturbing and there's a lot to digest (I mean this positively). And overall, I loved how the filmmakers pieced the story together.",becky-92346,N/A
40,9,"beautiful, bold, captivating","I have noticed on other occasions that many of the Korean films refuse easy categorizations. This is also the case of 'The Handmaiden', the film made in 2016 by Chan-wook Park. It is a mature film, a film that starts from an English horror-Gothic style novel, moves the action in Korea occupied by Japan in the 30s of the last century, and develops into a synthesis of psychological and erotic thrillers with family saga and social cinema with a strong feminist touch. The personal imprint is very visible, the director that 'Oldboy' made famous in the world manages once again to tell fluently and with a unique visual perfection a Tarantino style story that takes place in a Japanese Hitchcock setting. I think there will be viewers who are bothered by one or the other of the details and scenes in the film, but I don't think many can escape the magnetic charm of the story put on screen by this Korean master. Yes, master. I think that with this film, Chan-wook Park earned - at least for me - the title of master of the art of film.The film has four characters moving in a world that feels like a kind of historical pulp fiction, probably a retrospective satire of the Japanization of the Korean high and ascending classes that happened during the colonial period in the early 20th century. They all imitate Japanese behaviour, take Japanese names, aspire to become or at least look Japanese, which was probably the sign and appearance of the social rise of the period. Kouzuki (Jin-woong Cho), a rich old man, owner of a villa whose architecture mixes Victorian and Japanese styles and collector of an impressive library of precious books and lithographs, raises (severely, not to say cruelly) and educates Hideko (Min-hee Kim) the daughter of his late wife's sister who committed suicide years ago. Does he intent to marry her or does he just use her as a refined object of pleasure for the erotic readings served to his male friends? Hideko has a beautiful dowry, which he tries to get his hands on, same as do the young artist who introduces himself as Count Fujiwara (Jung-woo Ha) and the maid Sook-Hee (Tae-ri Kim), in fact a clever pickpocket who becomes the pivot of a chain of intrigues worthy of a saga of a fallen family, with many hundreds of pages devoured by readers. The plans will change several times, same as the viewer's perspective throughout the film, which is divided into three approximately equal in time parts, in which the story is told and repeated from different points of view.The narrative technique of alternative perspectives has already been used in the world cinema, including that of the Far East, by master Kurosawa for example. Here it seems to me that a new dimension is being added, because the two storytellers are the young Sook-Hee and Hideko whose connection is constantly evolving and oscillating between a master-maid relationship, solidarity facilitated by the shared destinies of traumatic childhoods marked by the deaths of the mothers, complicity , enmity, rivalry and love. It's one of the most beautiful stories of its kind I've seen on screens lately, and Chan-wook Park demonstrates his mastery of psychological characterization, as well as his ability to transform shocking details of violence and sex into functional elements of action. All four acting performances are perfect. Visually, the film is a delight, at no time is the camera neutral, the most interesting and unusual angles serve the story and each frame is studied and staged with the aesthetic refinement of the Japanese prints. Viewers who a priori reject movies that are too violent or which contain too explicit scenes will probably avoid this film anyway. For those who will see it, however, it will be difficult, I think, not to fall under the spell.",dromasca,N/A
41,6,Fetishization detracts from plot,"This movie disappointed me. I knew that coming out of a relatively homophobic country, it probably wouldn't be groundbreaking in that sense, but I still hoped that it would set a good standard for lgbtq movies.The plot itself is great. It follows the plot of 'fingersmith' rather closely, except it is set in 1930's Korea. It has many plot twists and strange characters that keep you on your toes.The cinematography is also, of course, beautiful. The costumes and sets are magnificent and appealing. It has a great soundtrack and also good acting.So why do I give it a 6/10? It mostly has to do with the fetishization of lesbians. The sex scene is ridiculous. They scissor, for chrissakes. No one does that in real life. It is dramatized and obviously panders to a male audience. It does nothing to further the plot. I was incredibly disappointed in this scene. It was a complete waste of 10 minutes (yes, 10 minutes). It watches like porn, the kind made specifically for men.To make matters worse, the two female characters are not very fleshed out. They meet, they have sex, now they're in love. There is barely any conversation between the two. The two lead actresses do a superb job of portraying sexual tension, but it is thrown in your face early on. Being gay was not exactly the norm in the 1930's. It's unlikely that two women would act so, well, gay around each other so soon after meeting. That adds to the idea that their relationship is being used for the sex appeal and not for the plot.Yes, this movie is worth watching. But don't go into it expecting an empowering message for lgbtq viewers. They could have done a lot more with the relationship movie, but instead they decided to play it safe, throwing away an accurate representation of a gay relationship. I suppose the world is not ready for a real lesbian movie.",maddyindahouse,N/A
42,8,"So good, and yet ....","This is a rewarding film to watch. The story unfolds in unexpected ways, with multiple reveals delivering an entirely different outcome to that initially signposted. The actors deliver with conviction. Plus I am a fan of Kim Tae-Ri.Unfortunately these strengths are sometimes subsumed by unnecessary sex and torture scenes. Sure - it's a story that involves both sex and torture - but that does not mean that these have to be delivered in such graphic and extended detail. The makers should have had more faith in the power of the story to draw us in.Otherwise the strengths in my opening paragraph would have merited an even higher score.",wheatley-20230,N/A
43,6,Long movie that you keep watching for great cinematography with lots of details for a small ending,"The Handmaiden disappoints, stretching a tantalizing plot into an overlong cinematic experience. The film drags with excessive detail, turning what could be an engrossing tale into a tedious watch. Although the mystery at its core beckons viewers to stay until the end, sitting through the movie becomes a chore due to its prolonged scenes, especially the explicit performances that feel unnecessarily drawn out. While the cinematography is undoubtedly stunning, capturing each scene with exquisite detail and artful composition, it's not enough to keep the intrigue alive throughout the excessive runtime. These visual achievements, though impressive, cannot fully compensate for the film's tendency to dwell too long on minor elements, which ultimately dilutes the impact of the narrative and leaves you feeling bored. Overall, 'The Handmaiden,' with its promising storyline and exceptional visuals, fails to maintain engagement, making it a beautiful yet ultimately unsatisfying film. Rating: 6/10.""",mohamadrezat-03741,N/A
44,1,Absolutely forgettable,1/10Absolutely forgettableSpoiler,nicroeg73,N/A
45,10,Movie for the weekend,"This kept me at the edge of my seat. If only more producers could make movies like this. I highly recommend this, especially for thriller lovers. It will not disappoint.The film is a visual feast, with stunning cinematography and production design that transports the viewer to a bygone era. Masterclass acting. The storyline is not cliché and can be handled by a mature audience.If you enjoy psychological thrillers, period dramas, or films with strong female leads, then ""The Handmaiden"" is a must-see. I want to say more but I'm afraid I will end up spoiling it. Viewer discretion is advised though.",masiruku,N/A
46,8,Beautiful movie with a but,"The storytelling manages to be interesting, graceful and always surprising, the imagery is impressive and refined to say the least...
A beautiful movie,
but I'm not that convinced by the love story shared by the two main characters, mainly cause their lesbian passion is obvioulsy shoot from a male eye and the prism of his fantasms....that the two ladies awkwardly pull off !",paulinebracq,N/A
