id,user_rating,review_title,review_text,author,date
47,8,Park Chan-wook magic,"Traditional and aristocratic Japanese themes create an easy-on-the-eye picturesque scenery. The film has a captivating flow. The common elements of Park Chan-wook's other works are also present in this masterpiece, but I'd still say this one differs in some areas.Similar to other movies in the director's filmography, 'Ah-ga-ssi' involves psychosexual dynamics, but unlike the others, it is built on them.The twist element that is usually present in Park's films is also seen, but uncharacteristically, it's not revenge-related.The film involves perversion combined with wealth as usual, and oddly, the psychosexual dynamics develop mostly outside the perversion in the movie.We see a clash of social classes in the form of nobles-commoners, pure-sullied, innocent-criminal.One of the best female-centric works I've seen in a long while.Although it's not a static film, it lacks the action element that other movies in Park Chan-wook's repertoire have.Overall, great plot and scenery. Sexually explicit. Not boring, but some parts felt protracted. After one plot point, the movie employs retrospective parallelism and explains every foreshadowing. It's quite entertaining to watch the revelation of these parallels, yet it's less appealing when there are 20 of them.If the film had been shorter in duration, it would have scored 9/10 instead of 8/10.Still, without a doubt, great cinema.""",LazarusKane13,N/A
48,9,A Masterpiece of Deception and Desire,"Park Chan-wook's ""The Handmaiden"" is a visually stunning and intricately plotted psychological thriller that masterfully weaves together themes of deception, desire, and liberation. Set in 1930s Korea under Japanese colonial rule, the film unfolds with a series of ingenious twists and turns, constantly shifting perspectives and challenging audience expectations. Its lush cinematography, compelling performances, and bold exploration of female sexuality and power dynamics make it a truly captivating experience. While explicit in its content, it's handled with artistic intent, serving the complex narrative.Is it worth watching? Absolutely. ""The Handmaiden"" is widely considered a modern masterpiece, offering a unique and unforgettable cinematic journey that will keep you on the edge of your seat.",muzotime_UZBEK,N/A
49,8,"A suspense thrill of twist and turns that questions trust, it's a double cross fueled by hot erotic passion and unexpected emotions.","I for one from time to time check out the Asian cinema mostly the Korean and Japanese works, however this was my first go around with director Park Chan-Wook. And I must say that with this work ""The Handmaiden"" it's an in depth work a drama that's split into chapters, and it's a film that takes twists and turns that you don't see coming. It proves that with lust, and hot unexpected erotic passion that leads to emotions that new life and love is possible for two ladies.Set in 1930's Korea a young woman Sook-Hee(Tae-Ri Kim)is hired to be a new handmaiden for Lady Hideko(Min-Hee Kim)who's a Japanese heiress who's lives on an estate by the country and the palace is a castle spread like with many books to read and much to learn like the arts which involve hand painting. However it's a secret plot that Sook-Hee has with a con man known as the count and that is to defraud Hideko of her large inheritance.Thru it all the film has visions of doubt, trust, and the elements of love and hot erotic passion is taken into new heights as the emotions brought out with Lady Hideko and Sook-Hee twist this plot and little cat and mouse game for a spin and turn that you and even the count didn't see coming. ""The Handmaiden"" is one powerful tale of greed, lust, sex, and hierarchy proving that unexpected emotions take over and win in the end.",blanbrn,N/A
50,10,Just perfection.,"Like everyone else I've watched countless movies in my life. I cannot really say I know any movie better than this one.
Of course one would be biased as a lesbian, but the plot is still amazing other than that and you really just cannot guess out the plot twists.
Definitely need to watch this. I feel my life more complete after watching it.",aozorabsl,N/A
