id,user_rating,review_title,review_text,author,date
45,10,Luc bessons greatest movie,"This is one of my all time favourite films, its a great story of a hired assassin in New York who meets a young girl played by a young Natalie Portman (the daughter of a neighbour) who soon becomes an orphan because of the ruthless corrupt and crazy DEA Police officer played by the fantastic Gary Oldman, who shows one of his best performances in this movie.Its packed full of action including an explosive finale, but its just not an action thriller, its a very powerful and moving story.I have often found it hard to describe the relationship between the ""cleaner"" played by Reno and Portman's character. He I feel sees her as the family he has never had. She obviously has a crush and sees him in romantic way, which he doesn't encourage and struggles to cope with!!! its these unexpected twists in the story and clever sub plot that makes the film stand out from the crowd. its a modern classic and needs 10 stars. Watch and enjoy endlessly",drewconnor,N/A
46,9,"A Gripping, Human Story","""Léon: The Professional"" is an incredible film that goes beyond the typical action-thriller. Jean Reno is perfect as the quiet, disciplined assassin, Léon, and Natalie Portman delivers a stunning debut performance as the tough and vulnerable Mathilda. The film's heart lies in their unique bond-a mix of protector and student, friend and confidante.The cinematography is also top-notch, with Luc Besson creating a gritty, stylish vision of New York City. The action is explosive and intense, but it's the quiet moments of emotional vulnerability that truly stand out.Is it worth watching? Absolutely. ""Léon: The Professional"" is a must-watch film. It's a classic for a reason, blending intense action with a deeply emotional and character-driven narrative. The performances from both lead actors are outstanding, and the film's unique tone makes it a standout in the genre.",muzotime_UZBEK,N/A
47,10,Extraordinary,"I was a teenager when I first saw the movie. It was recorded on VHS tape and it was supposed to be just a good movie worth watching. I couldn't believe how this epic movie ""grabbed my heart"" and I was wordless after the end of it. I am still so impressed every time I watched it again and again. This was the first movie with Jan Reno starring I watched. He became one of my favorite actors with his ""simplicity"" of acting and being the good bad guy. Gary Oldman was brilliant with his mad behavior and strong powerful playing. The little Natalie was the ""icing on the cake"" and she was as good as it was Macaulay Culkin in Home Alone. So I strongly recommend this film to everyone who is looking for a big entertainment.",snaper-1,N/A
48,10,Excellent,"""Léon: The Professional"" is a 1994 film directed by Luc Besson that has cemented its place as a cult classic. Its narrative, a unique blend of action, drama, and an unconventional coming-of-age story, continues to resonate with audiences. Here's a breakdown of the film's key elements:
* A Unique Relationship:
* At the heart of ""Léon"" is the complex relationship between Léon (Jean Reno), a solitary and highly skilled hitman, and Mathilda (Natalie Portman, in her debut role), a 12-year-old girl who becomes his unlikely protégé.* Their connection is born out of tragedy, as Mathilda's family is brutally murdered by corrupt DEA agent Norman Stansfield (Gary Oldman).* Léon reluctantly takes Mathilda in, and she, in turn, seeks to learn his trade to avenge her brother's death. This creates a powerful dynamic, blending elements of mentorship, surrogate family, and a poignant emotional bond.* Character Studies:
* The film excels in its character development. Léon is portrayed as a man of few words, living a regimented and isolated existence. Yet, beneath his hardened exterior lies a sense of vulnerability.* Mathilda is a precocious and resilient child, forced to confront the harsh realities of the adult world. Her desire for revenge is tempered by her growing affection for Léon.* Gary Oldman's portrayal of Stansfield is a masterclass in villainy, creating a truly unsettling and memorable antagonist.* Themes and Impact:
* ""Léon"" explores themes of isolation, violence, redemption, and the search for human connection.* The film's visual style, combined with Éric Serra's evocative score, creates a palpable atmosphere of tension and melancholy.* It has been praised for its nuanced portrayal of the central relationship, which avoids simplistic sentimentality.* The movie has caused conversations, and sometimes controversy, due to the nature of the relationship between the adult Leon, and the child Mathilda.* Legacy:
* ""Léon: The Professional"" has had a lasting impact on cinema, influencing subsequent action and thriller films.* It is considered a career-defining role for both Jean Reno and Natalie Portman.* The film's enduring popularity is a testament to its compelling story, memorable characters, and its ability to evoke a wide range of emotions.In summary, ""Léon: The Professional"" is a film that transcends genre conventions, offering a powerful and moving exploration of human connection in the midst of violence and chaos.",rahuldeep-37247,N/A
49,6,"Has merits, but made me feel uneasy","With it's soundtrack of Bjork and Sting, Luc Besson's film 'Leon' certainly reminds one of the early 1990s. The film also showcases Besson's ability to create a visually coherent and interesting world, in this case a slightly earlier, grottier New York brought to life on camera. But the plot and characters are frankly silly and quite dull, unless one happens to find firearms inherently interesting. What keeps the film watchable is the winning performance from a young Nathalie Portman, who makes her own entry in the canon of precocious movie children. In fact, it feels like a bit of a guilty pleasure to enjoy her, because there's no doubt that the director is playing up her incipient sexuality; and while we may be supposed to laugh at the twelve-year old acting sixteen, I felt, in watching this movie, that the director was encouraging his audience to sexualise the character (or at least exploiting their expected reaction); there's definitely something not quite childish about it. I haven't seen her act better in anything she's made since.",paul2001sw-1,N/A
50,9,leon the professional,9/10leon the professionalSpoiler,auuwws,N/A
