id,user_rating,review_title,review_text,author,date
1,9,Visceral and intelligent - Besson's masterpiece,"Leon is one of the most emotionally intense movies ever made. French director Luc Besson uses everything: actors, music, camera angles, lighting to create an unique experience - ""It's not realism, it's not naturalism - it's heightened reality"" as Gary Oldman very well put it.In ""The making of The Professional"" Besson says ""If I imagine somebody in the street try to knock on my daughter, I kill the guy, in five seconds. I kill him, and I think ""It's in me, I'm a beast!"" On this part we can't forget that a part of us, the genetic things inside are much, much older than The Ten Commandments"". He certainly uses visceral scenes to create very strong emotion  in the movie - the blood running from Mathilda's nose or Stansfield's unforgettable ""EVERYONE!"" are just a couple of examples. The music and the sound are excellent and are used in a masterly fashion - you can hear Fatman's heart beating desperately or a low claustrophobic sound when Stansfield turns to look at Mathilda's father.However Leon does not work only on this primary level, it also has an intelligent story. It may seem to be almost a fairy-tale, but don't be fooled -  just like his character Besson is serious. This movie has a message: without love we are dead, even if we don't see it. Only true love give meaning to our lives: ""everything else reminds me a big yogurt: warm and rancid"" as Mathilda says in the original script, which is available on the net under the name Leon Version 1. Is this true in ""real life""? I don't know but this movie can make you wonder.Then of course there's the sensuality. It's hypocritical to deny it, the camera interacts with Mathilda in a mesmerising fashion. It's not sick and it's not degrading: it's art, subtle and beautiful.Leon is not perfect but it has so many great moments that all its flaws can be forgiven. It's a movie that really should not be missed, unless you are concerned with its amorality. And don't be - Leon is less violent than many action movies and the unusual relationship between the main characters is handled mostly with genuine feeling and tact.",Twinsen61,N/A
2,9,"""I like these calm little moments before the storm...""","Many movies have characters in them who are hired assassins, or ""hit men"". They're the standard ""badass"" character that kills people in order to collect a reward. Most hit men in films have been portrayed as cold, heartless villains (Boba Fett of Star Wars, Vincent of Collateral). Léon, however, flips this cliché on its end, as the hit-man is the kind-hearted protagonist who learns how to love, thanks to a little girl who shows up on his doorstep.Léon begins in a restaurant, with the assassin himself (Jean Reno) taking a contract from his boss Tony (Danny Aiello) to kill a man who's moving in on Tony's territory. The next 10 minutes become an enthralling cat and mouse game where Leon shows the viewers just why he is known as the cleaner: he is extremely good at this job. We also see Leon's human side, shown by his passion for milk, his affection for his plant (whom he calls his best friend) and when he becomes engrossed watching Singin' in the Rain. Leon seems quite content with this life, not seeming to want anything more. That is, until he is forced to take custody of a twelve-year-old girl (Natalie Portman) whose entire family was cruelly massacred by a corrupt DEA agent (Gary Oldman). This is where Leon is forced to change his lifestyle for the little girl, and when she wishes to get into contract killing to avenge her brother, Leon becomes her mentor and protector.Luc Besson was both the director and screenwriter for Léon, and he proves with his sophomore effort that he is no one-hit wonder. Léon is a very fast paced movie, chronicling Leon's training of Mathilda, Mathilda's growing affection for contract killing (and for Leon himself), and the final standoff with Norman Stansfield. Despite all this, Léon also has time to throw in some slower scenes that develop Leon's and Mathilda's characters, expanding on their growing relationship and partnership.Jean Reno does a very good job as Leon, portraying him both as an effective and frightening killing machine, and as a loving and caring father figure. There is almost a childlike innocence to Leon, with him being unable to read and not familiar with most American culture. Reno allows the audience to both sympathize with this character and respect him, an extremely challenging feat.Natalie Portman's breakout role as Mathilda is one of the greatest acted child roles in a film, period. Portman is able to portray childlike innocence combined with an above average intelligence and awareness of the world around her. Although she is young, she becomes extremely interested in Leon and his job, wanting revenge for the gross acts committed upon her. Make no mistake, Mathilda is the true star of this film, and Portman completely shines in the role.In comparison to Jean Reno's fairly subdued performance as Leon, apparently Luc Besson wanted a more exciting and over-the-top antagonist for the film: enter Gary Oldman. Gary Oldman completely overacts his character of the crooked DEA cop, and he does it so wonderfully that he steals every scene he is in. This is without a doubt the greatest performance of this underrated actor's career, as the fun Oldman has with this role practically oozes out of the screen and infects anyone who watches him. While some critics criticized Oldman for his performance, it was actually spot on considering that the character of Stansfield is a drug-addicted psychotic cop who has no problem with murdering an innocent family to get what he desires. The only nitpick I have with Stansfield is his screen time is fairly small compared with Leon and Mathilda; nevertheless he completely steals the show when he does appear.The plot of Léon is fairly straightforward compared to most action flicks, as there are no particular plot twists or double crossings. However, the simple plot works because this is not a plot driven movie, it is a character driven one. That's not to say there is no action in this movie, there are a few great action sequences (especially the spectacular police shootout in the film's climax), but the film mainly revolves around the growing affection between Leon and Mathilda, and how they change each others' lives. Overall, Léon is an extremely well-made action/drama, and one of the best films of 1994.",ConkerBFD91,N/A
3,9,Being a good hitman takes more than merely a willingness to lay down one's life.,"I first saw this in the late 90s. Then again in the mid 2k on a dvd i own.Revisited the remastered extended version last night with my family.This movie is more than just a hitman or an assassin movie.The music is top notch, the characters are very well developed, the action scenes n direction are stylish.But the best part are the scenes between Reno n Portman. Leon is amazingly n very differently portrayed by Reno.There is a Bollywood copy known as Bichoo (Scorpio).The only thing good in the Bollywood movie is that the guy who played Tony gives away all of the hitman's money to the girl whereas in the original, the character of Tony gives only a single currency note to Mathilda n keeps blabbing the same ""safer than the usual bank story"".",Fella_shibby,N/A
4,10,Gripping story with well-crafted characters,"Luc Besson's movie Léon (The Professional) gives us an intense story which is maximized in potential by the casting of the movie done by Todd Thaler.  Every aspect of the movie delivers to the audience and makes an impressive overall package.  Jean Reno plays a character named  Léon who has learned to repress his emotions in order to perform his job as a ""cleaner"", or hit-man.  His secluded world is shattered by the young girl named Mathilda who lives on the same floor as he does in an apartment building. When she turns to him for help, he learns about living a normal life, even if the circumstances which unite them are far from normal.The performance delivered by then twelve-year old Natalie Portman as Mathilda is nothing short of brilliant.  Her ability to relate to others with body movement and facial gestures is matched by few, she really brings raw emotion and believability to a difficult role.  Mathilda and Léon are unexpectedly thrown together, but learn to value life from their chance encounter, and how valuable a friendship can be.Jean Reno as Léon gives us a solemn and calculated character who sets all of his energy on his assignments until her is given something else to care about.  Mathilda gives him the daughter that he never had, while Léon serves as a father and friend to her.  Gary Oldman, as the corrupt DEA Agent Norman Stansfield, offers the viewers an amazingly wired and electrical performance which pushes the envelope.  He moves the story along by his actions.  Oldman offers us a memorable portrait of a sadistically obsessed man who stops short of nothing to get what he wants.The Professional is what movie-making is all about.  Without the overuse of special effects, a large shooting location, or a commercially star studded cast, we are given all that could possibly be asked for in a movie.  Portman, Oldman, and Reno, along with Danny Aiello as the hit-contractor Tony remind us that there is no substitute for great acting. There are elements of comedy, drama, and action, and great original music by Eric Serra adds to the energy the film already encapsulates.  The most impressive thing about the movie is its story which is basic but is maximized by all the other elements which go into the making of the movie. Simply put, an intense and impressive movie.",Methos-7,N/A
5,10,A shameful praise of a fantastic film.,10/10A shameful praise of a fantastic film.Spoiler,Insincere Dave,N/A
6,10,Masterful,10/10MasterfulSpoiler,tjcclarke,N/A
7,10,Very well executed,10/10Very well executedSpoiler,cdsmith-2,N/A
8,10,Where are the accolades?,"This movie is rated 63 on the imdb top 250 movie list, showing that people obviously like this movie, and with good reason. But why the hell didn;t this movie garner at least one single oscar or golden globe nomination??natalie portman's performance was terrific as the emotionally ravaged matildha - best actress nomination for sure.jean reno should have been nominated for a best actor nomination. the fact that the audience is led to feel sympathy and sorrow for a hitman speaks words enough about his performance.gary oldman is fantastic as the corrupt and psychotic cop. his character is so repulsive and chilling, but at the same time so quirky and interesting to watch. best supporting actor nomination.luc besson. when this man will get some kudos for his work i never know. the professional, in my opinion, is his greatest achievement as a director and, considering the fact he has helmed classic cult films such as nikita and the fifth element, the professional must rate highly as one of the best films of the 90's atleast! best film and best director nominations should have been given.but no, it was all too easy to heap praise on the feel good movie forrest gump, and shun the movie that, through its intensity and tragedy, better highlights the value of life and love.",jcapelli,N/A
9,10,An Action Film For Lovers,10/10An Action Film For LoversSpoiler,robbijean,N/A
10,7,a symphony in film,"luc besson will never top this movie. This is his benchmark, his classical composition. Look at the precise, intricate scenes. It's a symphony in cinema. Straight off, it's action. Intelligently shot, and scripted. It makes everything that follows hard to live upto. But it does so easily. It's stylish without being showy, it's deep without being sentimental. And it's just hugely enjoyable. Seeing the friendship between newly orphaned mathilda and skilled assasin leon bloom, is tenderly done. At risk of slipping into a sappy bond, besson keeps it easy on the emotions, without coming off as shallow.The actors are all spot on, most notably the debut from a young natalie portman as mathilda. Showing an angry, sad, pent up, in love girl is no simple task but she breezes through it, touching all the right notes. And jean reno as the title character, is minimal but very effecting. Hard to understand, but easy to relate too. But gary oldman steals it, with his glorious overacting. He's as scary as he is determind. His line delivery is almost perfect. And his fate is very fitting. If only they made more intelligent action movies, then they could contend with this film. But as it stands right now, leon is one of the best action dramas ever made.",Gjay2,N/A
11,10,"Excellent, smart action film.","Luc Besson's ""The Professional"" is sort of a companion piece to his international breakthrough hit ""La Femme Nikiti"", and in many ways it's an even better film. It raises the stakes of Besson's playful women-with-guns theme by making the heroine a 12-year-old, played by a then unknown Natalie Portman. Jean Reno is excellent as her assassin trainer and surrogate father. Oldman is completely over the top in one of his best bad-guy roles, obsessed with both Beethoven and butchery. As a gritty, suspenseful thriller, this film won't leave action fans feeling cheated, but the film is so much more than that. At the center of ""The Professional"" is a wonderful father and daughter-like relationship between two damaged strangers who find solace in each other.",rustysettler,N/A
12,6,"Very good in some ways, problematic in others","When her family are slaughtered by a corrupt DEA officer and his men, a 12 year old girl takes refuge in a neighbour's apartment. A neighbour who it turns out is a professional hitman. She soon convinces him to train her to be his protégée.This was French director Luc Besson's first American movie. It is a follow up of sorts to his earlier chic action-thriller Nikita (1990), with Jean Reno essentially reprising his role of a cleaner (professional assassin), although in this one he is playing a different character. Like all Besson's movies there is considerable style brought to the table with the action sequences once again particularly well-delivered. But perhaps the true revelation of the movie is Natalie Portman who puts in an extremely strong performance for such a young actress, full of charisma, humour and emotional depth. She plays off well against Reno, who is also impressive. Gary Oldman, on the other hand, is pretty grating and annoying mostly as the main villain, a character who is cartoonish and somewhat ridiculous overall.While I do find this film good quality for the most part, with great action sequences and some interesting characterisations, I have to express serious reservations about the director's cut, where Portman's young character is constantly trying to get Reno to sleep with her. Its majorly uncomfortable stuff and really entirely unnecessary. And while Léon does spurn her advances, it's never really very clear that he rejects her for entirely the right reasons. Seemingly in the original script, the characters do actually end up sleeping together, which we can only be grateful never actually made the final cut but it does make you wonder what Besson was thinking with all this questionable stuff. My advice would be to avoid the director's cut and watch this one in the trimmed version, which removes all this contentious material.",Red-Barracuda,N/A
13,2,"Would be a great film, if it wasn't so disgusting","The only reason I'm not giving it 1 star is because the performances were incredible. Gary Oldman was phenomenal, and this was Natalie Portman's first acting credit, and she did so well considering how young she was. But that also segues into the main and irredeemable issue with this movie; Leon and Mathilda's relationship.Mathilda is insanely sexualized and Leon honestly doesn't do a ton to dismiss her feelings toward him. The movie on its own is disturbing, but knowing that Luc Besson married and impregnated a 15 year old girl when he was 31 really sheds a lot more light on the situation. In the international version of the film there are a lot more sexual situations with Leon and Mathilda, and in the original script, Besson went so far as to write in the two of them having sex. It's clear that this film is a reflection of Besson's own deranged life, and unfortunately the spectacular performances and every other great aspect of the film that garnered significant critical acclaim cannot redeem the film. I simply cannot overlook the depravity of a pedophilic relationship, portrayed as some beautiful thing.",saje_,N/A
14,10,One of the greatest thrillers of all time.,"A hitman is forced to look after twelve year old Matilda, who's family has been killed.Leon was and will forever be a masterpiece, it is a thought provoking, dramatic and pretty violent thriller, one that will actually challenge you, making you question what's actually happening in front of your eyes.Violent and bleak in parts, but not lacking some humour, the game of charades for example is a real hoot, and breaks the serious narrative up a little.Best scene for me, the showdown in The Gent's toilet, where Matilda finally confronts Stan, the acting is off the scale.The relationship between Leon and Matilda is complex, but one thing that I noticed, is that every aspect of it is driven by Matilda, not Leon, he just goes with the flow.The acting is phenomenal, there are a trio of first class performances, Jean Reno and Gary Oldman as you'd expect are captivating, but credit to a young Natalie Portman who is on par, defying her young age and inexperience, no wonder.This amazing film still packs a punch.10/10.",Sleepin_Dragon,N/A
15,10,A Brilliant Conflict,"This film, better known in the U.S. as ""The Professional"", is a wonderful and intense film. Jean Reno plays his role as a ""cleaner"" with incredible subtlety. Leon tries to keep his emotions completely suppressed, yet Matilda (in an extraordinary performance by a young Natalie Portman, who is destined to become a very powerful actress into her adult life) bring out in him a new-found joy for life that accompanies his growing paternal instincts. But, the most dynamic element of this film is undeniably Gary Oldman's performance as a wildly sadistic and crooked DEA agent with his own narcotic-induced demons. His obsessions eventually lead him to the brink of absolute madness in his hunt for the cleaner. Truly, this is Oldman's finest performance to date, worthy of Oscar glory, though sadly forgotten. And so, Luc Besson did indeed top his triumph of ""La Femme Nikita"" by far with this masterpiece. Though, I cannot exactly praise his most recent effort with the sci-fi misfire, ""The Fifth Element.""",Sickfrog,N/A
16,10,Masterpiece of violent Characterisations and fast action-shooting,"An interview with Anne Parillaud, in the Evening Standard, 24.8.90, it was said that the message of Nikita is not one of violence but the idea is that people who are full of despair and missing love are not alone.This idea continues in Léon. Léon was Besson's first foray into international film production. The similarities, or parallels, between Nikita and Léon are undoubted. Both the central protagonists attempt to come to terms with their dysfunctionality, to society, against a background of violence, which they both continue to act upon as the agent of someone else. There is no clean difference (we may also include Le Dernier Combat for comparison.) The only difference is gender.I always found that until obtaining the ""Version Integral"" there was a character hole in the plot. The original cut released for US audiences was felt, by Besson, had an ""offending"" scene cut which ruined later scenes. The American test audiences hated it, seeing it as perverse and paedophiliac. The film was still panned by US critics as quasi-child pornography on general release. What it to be understood about this film, and this is what infuriated Besson, is that the film is about pure love. Not sex, which is all the Americans, could see.And so we have ascertained that the characters in Besson's films are, simply, great. Then there is the action which is all the grace and style of Nikita. Typical of Besson's style with fast action-shooting and violent characterisation. This has to be one of Jean Reno's and by far Natalie Portman's best screen performance. To me, Gary Oldman plays his part to the tee, said by some magazines to be the best screen bad guy - it is one of his best performances.Stylisation and excess are hallmarks of Besson's work. Characters are larger than life. Décors are in excess of realism. Besson's characters lack psychological depth. ""The sumptuous and the ornate cohabit with the violent or the vulgar."" Besson's use of excess is also extremely playful mixing violence with humour. Besson's work appeals to the tastes of popular culture and may not please that of the elite - arguably a reason for the rejection of his work by many intellectual film journals.I have yet to hear of a person putting a bad word against this film. There is nothing I can personally fault so I give this film 10/10, a score only two other somewhat different films hold in my IMDb list of 345 films - ""The Wizard of Oz"" and ""La Cité des Enfants perdu"". If you like French Cinema or consider yourself a cinephile you must see the latter.",psiko,N/A
17,10,Besson's masterpiece - action cinema with real heart,10/10Besson's masterpiece - action cinema with real heartSpoiler,Leofwine_draca,N/A
18,10,A Perfect Chemistry,10/10A Perfect ChemistrySpoiler,claudio_carvalho,N/A
19,10,"""If you want the job done right, hire a professional.""","I don't care what you say about Luc Besson or his personality but there is no way that you question the greatness of this masterpiece. I got to see this in the cinema and the bond between Leon and Mathilda is just so pure and amazing as well as the fact that she did this while she was only 13 years old. I agree with the reviews saying that she was hypersexualized and I am disgusted by Luc Besson but in all truth, he managed to make this epic movie which I continue to admire, as well as Sting's song ""Shape of my Heart"" which remains as one of my favourite songs right now which fits perfectly to the end of this movie.",cemoturanli,N/A
20,6,Everything is overshadowed by unusually sexual undertones between Leon and Matilda,6/10Everything is overshadowed by unusually sexual undertones between Leon and MatildaSpoiler,ACollegeStudent,N/A
21,7,Some things I liked some I did not.,"I was very surprised to see that this film received such a high grade. I did not think it deserves it.Things i liked about it. It is the acting of two principal actors, Mr. Reno I like very much from the times of La Femme Nikita, he is a spectacular actor, especially in the roles like these. Natalie Portman is also excellent in a role like this, later in the Star Wars I did not like her that much. I think as a young teenager in this film she is excellent, for the later roles I am not that sure.Things I did not like. Plot is not realistic. I simply do not like that. When is something like this possible in the real life? Never. Also too much violence, but films of Luc Besson are always like that. I guess it has to be that way. Violence and sex sells. Especially if you throw a slight nudge of pedophilia in it.",petarmatic,N/A
22,N/A,Excellent film. Natalie Portman is superb.,Excellent film. Natalie Portman is superb.Spoiler,tr91,N/A
23,5,UnBeLiEvAbLe.,5/10UnBeLiEvAbLe.Spoiler,mallaverack,N/A
24,8,"""I take no pleasure in taking life...""","""...if it's from a person who doesn't care about it.""What really stands out for me (aside from the really excellent direction of the action sequences) is the too-brilliant for its own good script. Oldman,Reno, and Portman deliver lines that would seem goofy if spoken by lesser performers. Oldman especially chews the scenery in a way that's both amusing and utterly menacing. I wonder if his Beethoven obsession is a nod to the ultra-violent Alex from A Clockwork Orange?The American version (""The Professional"") was the first version I saw. I'd originally had no real intention of seeing it because I'd read a pretty savage review of it likening it to child pornography. Clearly this particular reviewer had his head firmly planted in his rear. I'm surprised he could find room what with that tremendous stick in the way. Anyway, once I finally saw ""Leon"" for myself - thanks to my cinemaphile grandfather - I observed no such thing. This wasn't smut, it was love. Leon has no interest in Matilda sexually, but loves her as a father would love a daughter.If you have a choice then go for the longer director's cut. You get about 15 minutes more film - and not just filler. These are scenes that truly expand upon the story.My only complaints are about the almost complete under use of the completely underrated Danny Aiello, and Oldman's single dimensional evilness.",robelanator,N/A
25,9,Walk the Line...,"Leon is a cleaner for his boss, it's like removing bits of debris when you floss, a variety of tools, he always plays by his set rules, now he's taken in a girl he's come across. She purports to be 18 but she's a child, had to grow up quick with a family that's quite wild, now they have wounds, that won't be healed, after messing with Stansfield, that's left her quite annoyed and somewhat, slightly riled. It's a story of revenge and adolescence, of walking a fine line that may cause offence, but there's chemistry and connection, performances played to perfection, quite original, without too much pretence.Jean Reno, Natalie Portman and especially Gary Oldman are immense.",Xstal,N/A
