id,user_rating,review_title,review_text,author,date
1,8,A love story with a twist.,"Sally Hawkins puts in a lovely, sweet, almost sympathetic performance as the central character, it's her delicacy balanced against the harshness of the amphibious man that makes it so interesting.It's not a film I'd sit through several times over, but I have seen it twice, and was as impressed with my second viewing as the first. It is a beautiful film, with the most glorious soundtrack, a feast for the eyes and ears alike.I'm sure there was a social message here, it was perhaps over my head, what I saw was a good old fashioned love story, one with a difference, and a load of eggs.It's sad, moving, funny, it's definitely very, very weird, but if you've seen any of his other movies, then you'll realise the inevitability of that.It's a unique watch, and a rewarding one, 8/10.",Sleepin_Dragon,N/A
2,8,A beautiful movie,"First off, I will say, this movie is not for kids. There are some sex and violence scenes that surprised me, but did add to the story. I found the story enthralling and endearing, along the lines of ET. You'll love some of the characters and absolutely despise others (specifically one). It's a story of innocence and of love. I highly recommend it.",jeff-89177,N/A
3,8,Haunting.,"""When he looks at me - the way he looks at me. He does not know what I lack or how I am incomplete. He sees me for what I am, as I am.""This film was strange, yet haunting. Disturbing, yet poetic. I loved the cinematography, the music, and the moral behind this film. Love is not judgemental, and this film leaves you with an ache in your chest.",iheartmilkshake,N/A
4,7,"Maybe not Oscar worthy, but a unique and captivating film","I must admit that I was surprised to learn that this film won 4 Oscars, though I'm just as surprised by the many negative 1 and 2 star reviews that it has received. In terms of ideas and creativity, 'The Shape of Water' is as good as any film I've seen in the last few years. With a storyline as inventive and unique as this one, it makes for a fascinating couple of hours of viewing and, if you like films that take risks and dare to be different, there is a lot to enjoy about it.For all its ideas and creativity, however, 'The Shape of Water' is lacking in some areas and can make for frustrating viewing at times. The storyline is underdeveloped in areas, particularly towards the end where there are many unanswered questions and the ending itself is a little underwhelming. That said, 'The Shape of Water' deserves credit for injecting fresh ideas into the fantasy romance genre. It might not be worth 4 Oscars, but 'The Shape of Water' is a unique and captivating film.",adamonIMDb,N/A
5,10,Many people misunderstood this movie! There is a twist in the story!,10/10Many people misunderstood this movie! There is a twist in the story!Spoiler,TheKing87,N/A
6,6,The hype of water,"The film starts with an interesting premise: during the Cold War era, a US government research center has captured a strange amphibious creature and the protagonist is a mute cleaning lady. From the beginning the story overflows with symbols if intolerance: towards women, towards handicapped people, black people, amphibious people, immigrants, gays, old people, and so on and so on. It's like it's trying to check all the boxes, see how many it gets in a single row. But while it does this, the story itself just stalls. This is a two hour long movie in which nothing much happens. It shows intolerance, but doesn't go anywhere with it. Yes, we know people are assholes and that during that era, they were slightly worse than now. It does nothing for the plot, which is predictable and boring.The bad man is reminiscent of Pan's Labyrinth villain and the main character a girl with an active imagination, but it is way slower and more poorly executed than Pan's. It is clearly a worse movie than that was. To put it mildly, I am at a loss for why this film won Best Picture. It was visually interesting, but you couldn't take it seriously. It went from metaphor to reality with no regard to the previous context. A villain that seemed to not have a purpose other than being obtuse and evil, a woman who after learning that the creature has bit two fingers off a man's hand goes near it and offers it food from her own hand, a black best friend who's only role is to gossip about her irrelevant husband, some Russian spies that seem more interested in food than in spying, the list goes on and on. It's not like the actors didn't do a good job, it's not that the direction or the sets were faulty, but the story itself was nothing more than a long slow cliche.",siderite,N/A
7,10,Unsettlement at its most beautiful,"So much appealed to me about 'The Shape of Water'. The trailer and story captivated me, Guillermo Del Toro has done some great work prior (especially one of my favourite films 'Pan's Labyrinth'), the critical acclaim and numerous wins and nominations (including a whopping thirteen Oscar nominations as we speak) promised so much as did the talented cast and having Alexandre Desplat on board.Luckily, 'The Shape of Water' didn't disappoint me at all. For me, it's one of Del Toro's best and his best since 'Pan's Labyrinth'. It's a beautifully transfixing adult fairy tale with elements of 'Beauty and the Beast', 'Amelie' and 'Creature from the Black Lagoon', while showing a real sense of unsettlement and affectionate nostalgia from film and music from the golden age.Everything here absorbs, right from the visually gorgeous, musically hauntingly beautiful and really quite wondrous opening to the genuinely unnervingly tense and powerful, in emotion and violent action, climax. The love story is very touching and has a lot of heart, the conflict provided by the as ice cold monster a villain as one can get brings chills up the spine, Elisa and Zelda's friendship has warmth and that between Elisa and Giles has charm and poignancy.'The Shape of Water' is one of the best-looking films of the year bar none. There is a real fairy-tale, in both sheer other-worldly beauty and sometimes unsettlingly nightmarish, look to the cinematography. The production and costume design are meticulously detailed, evocative (one really is taken back to the Cold War's look and atmosphere) and atmospheric, while the creature design clearly looked like a lot of care and effort went into it and the editing has a natural and cohesive flow.Alexandre Desplat's music score is ethereal and hauntingly beautiful, especially so in the opening scene, one of the best scored opening scenes of the year. The vivid sound mixing and editing helps it a lot, and the pre-existing music also makes a positive impression with the rendition of ""You Never Know"" touching the soul and haunting the mind. 'The Shape of Water' is one of the best examples of Del Toro's mastery of story-telling when the material is particularly good, like it is here and in 'Pan's Labyrinth', with all the different elements ideally balanced and just as strong individually.Regarding the script, it's tightly structured, poetic, poignant, nostalgic, thought-provoking and with nothing inconsequential. What is done with the monster is a revelation, not just because the design is so rich in detail, expressive and real but Doug Jones masterfully brings nuances, chills and heartfelt emotion and makes the monster much more than a creature design that looks good but with no soul.Can't fault the acting either. Sally Hawkins is one of the finest recent examples of conveying so many different emotions and nuances without saying a word, my personal favourite as of now of the nominees for this year's Best Actress Oscar category (yes even more so than Frances McDormand for 'Three Billboards Outside Ebbing, Missouri').Octavia Spencer is humorously earthy and sympathetic and warmth and sincerity shines through every aspect of Richard Jenkins' performance. Michael Shannon has rarely been creepier than he is here and Michael Stuhlbarg is also fine.In summary, unsettling and truly beautiful, one of the year's must sees. 10/10 Bethany Cox",TheLittleSongbird,N/A
8,6,"Okay, but hardly Oscar-worthy","It is the mid-1960s. Elisa is mute, and a cleaner at a US government experiment facility. Her life is quite mundane and unfulfilled. Then the facility starts on a new project: the US government has captured a man-fish hybrid in South America and now they are seeing if the creature's unique physiology could have some uses for humans, especially for astronauts. Elisa becomes attached to the creature.The winner of Best Picture at the 2018 Oscars, though difficult to see why. A pretty basic movie - a linear romantic drama with one-dimensional characters, cartoonish, badness-laid-on-so-thick-it's-laughable villains, conventional plot development and a fairly predictable ending. It's not that profound or original in its themes or development (unless the viewer has only seen a handful of movies in their life) - quite dumbed-down (though that might be more a reflection of modern audiences than anything else). If it wasn't for the excellent CGI, the sentimentality, the slickness of the plot development and some of the performances it would be just another B-grade creature feature.Part of the problem is that director Guillermo del Toro tries to steer a path between fairy tale and gritty drama, and thus ends up with something that is tonally jarring and inconsistent. The movie from the start has a light, airy feel, the ideal set up for a sweet, all-ages drama. There's even some funny moments to help this along. Yet, interspersed with the lightness are several adult-orientated scenes. Even as the movie becomes darker, bloodier and grittier, del Toro still tries to cling to the fairy tale side.Made as a plain fairy tale-like drama, suitable for all ages, this would have worked a whole lot better.Not that it's that bad though. The movie moves at a decent pace and is quite entertaining. There is a decent level of intrigue and tension and Sally Hawkins puts in a great performance as Elisa.",grantss,N/A
9,8,A Lagoon of Longing & Love...,"It's a time when being different was discouraged, by how you looked, by how you hooked, by how you foraged, in a world of prejudice, the overwhelming emphasis, was to align, to toe the line, to be acknowledged. Elisa's mute, but she still has things to say, using Zelda as a surrogate airway, together they both clean, where there's things that go unseen, behind one doorway there's a place she likes to stay. In this place something's imprisoned and interned, Elisa shows it love, the tides begin to turn, a connection has been made, it's time to escape and evade, logistically that causes some concern.Sally Hawkins is as spectacular as ever in an imaginative tale that reflects a world of the past, but not forgotten or disappeared (sadly).",Xstal,N/A
10,N/A,WOW. Delightful.,WOW. Delightful.Spoiler,theminorityreporter,N/A
11,8,A fairy tale for troubled times...,"The Shape of Water, the Oscar winning film about an unlikely love between a humanoid amphibian and a mute woman set in the early 1960's. The movie was greatly directed by director and screenwriter Guillermo Del Toro and acted by award winning actress Sally Hawkins with supporting actress Octavia Spencer. The movie is full of hope and desire as the lead characters explore love in a unique way that is different and unnatural. The movie will have you shed tears, in suspense, and thrilled by shocking twists and events.""Unable to perceive the shape of you, I find you all around me / Your presence fills my eyes with your love, It humbles my heart, For you are everywhere.""
-Giles, The Shape of Water",FandomFanatic21,N/A
12,7,Watch This!,"While I'm not into 'creature from the deep' type movies, this is not really one of those. It is more of a love story like I've never seen before...There really wasn't any room for 'spectacular' acting, though the whole cast did their job delivering the character they were assigned.The wardrobe and props departments also did a great job giving the film a 1950s type of look and feel. The same should also be said of the film crew.But, back to the story...There were a couple of times I expected a completely different reaction from characters (no spoilers). However the reactions were delivered smoothly, so smoothly, in fact, that they didn't bother me, or make me 'dwell' for longer than a moment.Like I said near the beginning, it is a love story, of sorts, with a sci-fi / creature from the deep sort of twist to it, and, once again, no spoilers, there is a betrayal that goes on, but a betrayal that has no pain...There is no reason this film should get less than a 7 out of ten.A film truly worth watching, no matter what you prefer. It has a story that it delivers, and a story that is easily enjoyed.And, probably best watched by mature audiences :)",juliancooper-935-75705,N/A
13,1,One of the worst Best-Picture movies of the 2010's.,"I'm going to be fully honest and blunt here. I absolutely, wholeheartedly did not care for this film. In fact, my jaw literally dropped open when it was announced the winner for best-picture that year. It's hard to say which movie was more deserving of that award, but it certainly wasn't this one. I found none of the characters likeable and the man in the fish costume to be bizarre and off-putting to say the least. I came in watching this film because I'm a fan of Octavia Spencer, but not even she could save this garbage of a movie.To sum of my thoughts, The Shape of Water is easily one of the worst Best-Picture movies I've ever seen.",ReelDreamer3790,N/A
14,N/A,Beautiful film,"This film was extremely imaginative and gorgeously shot. At the heart of it, the film is about a girl who falls in love with a fish. But it adds so many gorgeous elements to it to make it feel like you are watching an epic. The acting is phenominal, especially Sally Hawkins and Richard Jenkins. Worth checking out!",JennFilms,N/A
15,6,Strange little film,This was not at all what I thought it was going to be but I watched it all regardless. Very strange but actually not a bad film really.,jeanette-sadler78,N/A
16,10,Mesmerizing,"Typical for a beautiful movie to be underrated by most people. The difference in meta and user score was to be expected.In my experience, this movie was captivating from the first scene and ended on a high note, with a simple frame, music and quote. Del Toro takes you on a journey, that never goes full-blown fantasy. The minor details in both film and music are sublime. It really brings the story to life. In my opinion, this is one of those movies that don't need any questions. You have to experience is.Perhaps it is a story that is only enjoyable for people that daydream. The ambiance and message are set up in a way, a hopeless romantic could feast on for days. Seeing as most Hollywood movies are complete rubbish, this one really shows what a movie is capable of. Bringing the love of a celebrated director on screen. Go see this movie!",jellejeremiah,N/A
17,7,"Interesting plot. Fantastical beast romance, sprinkled with little action.","Everything was on point. I really loved how the story panned out. The creature was well designed, unlike most monster movies they actually hinted us answers about the creature. Except there were lame decision making cliché sprinkled all over. Other than that, i couldn't complain more. Story could've been much more vast. The 60s backdrop was amazing too. People shouldn't miss this movie. Beast and beauty movies always have a flamboyant effect on me.",loopinthoughts,N/A
18,8,Another Beautifully Visual-Driven Film from Guillermo del Toro,"One of the most impressive parts of The Shape of Water will probably go unstated by many, because it is easy to overlook. It is stunning how much chemistry a woman who never talks and a fish monster can have. The energy between them radiates, and I had to keep stopping myself to consciously think about what a feat that truly is. As a direct result to how great the writing, directing, and performances are, this relationship between a woman and a monster never feels strange. If done by lesser talent, this could have come across as very weird or wrong. But del Toro crafts this film in such a way that it never comes across in this manner. In fact, in feels only natural, and that is applause-worthy on his part. That is the single biggest thing that Del Toro needed to pull off flawlessly, and he rises to meet the challenge. As with every Guillermo del Toro movie, the production elements are all spectacular. Del Toro really has a great understanding of mise-en-scène, something I'm continuously taken aback by every time I watch a movie of his. His cinematography isn't usually something that lunges out at you and calls attention to itself; rather, it works to very subtly draw you into the film. I do very much like cinematography that stands out and pops, but there is also something to be said for more the subtle kind of shooting a film. Del Toro has a strong hold on his production design. From the set design to the costume design to the color palette, every del Toro movie has a clear direction that is unique to its own story, and this film is no exception...",themovieparadise,N/A
19,6,above all it is a film about feelings,"By subverting and paying homage to all sorts of styles and genres, Del Toro creates his own style and his own genre in The Shape of Water, a film that will hopefully live on for generations and be considered a masterful classic by future filmgoers. Many people will hate it (there are already plenty of reviews on this very site that are unreasonably negative, which is always bound to happen when someone creates a work of art that is genuinely beautiful and creative and is also willing to take people out of their comfort zones and be totally weird and have serious moral questions and thought provoking statements to make), but many people will, and should, love it until the end of time. It is a moving, touching, thrilling, frightening, funny, and romantic hybrid of the whimsical fairy tale, the classic Universal monster flick, the Old Hollywood melodrama, the surrealist film, the fantastically foreign art house masterpiece, and probably tons of other things to. The characters are well developed, Del Toro's lens has a profound understanding of human emotion that makes me want to cry as I reflect upon this simply flat out majorly f*cking brilliant movie...that's enough of my talking, just see it!",framptonhollis,N/A
20,8,"A part fantasy romance, part monster thriller that could only come from the mind of Guillermo Del Toro.","A mute janitor falls in love with a fish man during the Cold War 1950's. That's about as simple as you can describe the plot of Guillermo Del Toro's new film The Shape of Water. Del Toro has always had in interest in monsters for his films. No matter how scary or deformed they look, they always have human traits that connect us with them. In this film, Del Toro has crafted his most likeable monster yet and tells a totally original story (trust me) that is part romance, part thriller.We follow the life of a janitor without a voice, Elisa Esposito (Sally Hawkins). She works in an underground facility alongside her co-worker, Zelda (Octavia Spencer), who talks enough to make up for Elisa's silence. One day a secret test subject is brought into the facility by the psychotic Strickland (Michael Shannon). The subject happens to be an amphibious-human hybrid creature that was found in the Amazon and has been brought back to America in order to be dissected and studied. After interacting together a few times, Elisa and the creature begin to form a special bond of love. Elisa recruits her neighbor (Richard Jenkins) and a sympathetic Russian spy (Michael Stuhlbarg) for a plan to break the creature from his chains and allow him to return home.The plot carries both a whimsical and serious tone to it. They mostly go together well as we get a fairytale that isn't afraid to embrace a childish feel with adult actions. However, GDT goes overboard once with a song and dance number that comes close to throwing the whole film off during its most poignant time.This is one of GDT's most mainstream films (apart from Pacific Rim) and is a great way for people unfamiliar with his work to be introduced. He expertly uses his monster experience to make a film that carries a realistic and fantasy tone.He also makes a very brave film that doesn't shy away from unconventional material. We get to see Michael Shannon having sex after his fingers get severed, political assassinations, and a self-pleasuring scene involving an egg timer. Oh, Elisa and the Amphibian Man also experience, let's just say, a special physical connection.The most impressive aspects of the film come from the behind the scenes work. The camera is brilliantly manned by Dan Lausten. It flows freely between the sets to give the film a romantic fantasy feel, but he also uses constant rain, dark colors, and confined spaces to make it feel like a cold war noir.The production design is also outstanding as each set piece is designed with care and precision. It's astonishing that this film was made for only $19.5 million because it looks like it cost more than triple that amount.The actors create one of the best ensembles of the year. They all carry their weight when matched together and make their characters interesting to watch. Hawkins is perfectly cast and leads the show with her signature shy look. She gives the most compelling and passionate performance of the year, all without saying a word.Richard Jenkins also gives an award-worthy supporting performance as Elisa's neighbor, Giles, who is going through a midlife crisis in terms of his career and sexuality. His scenes with Hawkins are astounding, but the ones with him alone aren't as great and take away from the important story.While not breaking any new ground, both Michael Shannon and Octavia Spencer do what they do best. Shannon gives his trademark evil, unhinged authority performance. Spencer does well in a performance very similar to her role in The Help.Michael Stuhlbarg also continues his amazing 2017 (also in Call Me by Your Name, The Post, and on TV with Fargo) by giving a great performance in the little time he has. Shoutout to Doug Jones as well for playing the Amphibian Man. He gives an endearing performance that brings warmth to his naturally cold-blooded character.The Shape of Water is easily one of 2017's best films and deserves all the Oscar nominations it will get. Every person in the cast and crew do their job exceptionally and create a breathtaking cinematic experience that makes you feel like a kid again while also giving you the stuff your adult mind wants to see.",hunter-friesen,N/A
21,7,"Solid, beautiful movie with good script and acting","Another very satisfying GDT movie, very reminiscent of Pan's Labyrinth. Lots of the technical aspects, such as score, makeup of Doug Jones, scene shooting and cuts, and acting performances of Hawkins and Jenkins, were really impressive and help explain why it's got a good chance at Best Picture. I really like the themes they touch on, with the Cold War, love and understanding, loyalty and hierarchy, and very clearly defined and developed characters. However, I didn't find these themes to be extremely deeply or consistently explored, as none of them are especially vivid, emphasized, or concluded in a way that makes you reconsider the idea - they were smaller pieces to a beautiful movie about the main character finding love and understanding. Nothing wrong with that, and it was well done, but nothing that makes it especially memorable or emotionally intense. Very solid, well-directed, and good peripherals, but nothing that puts it over the top.",andrewroy-04316,N/A
