id,user_rating,review_title,review_text,author,date
22,7,Solid court drama,"The script of this Witness for the Prosecution manages to captivate thanks to delicious and incredibly well written dialogues, and Charles Laughton's performance who superbly delivered them and who clearly stands out within a cast that has no big flaws but isn't exceptional either. The plot however lacks sometimes a bit of interest, and the rhtyhm a bit uneven doesn't play in favor of this very static movie.But the main point for which it can be blamed is its ending, not that the ""initial"" twist is bad, far from it, it's excellent, but it is followed by a series absurd and very little credible twists. The explanation for this improbable outcome lies in the Hays Code, this censorship code that governed Hollywood's productions from 1934 to 1968 and obliged Wilder and his writers to provide this rather twisted (!) ending that inevitably impacts the quality of the movie on the whole, which remains a notch below 12 Angry Men for example.",christophe92300,N/A
23,9,Like Perry Mason?  You'll love this...,"I first saw this movie about 15 years ago and loved it.  I just watched it on VHS and was captivated all over again.  Agatha Christie's story, Billy Wilder's screenplay and direction, and the four main leads all get it right. Charles Laughton is absolutely superb, and Elsa Lanchester is a perfect foil.Agatha Christie's story has more twists and turns than a roller coaster and this provides a strong foundation for the movie. But the actors give life to the characters. I haven't seen the 1982 version, but I'll admit to a bias for Marlene Dietrich.  She and Tyrone Power pull just the right punches.It's a mystery, of course.  But a top notch one. So if you want only to dabble in the genre, this is the one to try. (If you like mysteries, it goes without saying that you must see it.) Moreover, this is one B&W movie for people who don't like B&W movies.",August1991,N/A
24,7,silly ending spoils good movie,"I watched Witness For the Prosecution tonight, and was struck by it. It is an interesting courtroom drama with solid performances all round; compelling in it's style and makeup, and well directed. But the ending, after such a plausible and almost beautiful winding story of complete believability. . . left me shaking my head in disbelief. How the film makers could allow such a fine picture to collapse with such a concoction of trumped up melo-dramatic absurdity in the final scene goes beyond absurdity. It was as though someone in the production staff decided they had to save Charles Laughton's (who gave a grand performance as the lead defense English barrister, Sir Wilford Robarts) reputation, so that he did'nt come off looking as though he had been duped by the main characters involved in the murder he was defending. Afterall, Laughton had been the beloved protagonist featured as the barrister hero throughout the film. So at the end, when the wife (Marlene Dietrich) saves the murderer (Tyrone Power) from the gallows, they had to quickly concoct a scene to avenge the wicked and scandalous trick that had been played on the defense team, the law, and the true hand of justice. If they had allowed the husband and wife to walk off together hand in hand into the sunset at the end, I would have said this is one of the greatest courtroom pictures ever made. But Billy Wilder could have done much better with the ending IMO, which had nothing to do with plausibility, and for me almost ruined the picture.Kudos to the actors, especially Laughton, Marlene Dietrich, and Elsa Lanchester. More kudos to the director who clearly did a masterful job right up until that final silly scene that kind of ruined it for me.",emdragon,N/A
25,3,Courtroom Melodrama Guilty of Being Overrated,"Another extremely overrated classic, and this one always compared to Otto Preminger's Anatomy Of A Murder, and Billy Wilder's stagey direction of an Agatha Christie stage-play mystery of Witness for the Prosecution couldn't be more different if it centered on purple unicorns traipsing through Iceland...The first is an existential courtroom drama about a man who's entirely guilty of murder, and here it's obvious someone's not telling the truth. Either a horribly aged once-perfect-looking Tyrone Power (with a gorgeous trophy in the wings played by Ruta Lee, pictured twice): he's accused of killing a rich old lady befriended for need of a loan on an egg-beating invention, or the title character in Marlene Dietrich, who gives the best performance overall, especially having to do with a twist that really only works in repose...Meanwhile, the always great acting team of Charles Laughton, as the flawed defense consul of the English Court, and real life wife-beard Elsa Lanchester, are only pretty good here, going back and forth more like another kind of stage play. Comedy, perhaps. Which simply doesn't fit here, and with everything mounting to the last five minutes, like mysteries do, this isn't one for rewatching: another major difference between Anatomy Of A Murder, a true classic that really needs a divorce from this otherwise semi-decent courtroom melodrama.",TheFearmakers,N/A
26,9,"Agatha Christie is a classical detective story writer; arguably, THE classical detective story writer.","Let me explain.The best book on music I've ever read is ""The Classical Style: Haydn, Mozart and Beethoven"", by Charles Rosen.  (Read it, it's fascinating.)  One of Rosen's claims is that the classical style was the offspring of two impulses: the desire to surprise, and the desire to be formally perfect, to sound ""right"".  In the decades before Haydn's maturity there were composers who startled and composers who satisfied; Haydn was the first to startle and satisfy in the same breath.Detective story writers have the same ideal as classical composers.  The solution must surprise us; yet the ""shape"" of the story, to those who know the solution, must be beautiful.  And, as in music, it's hard to surprise and satisfy at once.  If you must go one way or the other, much better to satisfy.  One can see the denouement of a Thorndyke story by R. Austin Freeman a mile off, but it's always perfectly crafted, and that is enough. Too many modern detective stories startle us by having the murderer turn out to be one of a dozen characters when it could so easily have been one of the other eleven and nobody would have particularly cared because there's little beauty in the story whoever it turns out to be.  But Agatha Christie ... not for nothing is she called ""classical"".  Her solutions are almost always surprising - she may have been better at misdirection than anyone else who ever lived - but they always, in a way that's hard to describe, make perfect dramatic sense.  -Okay, so she's not the world's best mystery WRITER.  But I often think she attracts undue criticism because she so obviously writes less well than she plots, while the literary defects of writers who can't plot either pass unnoticed.For all these reasons I'm surprised there aren't more first-rate films based on her works.  (I can understand, though, why ""The Mousetrap"" has never been filmed.)  Looking through the IMDb list of twenty-eight cinematic Christies, I'm surprised how many of the ones I've seen fall short of their potential. And twenty-eight isn't really, when you think about it, that many, especially when so many of them are remakes of earlier ones.Still, most are worth watching, and this particular one is excellent. Faithful to the play, it has the usual finely crafted, classical, Agatha Christie twist.  Wilder made it at a moment in his career when he could do no wrong.  It must have taken him all of two seconds to decide that Charles Laughton would make the perfect Sir Wilfrid; then, perhaps, another fifteen minutes to settle on Marlene Dietrich as the title character.  Just as ""Double Indemnity"" is set in a black-and-white California, ""Witness"" is set in a black-and-white England - it makes me wonder if it's a mistake filming Agatha Christie in colour.  You'll enjoy this, trust me.",Spleen,N/A
27,10,Witness for Prosecution,"This movie is truly gripping. The actors involved are top of the line and they all have the ability transport the viewer into the film and make you forget your surroundings.This movie is worth watching. I am not a fan of Agatha Christie, but this movie is one of my favorites.Charles Laughton makes this movie. He is what drew me to the movie to begin with. I was not disappointed.Marlene Deitrich and Tyrone Power play their rolls to the max and manage to play both the jury and the audience to the end.This movie is well worth watching.",caliadragon,N/A
28,10,Laughton and Wilder team up to produce cinematic gold,"Hollywood's Golden Age set the standards for how great films should be made with its pioneering narrative and visual approach. There were countless great works that emerged from ingenious directors like Alfred Hitchcock, Frank Capra and Billy Wilder. One particular masterpiece from the latter was the 1957 courtroom drama Witness for the Prosecution.When a young man (Tyrone Power) shadily becomes the beneficiary of a recently murdered wealthy widow, he must testify to his innocence with the help of a master barrister (Charles Laughton) recovering from a heart attack. His immunity ultimately rests with his wife's alibi who opts to be a ""witness for the prosecution"", making for a tumultuous trial for the aforementioned men.I can't say enough about this film's quality – it was simply outstanding. When it was originally released, audience members were actually given and asked to sign cards that read ""I solemnly swear I will not reveal the ending of Witness for the Prosecution."" At a time where twist endings were not ubiquitous, it certainly would have stunned quite a few people. But this film unquestionably shines from beginning to end and merits a viewing from any film lover.There are many fascinating characters that bring the Agatha Christie play to life. Marlene Dietrich is phenomenal playing the accused's wife in a cold, calculating manner. Tyrone Power gives a great performance as a timid man who, for the most part of the film, is subdued in his distress. Charles Laughton, playing the defense's attorney, absolutely stole the show for me. His sharp-witted and astute character is an absolute joy to watch during the trial. He makes the trial process an enthralling, entertaining experience that seems to never have a dull moment.It is character-driven, stimulating films like Witness for the Prosecution that remind me of just how great courtroom dramas have the potential to be. This film manages to keep you in a tight suspense while simultaneously managing to be humorous, incisive and intelligent. The use of long takes and the authentic feel of the court atmosphere converts the viewer into an onlooker in the courtroom with the others. Yet another masterpiece on Billy Wilder's impressive repertoire and one of my favorite films of the Classical Hollywood Style. The man was a genius in so many ways.",pere-25366,N/A
29,10,Classic Masterpiece,A classic Courtroom drama with fun and exciting elements. Never seen such a Courtroom drama before. No movie ever had such a twist.,sivamani-09779,N/A
30,10,Another Remarkable Movie by Billy Wilder,"When the efficient but bitter and stubborn barrister Sir Wilfrid Robarts (Charles Laughton) returns to his office in London recovering from a heart attack, he is invited to defend Leonard Stephen Vole (Tyrone Power), who is the prime suspect in a murder case. Leonard is a former soldier that fought in World War II and is married with his beloved German wife Christine Helm Vole (Marlene Dietrich). He is unemployed and accused of seducing and murdering the wealthy middle-aged single woman Emily French (Norma Varden) to inherit 80,000 pounds. His unique alibi would be the testimony of Christine, which would not be accepted by the court, since she is his wife. Along the trial, Christine is surprisingly called to testify in court by the prosecution, when secrets about their lives are disclosed.""Witness for the Prosecution"" is another remarkable movie by Billy Wilder and one of the best about trial. The plot is perfectly tied-up without any flaw in the screenplay, which has many plot points and witty lines in a perfect combination of the caustic and sarcastic ""British humor"" with crime, drama and mystery. The cast has awesome performances, highlighting Charles Laughton and Marlene Dietrich. Billy Wilder is one of my favorite directors and his direction is once again outstanding. Last time I saw this movie was on 12 March 2005 on VHS and today I have watched it on DVD for the fifth or sixth time. My vote is ten.Title (Brazil): ""Testemunha de Acusação"" (""Witness for the Prosecution"")",claudio_carvalho,N/A
31,9,Brilliant!,"I have no idea why I'm writing this review. There are already 125 other reviews here, and that odds that anybody's even going *see* mine are slimmer than an already-slim person on a severe diet.What's more, I don't have anything new to add. I just finished watching the movie for the first time, and I thought it was just magnificent. Wonderful cast, wonderful performances, and a completely engrossing and surprising plot. And even some charming humor on the side to keep things from getting too grim. I was able to foresee some of the ending but definitely not all of it.So anyway, the main point I would want to make is just this: If you have NOT seen this movie, do NOT read any reviews with spoilers! Just see the movie!",Qanqor,N/A
32,N/A,Edge of Your Seat Entertainment,"This is one of the all-time great mystery movies, headed by an unusual but great cast. Marlene Dietrich plays an enigmatic character and actually has the top role--she is the witness. But Charles Laughton is a delight as the lawyer who is trying to save her husband--Tyrone Power,a drifter who has been charged with killing an elderly woman. The acting by all principals is extremely good, and so is the plotting. There is no filler here. One tip: watch it to the very, very end. The movie contains a ""false"" ending.",Alessa-3,N/A
33,7,Well-done courtroom drama...,1st watched 11/4/2001 - 7 out of 10(Dir-Billy Wilder): Well-done courtroom drama with many twists at the end with a unique trailer that asks all who watch this to not reveal the ending to others.  So I will obey and not give this away to anyone.  Laughton is wonderful as the aging & ailing defense attorney(barrister in England) with a typical mysterious performance by Marlene Dietrich and a sometimes hammy performance by Tyrone Powers.  A lot of talented people were a part of this production of a Agatha Christie story & screenplay including Director Billy Wilder.  They all came through remarkedly and presented this story as it is(a well-written courtroom drama that was originally a play).  Wilder did a good job of letting the actor's play this story out and it shows in the final production.,dwpollar,N/A
34,9,This witness is an absolute must!,9/10This witness is an absolute must!Spoiler,JohnHowardReid,N/A
35,7,""" The First Rule of law forbids that we Think ""","Among black and white movies there are some which stand on their own merits as genuine Classics. This is one of them. The Movie is called "" Witness for the Prosecution. "" If you have read the book, then see this film you will not be disappointed as it is directed by one of the best, Billy Wilder. The story is set in England and spins the unlikely tale of Leonard Vole (Tyrone Power) a handsome young man accused of murdering a wealthy woman who left him a sizable amount of money in her will. Once on trial for murder he is able defended by noted barrister Sir Wilfrid who does a splendid job. (Charles Laughton) The entire case stands precariously on a sole witness named Christine. (Marlene Dietrich) The story runs smoothly as does the play and all the characters from Elsa Lanchester, John Williams to Henry Daniell do their part to ensure a dizzying display of early stage theatrics. Watch this from the start to it's end and see if you're not surprised by the ending. I was! Superb movie and a must for Power fans. Easily Recommended. ****",thinker1691,N/A
36,5,Pretty meh,"Honestly, this film didn't make much of an impression on me. I thought it generic and nothing special. I wasn't engaged throughout and my attention did wander. Sure parts of it are interesting and it is funny at times, but this wasn't consistent enough to make me really like this film. Although, the film's twist ending, which I won't spoil here, was really good. I certainly didn't expect it. I read that when the actors all signed up, they were under strict conditions to not reveal the ending to anyone. But ultimately, I just found this film boring and slow.Read my full review here: http://goo.gl/otLOdm",jameslinton-75252,N/A
37,9,I Loved It!,9/10I Loved It!Spoiler,TheLittleSongbird,N/A
38,9,I want Charles Laughton as Council!,"Charles Laughton is absolutely hilarious and superbly witty as barrister/solicitor in this film, in fact- I cannot recall any courtroom lawyer who has a better grasp of language cadence and tone and pitch as the great Charles Laughton which makes his courtroom defence posturing unlike any! Further, outside of the court, Charles has such a finicky and droll humour that I was so tickled by his badgering of his nurse (who happens to be his wife in real life).Marlene Dietrich is superb as well. She just commands the screen and that wonderful German accent is spellbinding.Tyrone Power is a powerhouse but I found that he somewhat over-acted just a tad for my liking; however, this does not deter the quality of the entire movie.This is a terrific movie with a great little twist at the end, so stay with it right to the very end!",misterjiggy,N/A
39,9,Classic Agatha Christie courtroom drama,"Witness for the Prosecution is one of the great courtroom dramas on par with Anatomy of a Murder, 12 Angry Men and To Kill a Mockingbird. It is also the finest adaptation of a Agatha Christie novel.In large part, credit has to go that brilliant writer-director Billy Wilder, who gave cinema so many other noir and comedy classics. This is a thriller with a good bit of comic relief in the verbal sparrings of real-life husband and wife Laughton and Lanchester as a Barrister with a heart condition and his erstwhile nurse respectively. Both give brilliant performances in their own right.The dialogue is brilliant, the plot twists are very intelligent, surprising yet believable. Marlene Dietrich also has a sizeable role with a minor love story thrown in. Tyrone Power, who I never liked is his usual wooden self.A highly recommended film classic for all ages. Do not miss this one!",faraaj-1,N/A
40,10,A first class mystery.,"Leonard Vole enlists that help of veteran Barrister,
Sir Wilfrid Robarts, to help defend his case, the case in question being the murder of mature lady Emily Jane French.Agatha Christie movies sometimes translate well to the big screen, sometimes they don't, on very rare occasions they become incredible films that defy passing years, this is such a film.Full of twists and turns, you are made to wait until the very end to learn what exactly is going on. Not without humour, there are a couple of laughs and chuckles, particularly in the court room.It's a quite wonderful film, the direction is superb, it looks tremendous, beautifully shot, however it's the tremendous combination of the acting and story that make this film the absolute classic mystery that is still loved today.Power and Dietrich are marvellous, Elsa Lanchester is hilarious, Charles Laughton, I think he's captivating here.There have been several remakes, this I'd argue remains the ultimate adaptation.10/10.",Sleepin_Dragon,N/A
41,9,An outstanding film,"An outstanding and extremely watchable film. That it is more than 60 years old makes it a genuine cinematic achievement. Charles Laughton is superb, a pleasing combination of drama and comedy.",rclarke-84225,N/A
42,9,"""We've disposed of the gallows, but there's still that banana peel somewhere!""","WITNESS FOR THE PROSECUTION is a great courtroom drama that contains elements of thriller, mystery and dark comedy. The film is based on the short story and theater piece of the same name by Agatha Christie. A poor innovator was arrested for the sensational murder of a middle-aged and wealthy widow. The old and respected lawyer, despite ill health, can not resist this seemingly hopeless case. The case is further complicated when the wife of the accused agrees to testify against her husband...This serious courtroom drama is ""mottled"" with tense and comical dialogues at the same time. This approach, in addition to the standard tension, is causing a good mood. Mr. Wilder has managed to create an atmosphere where emotions are literally burning. This claim is justified by an explosion at the end of the film.Charles Laughton as Sir Wilfrid Robarts the senior counsel is stubborn, witty and determined patient or lawyer. He is an extremely charismatic and dominant character. His appearance is very funny in this movie. Marlene Dietrich as Christine Vole/Helm, the accused's wife is a key character in the story. I thought that this is another example of a femme fatale, but I was wrong. Ms. Dietrich is something special and it is a privilege to enjoy her appearance and performance.Tyrone Power as Leonard Vole, the accused is somewhat inconclusive. Maybe it was a deliberate spoof by Mr. Wilder. However, his laid back approach and mixed emotions during the trial seem unconvincing. Elsa Lanchester as Miss Plimsoll, Sir Wilfrid's private nurse is the nicest protagonist. Mr. Laughton in the fight against his wife for a cigarette and a glass of brandy. I would describe their relationship as a kind of story in the story.John Williams as Mr. Brogan-Moore, Sir Wilfrid's junior counsel in the trial remained in the shadow of his mentor. Humorous interruptions are also lacking. Una O'Connor as Janet McKenzie, Mrs. French's housekeeper and a prosecution witness has through small role revived some of my memories. I just enjoy every time while watching the little ""chatterbox"".Changes in mood and tempo, black humor that is ubiquitous, interesting and tense ""fire"" in the courtroom and excellent characterization are the advantages of this film.Simple, classic.",elvircorhodzic,N/A
43,7,This is a Spoiler,7/10This is a SpoilerSpoiler,kterryl,N/A
44,10,One of the few nearly perfect films,"Flawless retelling of the Christie courtroom drama. Amazing writing, direction and acting. There are some fun moments of comic relief thanks to Lancaster.Don't share the surprise ending with friends!",mls4182,N/A
45,N/A,Untrusted Means of Untrusted Narration,Untrusted Means of Untrusted NarrationSpoiler,tedg,N/A
46,7,Wonderful performances...except one,Great acting and a wonderful story. ..with the exception of Tyrone Power. His portrayal of the accused is so over the top that it is a farce.His constant emotional outbursts are ridiculous and would never be allowed in a court of law. He almost ruins the movie.,rickstockton-05055,N/A
47,4,A 1950's Fantasy,"First the good thing about this film. The acting is superb, and both Laughton and Lanchester excel as a real life couple; Laughton laying down the law as it were, and Lanchester as his feisty nurse. No real spoiler to say that he has had a heart attack and she lovingly puts up with his tantrums. Not since ' The Bride of Frankenstein ' has Elsa Lanchester given such a memorable performance. As for Tyrone Power on trial for murder he looks tired and old but is solid in his role. Marlene Dietrich is Marlene Dietrich and despite a misplaced song in the ruins of Berlin, and an equally unlikely love scene she gives her all, which is quite demanding. She even transforms herself into another person and that is quite a feat as the German accent has to go. Along with Elsa she steals the film. As for the story the surprises come and go like clockwork. The morbidity of the impending gallows leaves a nasty taste in the mouth, and the mob in the gallery watching the trial comes across with depressing accuracy. An execution has to happen and no spoilers but the baying audience in the 1950's need to see it come hell or high water. The ending which we are crassly told must not be revealed is of course aimed at the audience's satisfaction. The mob in the gallery have to be satisfied in the Upper Circle and the stalls. Based on an Agatha Christie play the scenario is typical of its era of suspicion and imprisonments, and as long as you can accept the fantasy of crime and often unjust punishment this is an excellent film. As cruel entertainment it works, and unbelievably a child of ten could see all this as long as they had money in their hands to see it alone.",jromanbaker,N/A
