id,user_rating,review_title,review_text,author,date
1,9,Fun with Charles and Marlene,"To see ""Witness for the Prosecution"" for the first time in 2008 is a jolting surprise. Nobody could do it better than Billy Wilder did in 1957. A man accused of murder, Tyrone Power, the weakest link in this terrific chain. Sir Wilfred is called to defend him, he is played by the extraordinary Charles Laughton, but he's just out of hospital - he wasn't dismissed he was expelled - and due to doctor's orders he's not to take any criminal cases. He finds Power charming and personable enough but he's not going to risk his life to save his until Marlene Dietrich makes her entrance - and what an entrance! How marvelous that what amounts to a bit of Agatha Christie's usual fare becomes such an entertaining and at times right down riveting piece of film-making.",willandthomas-picturehou,N/A
2,9,This had me to the bitter end!,"I love it when a movie captivates me, carries me along, then surprises me at the end. This is a masterpiece of human maneuvering. It has outstanding acting and a plot to die for. This is a fairly pedestrian Agatha Christie short story. I'm not saying it's not a wonderful story, just that it doesn't come to life like it does on the screen. Charles Laughton is the wonder barrister who is taking the case, even though he is in poor health. The murder case seems a relatively simple one until we begin to trip over the many layers left lying on the path. Marlene Dietrich does a masterful job in all her roles (I won't say anymore than that so I don't spoil the ending). Tyrone Power is able to balance his pathos and his potential guilt. The beauty of the movie is that it never takes itself too seriously. There are some modestly funny subplots and a great deal of careful investigation. I guarantee you that once you start watching, you won't be able to turn it off.",Hitchcoc,N/A
3,9,The Mother of all Courtroom dramas/thrillers.,"Yours truly has never been much of a reader, though with one notable exception: the work of Agatha Christie. I absolutely, positively worship this brilliant woman and try to read as many of her novels, short stories and stage play adaptations as possible. ""Witness for the Prosecution"" is a genuine classic, and although somewhat atypical for Christie, it is undeniably one of the greatest stories ever penned down. There's one major disadvantage about having read all of Christie's whodunits, of course, namely that you can't experience the same astounding twist-in-the-end twice! I would really have loved to be overwhelmed by the climax of this film- version, especially because Marlene Dietrich and Tyrone Power give away such fabulous performances. The story, with its fascinating characters and dazzling plot twists, does remain the movie's biggest strongpoint, but there are a number of more reasons why ""Witness for the Prosecution"" is righteously considered as one of the most massive milestones in cinematic history. Billy Wilder's surefooted direction, for one, and the stellar performances of the entire ensemble cast. I mentioned Dietrich and Power already, but there's also the downright phenomenal Charles Laughton (arguably the most shamefully neglected actor/director in history) and an appealing supportive role for Elsa Lancaster. But do I daresay that the ultimate success-factor of this stage play adaptation is the masterful re-creation of the court trial? The bombastic settings and decors, the echoing acoustics, the powerful monologues of confident (and arrogant) barristers and the intimidating gowns and wigs are largely what make ""Witness for the Prosecution"" not only the first but also the mother of all courtroom dramas. This may just be the opinion of an avid fan, but practically ALL great courtroom-dramas that were released from the sixties until present day (""To Kill a Mockingbird"", ""Philadelphia"", ""Devil's Advocate"", ""A Few Good Men"") were clearly influenced by ""Witness for the Prosecution"". In fact, I only have one minor complaint: *** Spoiler **** the film version adds one more final twist that I didn't find 100% plausible.",Coventry,N/A
4,10,A Hitchcockian Billy Wilder,"At the end of the day the films you give top marks are those films that become constant companions. You can see them again at the drop of a hat, you show them to people who have never see them and it's always a triumph. ""Witness For The Prosecution"" is one of those wonders. Suspend your disbelief for a couple of hours and enjoy this banquet of a romp. Charles Laughton showed here what he was made of better, more clearly and more loudly than in any other film and all of his films, at least the moments with him in it, are unforgettable - Captain Blight or Henry VIII, Quasimodo or that malefic Senator from South Carolina. Here the severity of his lawyer by vocation takes your senses away with his masterful judicial way to see logic and it's such an incredible fun to watch him do it. Tyrone Power is a toy in his hands but not Marlene Dietrich who stands her ground, not merely as a character but as a presence on the screen. Billy Wilder visits early Hitchcock territory with wit and fun. Elsa Lanchester's nurse is the cherry on top of this delightful film.",littlemartinarocena,N/A
5,9,Another triumph for cinematic genius Billy Wilder!,9/10Another triumph for cinematic genius Billy Wilder!Spoiler,The_Void,N/A
6,10,Dynamite courtroom drama,10/10Dynamite courtroom dramaSpoiler,planktonrules,N/A
7,8,Love That Laughton,8/10Love That LaughtonSpoiler,flickershows,N/A
8,N/A,Billy Wilder meets Agatha Christie,"Another brilliant work in the legendary career of Billy Wilder. The director signs a cinematic adaptation of this Agatha Christie story: actually it is really as if the camera went on stage for filming the play. But the film is passionating and exciting, there's no time to get bored.Another thing we shall not forget is that Billy Wilder is European. He manages to keep the spirit of the film very British, with lots of humour and sarcasm. Compared to films like this one, ""legal"" movies from John Grisham's novels are empty and meaningless, without soul.Mr.Wilder is the director, we know; we have Charles Laughton, Tyrone Power and Marlene Dietrich: what a cast! Add a superb black and white cinematography... The result is amazing, with a film where dialogues are flawless and carry everything.Times are different now, but the atmosphere and the taste of movies like this one are impossible to find in contemporary films.",michelerealini,N/A
9,10,What a movie!,10/10What a movie!Spoiler,scott-buchanan,N/A
10,9,The Goal Is Always Justice,"In a recent biography of Billy Wilder, Agatha Christie is quoted as saying that this was the best adaption of her work ever done on the screen. I can't praise Witness for the Prosecution any higher than that.Tyrone Power in his farewell film plays Leonard Vole who befriends a dotty old widow played by Norma Varden. She even rewrites her will leaving him the bulk of a very large estate. When she's murdered, Scotland Yard arrests Power.Power's solicitor Henry Daniell retains a dream team for defense of John Williams and the recently recovered Charles Laughton. Laughton is recovering from a heart attack and against medical advice plunges into the case. Laughton also has to deal with the efforts of his assigned nurse Elsa Lanchester to keep him following doctor's advice.The original play this was taken from concentrated completely on the Power character and the machinations of his wife. Wilder built up the character of the nurse and barrister Sir Wilfred Robards so that they almost equaled the screen time of Mr. and Mrs. Vole. So much so that Charles Laughton was nominated for an Academy Award in 1957, but lost to Alec Guinness.Marlene Dietrich plays Mrs. Vole. She's a war bride over from Germany and she's got her own agenda going. Her performance and what her character does is the key to the whole film. Dietrich probably would have gotten an Oscar nomination herself, but due to the fact that if her performance was hyped up for Academy consideration, the element of surprise would have been lost in the film. Wilder in fact apologized to Marlene for that.The Anglo-Saxon legal system's goal is justice. Justice is served though not quite in the way it usually is in Witness for the Prosecution.",bkoganbing,N/A
11,7,"If you've seen the movie, be sure to read Christie's story.  If you've read the story, still see this movie.","Witness for the Prosecution is, as IMDb voters cann attest, a great movie. A clever, character-driven courtroom drama, it deserved the Academy Award nominations that it received in 1958, and it has justly endured to the present day. Starring the terrific talents of Charles Laughton, Tyrone Power, and particularly Marlene Dietrich, directed by Billy Wilder, and based on the superb short story by Agatha Christie, it is a combination has all of the very best ingredients, and delivers a nearly outstanding film.The movie centers around Laughton's character, an aged, feisty, and very canny English barrister (lawyer) who is in poor health and headed toward retirement. The opening of the movie is entirely Laughton's show, as he portrays a curmudgeonly and endearing character. On his first day home from the hospital, he soon takes up the defense of Leonard Vole (Power) a man who is charged with murder and up against a barrage of circumstantial evidence. Power is convincing as the honest and somewhat naive defendant, in increasingly over his head. Soon, Dietrich makes her entrance as Vole's cool German femme fatal of a wife. After a few flashbacks to set up the story of the murder case, Laughton takes up Vole's case. What ensues is a well-written and well-directed courtroom drama, in which Laughton continues to shine, delivering a convincing performance peppered with humor. Soon, the story takes a series of dramatic twists, during which Power plays his part as the beleaguered defendant to the hilt and Dietrich uses the gifts that made her a legend. By the end, the audience has been treated to an excellent drama with sensational acting.The result is a classic, but not an icon in the sense that Christie's short story, penned twenty years earlier, would become. While it may be the best-regarded of all Christie adaptations (Murder on the Orient Express a possible exception), the movie does not seem to have the stature it ought to have. At the end of the movie, I did not feel the same as when I read the story, and not just because I knew all along how it would turn out. With such visible talent on all fronts, I took a long look at what it was, and what was missing. The answer: Christie.The movie is good in its own right, but from the beginning misses the crucial aspect that the original story has: the mystery. Agatha Christie is the master of suspense, and throughout the story, that suspense, that anxiousness to know what will happen next, the eagerness to know where this next twist will lead, and the shock that comes at the very end, were what the story was all about. The direction the movie went, the legal thriller, substituted drama for mystery, and while the movie only added to the story, changing very little of what Christie wrote, the movie lost the grip that only she could create. Christie treated the courtroom proceedings (the centerpiece of the movie) with brevity, focusing on the intrigue surrounding the case. Also, the Hollywood ending overdoes it a little bit, and deprives the most important plot twist of some of its its emotional impact.That said, however, the movie is still a classic. Fortunately, the heart of the story was still very strong, with a unique plot and rich characters, which were taken advantage of by Wilder and the cast, respectively. And, as it turns out, the movie is a good complement to the story. To those who have only seen the movie, the story should be read to truly appreciate the missing value of the mystery. To those who have read the story, the movie nails the characters (particularly Dietrich's Mrs. Vole). All in all, I give this movie a 9 out of 10, and would gladly see it again.",Anansi00,N/A
12,9,EntertainingTrial Movie That Still Holds Up,"This is one of the best ""trial movies"" ever made. It's an outstanding film that is just as good today as it was almost 50 years ago when it was released in the theaters. The shocking ending caused quite a stir back then, too.The only part of the movie I thought looked dated and unrealistic was Tyrone Power's character being able to interrupt the trial with outbursts and not be reprimanded for it. There is no way that would be tolerated, at least today.Otherwise, it's a pretty solid film with a good cast that includes two fascinating characters played by actors who know how to entertain: Charles Laughton and Marlene Dietrich.Laughton, who plays Power's defense attorney, grabs the spotlight in the story but Dietrich almost steals the movie in her role as Power's wife. Laughton's dialog is terrific throughout, bringing a number of laughs to this serious film. He's just a joy to watch. Dietrich is even more riveting but just doesn't have anywhere near the same amount of screen time as Laughton.Not to be overlooked is Elsa Lanchester, playing Laughton's nurse. She, too, demonstrates her comedic talent and significantly adds to the fun of watching this film.If you like some fine drama, storyline twists, a little humor thrown in and great acting and dialog, this is a classic film to check out.",ccthemovieman-1,N/A
13,7,Suspenseful and amusing Christie,7/10Suspenseful and amusing ChristieSpoiler,rmax304823,N/A
14,2,Witness to my eggbeater,2/10Witness to my eggbeaterSpoiler,onepotato2,N/A
15,10,"""I suspected something, but not that. Never that!""","That's a quotation from the film and what you'll say at the conclusion. I saw it the first time 36 years ago back when network TV ran old movies late at night, and I'd never even heard of it. I thought it was a Hitchcock film with all of the unexpected twists, but no, the director was Billy Wilder. How surprised I was to see Wilder do Hitchcock better than Hitchcock ever could! The set-up is this - Leonard Vole (Tyrone Power) is an inventor that is having trouble getting his inventions to market. He befriends a wealthy older woman, one Emily French. She is obviously flirting with him, and Vole, though married, flirts back, his objective being that maybe she will financially back one of his inventions. Then disaster strikes. Emily French is found murdered. Vole is an obvious suspect because Mrs. French has just changed her will and left everything to Vole. There is circumstantial evidence pointing to Vole, and he says he knows nothing about the will. Enter barrister Sir Wilfred, the finest in England, whose doctor has told him he must quit work and go on a vacation because of his heart condition. Sir Wilfred talks to Vole, believes his story, and also talks to his wife, Christine (Marlene Dietrich) who backs up Leonard's story but comes across as somewhat cold to her husband's peril. Sir Wilfred is convinced to take the case and agrees to retire upon this last trial. Past that I cannot tell you any details or I'll ruin it for you.Everyone in the cast performs masterfully. Especially charming is the interaction between Laughton's character and his nurse played by his wife of then 28 years, Elsa Lanchester. They go back and forth at each other with Nurse Pimsoll insisting that Sir Wilfred keep his rigid schedule of medications and him treating her like a jailer with hilarious one liners at the poor woman's expense. Only a long married couple could do this feature length banter so well. If Nightmare Alley didn't convince you that Tyrone Power was more than a pretty face, this film will. Likewise, Marlene Dietrich is much more than a blue angel and a fine figure of a woman at age 56.Notice all of the little touches. How Sir Wilfred seems to be ignoring testimony in court by counting out his pills, only to stand up and ask insightful questions when his turn comes. Plus this film really shows that nothing is off the record, even if the judge says that it is - the jury hears and sees everything. Sir Wilfred plays on that fact.Great acting, great direction, great story - it doesn't get any better than this. Thus I give this a solid 10/10. And one irony - Power's character mentions several times about Sir Wilfred's heart, but it is Tyrone Power himself who will be dead of a heart attack by the end of the following year. Sadly, this is his last completed film.",AlsExGal,N/A
16,10,"Wilder, Laughton, Lanchester, & Dietrich Add Sparkle to Christie's Courtroom Classic","10/10Wilder, Laughton, Lanchester, & Dietrich Add Sparkle to Christie's Courtroom ClassicSpoiler",dtb,N/A
17,9,One of the best courtroom movies of all time,"Witness for the Prosecution is one of the most entertaining courtroom stories of all time, written by the crime mistress herself, Agatha Christie. Charles Laughton completely owns the courtroom, starring as a famously brilliant barrister who's supposed to be taking a break for his health-but he gets drawn in by a truly compelling murder trial. Tyrone Power, in his last movie, has been accused of murdering a wealthy older woman. While all the evidence racks up against him, Charles doesn't give up hope and tries to win the case, all the while trying to crack the very hard nut Marlene Dietrich. Marlene is Tyrone's wife, and it's impossible to tell what she's really thinking or feeling.I love this story, and I love both versions of the film, from 1957 and 1982. It's incredibly suspenseful and interesting-and also quite impossible to talk about without giving spoilers. If you've never seen Witness for the Prosecution, add this one to your list of classics to rent. The acting is fantastic, and the timing makes it a very entertaining old movie to watch. There are no boring bits in this drama; and I guarantee you'll still sit on the edge of your seat the second time you watch it.",HotToastyRag,N/A
18,9,I'm constantly surprised that women's hats don't provoke more murders.,"Leonard Steven Vole finds himself on trial for the murder of a wealthy widow from whom he has inherited a fortune. Top barrister Sir Wilfrid Robarts takes up the defendants case, but he, along with everyone else, is stunned when Vole's seemingly loving wife Christine turns up to testify against the defendant.Based on Agatha Christie's successful 1953 play, ""Witness For The Prosecution"" benefited from fine tuning from master director Billy Wilder and writing partner Harry Kurnitz. Here the dialogue becomes razor sharp and the characters are fully realised with quite wonderful results, but chiefly the masterstroke here is not letting a court room drama become just that, a court room drama. The film plays out with no wasted scenes, no moments of boredom, and it has such vim and vigour you sometimes forget that there actually is drama in the story.The cast here are on fine form, Wilder had wanted to work with Charles Laughton for some time, and it's obvious that both parties here are getting the best out of each other. Laughton is a pure delight as Robarts, a sharp tongue, all bluster and cheeky into the bargain, his interplay with Miss Plimsoll (Laughton's real life wife Elsa Lanchester) is quality, and it's another testament to Wilder's genius for putting them together. Tyrone Power, in what would be his last completed film before sadly passing away, is devilishly smart as Vole, whilst Torin Thatcher is great as the gruff prosecution barrister Myers. Yet as good as they all are, they all sit in the shadow of Marlene Dietrich and her turn as Christine Vole, sultry and femme fatalistic, it's a sizzling performance that crowns this delightful film.It occurred to me overnight that it's probably the closest film that Wilder got to being Hitchcockian, and I'm pretty sure the big master of suspense himself would have enjoyed this one. It's a mystery that is dramatic, it's a thriller that is also funny, it's pretty much a multi genre classic. 9/10",hitchcockthelegend,N/A
19,N/A,Superb and unjustly maligned film,"WARNING: SPOILERS AHEAD!I'm not sure I have the ability to adequately praise this film. The original short story(rather unremarkable, actually)has been expanded into a magnificent example of Hollywood entertainment at its best. In addition to perhaps the finest line-up of character actors ever assembled(next to Cukor's David Copperfield, that is), we get Laughton and Dietrich at the top of their form. The person who criticised Lanchester's performance as ""annoying"" missed the point entirely. Miss Plimsoll is meant to be annoying! Also, what's with all the bad-mouthing of Tyrone Power? ""Hammy""; ""terrible""; ""worst performance ever"". These are the perceptive IMDb reviews? Only one of you got it right: it's hammy because Leonard Vole is the one acting, not Power! For 95% of the film, the character is dissembling, only showing his true colors at the end. Of course it looks hammy: Vole isn't a born actor like his wife. And to all those know-it-alls who called this film mediocre and predictable, I look forward to your upcoming film projects which I'm sure will be paragons of excellence and worthy to be set alongside classics of the golden age.",jasonhurd,N/A
20,8,A Hickcoktian courtroom puzzle game  masterfully played and perfectly directed by the great Billy Wilder,"Entertaining suspense movie packs thrills , intrigue , twists and turns ; being realized in Hitchcock style . As the tale is ordinary Hitchcock fare that plays and preys the senses including sensational acting , enjoyable dialog and interesting screenplay from start to finish . Leonard Vole (Tyrone Power) is detained on suspicion of killing an elderly acquaintance . He employs an experienced but aging barrister, Sir Wilfrid (Charles Lawton) as his defense attorney who is recovering from a severe heart attack . The ill advocate at law is attended by a nurse Miss Plimsoll (Elsa Lanchester , they were real-life husband and wife).Excellent film packs drama , emotion , suspense and plot twists . This agreeable and often intriguing picture from master of comedy has a memorable scene after another . It contains interesting intrigue based on Agatha Christie's novel , fun intrigue , amusing situations and keeps the action at feverish pitch . The film followed the basic story of Agatha Christie's play, but director and co-screenwriter Billy Wilder opened up the story by including numerous scenes that did not take place solely in the courtroom, as the play had, and changed the emphasis from ""Leonard Vole"" to ""Sir Wilfrid Robarts¨. Top-notch and unforgettable performance from Charles Laughton as the peculiar as well as intelligent barrister , throwing himself into the role with dedication and delight . Nice acting by Tyrone Power , this would be his last complete film , he would die of a heart attack while on the set of his next film (Salomon) less than one year after release of this one . Sensational support cast , including familiar faces such as Elsa Lanchester , John Williams , Henry Daniell , Ruta Lee , Torin Thatcher and veteran Ian Wolfe . Special mention for Una O'Connor , this was Una O'Connor's last big screen motion picture and she was the only member of the original Broadway cast of the play to repeat her role on film . Evocative and atmospheric cinematography in black and white by Russell Harlan . The producers were so concerned about the financial success of the film that during the credits, an announcer urges the audience not to reveal the film's ending to anyone . Lavishly produced by Arthur Hornblow Jr. and Edward Small , as the courtroom setting, which cost $75,000 to build, was a recreation of an actual courtroom in London's Central Criminal Courts , The Old Bailey.The motion picture was very well directed by Billy Wilder who includes several punchlines , amusing dialogues , humor and entertaining intrigue . Billy was one of the best directors of history . In 1939 started the partnership with Charles Bracket on such movies as ¨Ninotchka¨ , ¨Ball of fire¨ , making their film debut as such with ¨Major and the minor¨ . ¨Sunset Boulevard¨ was their last picture together before they split up . Later on , Billy collaborated with another excellent screenwriter IAL Diamond . Both of them won an Academy Award for ¨Stalag 17¨ dealing with a POW camp starred by William Holden . After that , they wrote/produced/directed such classics as ¨Ace in the hole¨ , the touching romantic comedy ¨Sabrina¨ , this ¨Witness for the prosecution¨ and two movies with the great star Marilyn Monroe , the warmth ¨Seven year itch¨ and ¨Some like hot¨. All of them include screenplays that sizzle with wit . But their biggest success and highpoint resulted to be the sour and fun ¨¨The apartment¨. Subsequently in the 60s and 70s , the duo fell headlong into the pit , they realized nice though unsuccessful movies as ¨Buddy buddy¨ ,¨Fedora¨ , ¨Front page¨ and ¨Secret life of Sherlock Holmes¨, though the agreeable ¨Avanti¨ slowed the decline . The team had almost disappeared beneath a wave of bad reviews and failures . ¨Witness for prosecution¨ rating : Above average , essential and indispensable watching . It justly deserves its place among the best ¨Court Dramas¨ ever made . One of the very best films of all time and to see and see again . An extremely entertaining and riveting film and completely provoking , as it ranked #6 on the American Film Institute's list of the 10 greatest films in the genre ""Courtroom Drama"" . It's the kind of movie where you know what's coming but , because the treatment , enjoy it all the same .",ma-cortes,N/A
21,10,The Best of the Pre - 1970s Agatha Christie films?,10/10The Best of the Pre - 1970s Agatha Christie films?Spoiler,theowinthrop,N/A
