id,rating,review_text
1,4.5,"The Social Network is a very popular drama film. It was released in 2010 and it stars Jesse Eisenberg as Mark Zuckerberg, the creator of Facebook, and Andrew Garfield as his friend Eduardo Saverin. The plot is about a young student who creates a social networking website at university. The website becomes very successful, but Mark has problems with his friends and people who work with him. There are many interesting and tense scenes in the film. Will he be able to keep his friends and his success? The film is set in different locations, such as a university, offices and courtrooms. This gives the film a serious atmosphere. The soundtrack is good and helps make the film more exciting. The acting is very good, especially Jesse Eisenberg, who plays his role in a clear and realistic way. I would recommend The Social Network to people who like films about real life and modern technology. It is interesting from the beginning to the end."
2,3.5,A pretty cool way to tell the story of Facebook's upbringing. I just couldn't get behind how quickly paced this was.
3,4,"Well done and very interesting story throughout without feeling too long or convoluted. Great performances by everyone, especially Jesse Eisenberg who was perfectly cast in the role of Zuckerberg."
4,5,"Best film of 2010 excellent masterpiece awesome performances from Jesse eisnberg, Andrew Garfield and Justin Timberlake"
5,5,Good movie!!! It's a very good movie!!
6,4,"""Mark give me the zuck"""
7,4.5,"The Social Network is genuinely a great film. The story holds your attention from start to finish, and it’s far more intriguing than you’d expect from a movie about building a website. David Fincher does an incredible job exploring the psychological layers of the characters, revealing their motivations and conflicts through dialogue and actions. The film’s back-and-forth structure shifting between different timelines kind of gave me slight Oppenheimer and Memento vibes, though maybe that’s just me, haha! The cast is outstanding, each performance bringing a different shade of intensity and vulnerability. And the score? Perfect. It sets the mood in every scene and elevates the tension beautifully. Overall, it’s a solid film that captures the messy intersection of ambition, politics, and the corporate world."
8,5,"I honestly don’t know any American movie with better dialogue since the year 2000! Written by mastermind Aaron Sorkin and directed by visionary David Fincher, The Social Network is a modern cinematic masterpiece. The incredibly fitting yet unconventional score by Trent Reznor and Atticus Ross (Nine Inch Nails) perfectly underscores the film’s cold, pulsating atmosphere. And the cast? OMG – every single actor is outstanding. Each character comes alive with remarkable depth, making the film almost overwhelmingly immersive. The opening scene between Jesse Eisenberg and Rooney Mara, in my opinion, is the best way to start a film — sharp, witty, and brilliantly written. Dialogue, acting, and direction at the highest level. The Social Network is simply unparalleled."
9,5,um filme digno de gramys
10,5,It is really engaging.
11,5,"Juntamente com ""Ela"" (2013) e ""Garota Exemplar"" (2014), esse é, para mim, um dos filmes que melhor definem a década de 2010, culturalmente falando. Brilhantemente escrito por Aaron Sorkin — mesmo roteirista de ""Questão de Honra"" (1992) — e cirurgicamente dirigido por David Fincher, um dos melhores diretores da atualidade, ""A Rede Social"" é um instigante recorte da cultura digital do século XXI e um envolvente conto sobre ganância, amizade e inveja. Tudo isso em torno de uma maravilhosa demonstração do que o cinema moderno tem de melhor, tanto no sentido audiovisual quanto no sentido narrativo."
12,5,"The Social Network is one of the best movies I’ve seen. The story is really engaging, and the acting is top-notch. Jesse Eisenberg does a great job showing both the smart and awkward sides of Mark Zuckerberg, and Andrew Garfield adds a lot of emotion as Eduardo. The script by Aaron Sorkin is full of clever and fast-paced dialogue, and the direction by David Fincher keeps things moving and intense. It’s a smart and entertaining film that really sticks with you."
13,5,"My absolute favorite movie. I haven’t used RT for a while, now with this new ID, I choose this as the first movie to Rate. After watching Oppenheimer I wished it was created by Sorkin-Fincher. Everything about this movie is perfect.."
14,4,"“The Social Network” is one of those movies that sneaks up on you with just how endlessly rewatchable it is. I’m always in for a biopic, and with Fincher at the helm, you know you’re in steady, razor-sharp hands—he proves once again why he’s one of my favorite directors. Andrew Garfield, my personal favorite actor, brings such raw sincerity, and Jesse Eisenberg is, as always, a joy to watch with his icy precision. The film is packed with quotable lines and scenes that still feel fresh over a decade later. Special shoutout to the effects team: I legit bought Armie Hammer as identical twins without a second thought. It’s not quite a flawless masterpiece, but it’s definitely a modern classic—four stars."
15,5,Shout out to Jesse Eisenberg and the best script of 2010 made by Aaron Sorkin.
16,5,"Arguably the film of our entire millenium and generation. Fincher directs this film with he absolute perfect sequencing between timelines to: withold mystery while keeping you informed, not make you dizzy going back and forth, and telling a 100% coherent story that you're addicted to within the first 10 minutes. Eisenberg's the best Darth Vader since James Earl Jones, and Atticus/Finch scored this film hauntingly well. A perfect movie."
17,2,Exactly what ‘overrated’ looks like
18,5,Great movie. Recommended.
19,5,"Success in 02 hours, 00 minutes, and 45 seconds and based on a true story!!!!! Rated PG-13 for Language, Drug and Alcohol Use and Sexual Content!!!!!!!!!!!!!!!!!!!!!!!!!!!!!!!!!!!!!!!!!!!!!!!!!!!!!!!!!!!! Starring Justin Timberlake as Sean Parker!!!!!!!!!!!!! The worldwide gross is $224,927,749.00!!!!!!!!!!!!!!!!!!!!!!!!!!!!!!!!!!!!!!!!!!!!!!!!!!!!!!!!!!!!!!!!!!!!!!!!!!!!!!!!!!!!!!!!!!!!!!!!!!!!!!!!!!!!!!!!!!!!!!!!!!!!!!!!!!!!!!!!!!!!!!!!!!!!!!!!!!!!!!!!!!!!!!!!!!!!!!!!!!!!!!!!!!!!!!!!!!!!!!!!!!!!!!!!!!!!!!"
20,4.5,Incredibly well made film on Mark Zukerberg. All the actors gave 10/10 performances and David Fincher truly is one of the best filmmakers working today. nearly perfect film. Possibly even perfect. There could be strong arguments for both sides.
21,4.5,"I found this version of Mark's ascent to the top, absorbing. Jesse Eisenberg suited the role very well. We have been told that it is not accurate, so classify it as a Docu-Drama. Well worth a watch."
22,5,Excellent movie to be watched for Entrepreneurs
23,5,"One of the best movies I've ever watched. The casting was brilliant. Andrew Garfield puts on a fantastic performance as Eduardo Saverin, and the soundtrack was chef's kiss."
24,4,Fantastic! Jesse Eisenberg is a PERFECT fit to play as the Facebook creator we all know as Mark Zuckerberg.
25,4.5,The social network is a fantastic movie! It's well written. Andrew Garfield should've got nominated for best supporting actor.
26,4.5,The Social Network has great performances and solid promise
27,4.5,Eduardo was the best and when he got backstabbed it hurt.
28,2,Fincher hasn't really done anything good since Seven and Fight Club.
29,2,"The actors did a great job, but this movie does not deserve the hype. I had high expectations with people calling it a ‘masterpiece’, or the ‘greatest film they’ve ever seen’. Didn’t even notice the score, lol. Not a necessary watch, just a story about a person I don’t really care about."
30,4,"Really well done impactful story of ambition, drive, friendship and betrayal. Eisenberg does a good job humanizing an awful person. The first half you are rooting for him, and then geez the guy just comes unglued at the seams. Gave me way more perspective on the whole IP battle over Facebook. I knew the names but not the stories. On the down side the dialogue audio was pretty bad, especially when everyone was talking so fast."
31,5,"The Social Network is possibly one of my all-time favourite movies. Jesse Einsberg does an impeccable job at portraying Mark Zuckerberg in this, with the supporting cast doing just as great a job. I go back to watch this movie every time it pops up on Netflix, I listen to the soundtrack all the time when im brainstorming ideas, and I watch clips of Mark Zuckerberg destroying the lawyers with their ‘condescending question’ all the time. Its a must watch, 5/5 stars."
32,5,When I think of Jesse Eisenburg I think of this movie. 10/10 I would recommend anyone who enjoys dramas based on real events this would definitely be one to watch.
33,4,"The Social Network is a perfectly well-acted spot-on casting of an immaculately written screenplay that has never been written in the history of all Hollywood-produced biopics. This film is certainly not my go-to movie as my interest in how Facebook began doesn’t satisfy me entirely, but for sure, in my books, this film will always be considered a perfect study film for any future filmmaker, thanks to David Fincher pitch perfect direction and Aaron Sorkin’s Oscar winning writing. Grading: A-"
34,5,"Cold and captivating, the ability to make you love to hate a real person while finding them incredible, all the surrounding factors are extremely well covered, programming, business, drama and everything possible."
35,5,"Great cast, great direction and a great script turns what could have been a dull film about nerds coding into something engrossing and fascinating"
36,4.5,"Watched this again recently and damn, it’s a really well done and interesting movie. It also seems like everything Aaron Sorkin writes is excellent 👌🏻"
37,5,"one of the best movies that i have ever seen and humanity have 100% masterpiece no flaws perfect editing, performances, script, THE SCORE IS OOOMG SO GOOOD, cinematography, sound, EVERYTHING IS PERFECT, THIS SHOULD HAVE WON BEST PICTURE AT THE OSCARS, NOT THAT CRAPPY ""the king's speech"" AWFUL MOVIE"
38,3.5,"This film has its fair share of flaws (mainly the far too fast pace), but an amazing performance by the always great Jesse Eisenberg and an undeniably great story make this film hard to criticize or not enjoy."
39,5,"Memories of the first time I watched this, and the several times I rewatched it. Brilliant writing and performances."
40,4.5,"Sporting slickly delivered repartee and tensely edited drama by Kirk Baxter and Angus Wall, The Social Network portrays a fascinating look at the rise of Mark Zuckerberg and Facebook that often finds itself enervating (and captivating) viewers."
41,3.5,"A movie that proves to be memorable but wasn't as engaging as I had previously hoped it to be. With an unlikeable lead played by the more likable Jesse Eisenberg, I found myself hating his decisions and attitude more and more without any charm or love for his character while Justin Timberlake takes an even more unlikeable character and spins him to be interesting and charming. Andrew Garfield shines as what seems to be the true main character, as well as the main victim, as he tries his best to do what's good for him and Eisenberg, but is ultimately hurt instead. With all-star talent from these three featuring the wonderful Rashida Jones, Brenda Song, and Dakota Johnson as their supports, the talent and the effort into this film goes far beyond my own thoughts and feelings for the lead."
42,0.5,"Overwhelmingly positive reviews had me psyched for this movie. However, the horribly excessive objectifying female depictions with no addition to the storyline, alone to serve the male actors, left me so incredibly disappointed."
43,5,This is a goood movie defo watch this
44,4.5,"A classic. Tense, witty, and purposeful. A masterpiece of cinema."
45,5,"The Social Network is a masterclass in effective writing. It is rare that a script perfectly illustrates the tone of a story, just with words. Quick-witted and purposeful, every line is delivered effortlessly by Jesse Eisenberg. I have never felt such strong emotion from an emotionless character before. The cast is excellent, the score is poignant and the directing is top notch, but what makes this a perfect film? The writing. Additional Note: If Aaron Sorkin is attached to any film, I will watch it because of this movie."
46,4.5,"Cuando me enteré de la película dije que onda una de facebook pero dije le dare una oportunidad y si esta buena la película curioso que fincher a pesar de ser el genio del thriller hace que esta película se sienta mas fresca con un protagonista que no es un santo y quién sabe si paso de verdad teniendo en cuenta varias libertades pero lo que mas me impacto fue el final solamente ver a mark solo después de todo lo que pasó al final hay un plano corto pero inteligente que dice ""mark zukerberg es el billonario y joven del mundo"" y suena la canción BABY YOUR'E A RICHMAN joder es cine!"
47,4,"Foda demais, esse filme aqui é massa demais, o massa é que o protagonista não é bonzinho não, o fi da pé é o cão, mas não chega a ser pika de cachorro, o clímax foi bom mas não foi essas boba do rato toda, o cara só fez destruir a parada, nada como um ""absoluto cinema"" Wow konomoul"
48,4,"You don't get to 500 million friends without making a few enemies. 'The Social Network' is a story about friendship, loyalty, greed and betrayal. It is an absolutely amazing, and engrossing film to watch."
49,1,"2 hours of college kids arguing about a website.... everyone else seems to love it and think it's brilliant. Sorry to be the one who calls it for what it is ---- another one of David Fincher's so-called ""masterpieces."""
50,5,"The Social Network is a dialogue-based movie with a perfectly written script. The writing is flawless, I was interested in all the characters and I liked them including the morally questionable ones. It's amazing to see that all of the characters are completely understandable, all of their actions are backed with reason even though they are morally wrong from an objective point of view. The acting was also flawless, which brought the words from the screenplay to life. The cinematography, editing and direction were amazing, I felt completely locked in. During every work meeting, every party I felt like I was there. The music was also amazing. Dialogue-based movies often make the mistake not to give audiences outstanding visuals, but this movie has that in the form of the amazing editing, direction and cinematography. The Social Network is a perfect film."
