id,tomato_score,review_text
1,positive,"The 1957 courtroom drama (based on an acclaimed 1954 teleplay) celebrates reasoned dissent, open debate, and the power of a single voice challenging consensus, principles Bhattacharya values deeply, especially in science."
2,positive,"It’s a classic for a reason, and it’s a film that everyone should see at least once in their life."
3,positive,"A film like 12 Angry Men comes around once in a lifetime, and it will remain a blueprint for what a masterpiece looks like."
4,positive,"This arguably remains Sidney Lumet's most compelling work, a sweaty, sustained drama that milks its claustrophobic setting for all it’s worth."
5,positive,12 Angry Men is one of the best courtroom dramas in cinematic history.
6,positive,"It’s a near perfect mix of theme and setting, personal drama and social commentary, a microcosm that suggests an entire world outside the frame ..."
7,positive,"Sidney Lumet's solid success is achieved without even once resorting to flashbacks or other standard procedures of the film trade. The secret rests in spirited dialogue, realistic setting and, of course, the excellent cast of outstanding character actors."
8,positive,Within its simplicity there is a freshness and ingenuousness about Twelve Angry Men uncommon in a slickly sophisticated film industry.
9,positive,"One has to imagine the dramatic imagination that went into creating this fascinating, psychologically realistic motion picture, which, from start to finish, never changes its subject or its location."
10,positive,A court drama that transcends time or place; a real masterpiece. [Full review in Spanish]
11,positive,If you have never seen the film I cannot recommend it enough.
12,positive,Reginald Rose's script is one of deep revelation.
13,positive,"Thought-provoking, continually riveting, and absolutely unforgettable - and surprisingly designed around a very simple, tightly budgeted, special-effects-free premise."
14,positive,"""12 Angry Men"" puts the full range of human good and evil on display. It posits that, ultimately, the universe is benevolent, and our job, regarding each other, is to attempt with our best effort and greatest compassion to elucidate and clarify the truth."
15,positive,One of Hollywood's more notable borrowings from television is this Reginald Rose drama about the soul-searchings of a murder-trial jury...
16,positive,This movie is a masterpiece. That term gets thrown around a lot -- it's a very easy thing to say about great films like this -- but this movie is one of the best. This is one of the very few films that I will call perfect.
17,positive,"In the 60 years since its release, Sidney Lumet's masterpiece has lost none of its impact. In this age of unreason, 12 Angry Men remains sorely and urgently contemporary."
18,positive,With each new viewing I come away feelings as if I have peeled away another layer on the characters and their buried motives.
19,positive,"Lumet in his first film records it as a meticulous laboratory experiment, a clammy orchestra"
20,positive,...the film has aged surprisingly well in the years since its 1957 release.
21,positive,"There is real value is how it allows each member of the cultural mosaic of a jury to develop into distinct, damaged, and interesting characters"
22,positive,"Too few films take on the art of arguing as a subject; we could certainly use more of them, but until then, Lumet's window into strained civic duty will continue to serve mightily."
23,positive,"The film takes a confined, almost completely banal real-world location and makes it completely dynamic, using incredibly nimble camera movements to establish character motivation and theme."
24,positive,"The cast is incredible, the writing superb, and the film is unparalleled in its sheer excellence."
25,positive,"This was Sidney Lumet's first movie and it's as riveting as it was back in the late 50s, when everything was changing."
26,positive,an incisive and gripping film
27,positive,"Lumet keeps things tense, sweaty, suspenseful and entertaining despite the contrived story line."
28,positive,Outstanding Henry Fonda jury classic.
29,positive,"12 Angry Men has some shrewd observations to sell about argumentation and group behavior, but they're not the ones of which the film seems most proud."
30,positive,The film leaves a tremendous impact.
31,positive,Every bit the classic it's been made out to be for all these years.
32,positive,Power house jury room drama w/cast of memorable actors.
33,positive,
34,positive,"Makes no self-saluting motions to greater importance, which gives the material the much-desired breathing room it needs to reach full potency."
35,positive,"Mechanically written, but within its own middlebrow limitations, it delivers the goods."
36,positive,A strangely realistic thriller.
37,positive,"Sidney Lumet's Oscar-nominated feature directing debut is a brilliant courtroom drama, featuring a superlative cast that includes Henry Fonda (also producer), Martin Balsam, Ed Begley, Jack Warden, and E.G. Marshall."
38,positive,A masterful work of debate and dialogue; of shifting momentum and the ideal of sticking to your scruples in the face of antagonistic groupthink.
39,positive,
40,positive,This film is a great combination of an adult theme and the treatment suitable for younger audience.
41,positive,"Ainda que se passe em um nico ambiente, esta obra-prima possui um alcance emocional imensurvel - e  incrvel que tenha sido o primeiro longa-metragem de Lumet."
42,positive,
43,positive,
44,positive,One-room dramas don't get much better than this
45,positive,"Although it may sound ungallant, these 12 Angry Men, are all right without distaff glamour. Their dramas are powerful and provocative enough to keep a viewer spellbound."
46,positive,"An intense concentration of power, and my all-time favourite film."
47,positive,
48,positive,
49,positive,Sidney Lumet's debut feels a bit stagy but is never short on tension.
50,positive,"This is a film where tension comes from personality conflict, dialogue and body language, not action."
