review_id,user_rating,review_text
1,100,"In short, they don't make 'em like this one anymore. Viewing it is like taking a time machine to a movie age that was more naive than our own in some ways, more sophisticated and ambitious in others."
2,100,"What a bold, mad act of genius it was, to make Lawrence of Arabia, or even think that it could be made."
3,100,"It's perhaps only because it can't be seen in its full glory on television that ""Lawrence"" isn't ranked more highly on some recent all-time ""best film"" lists. But it belongs near the very top. It's an astonishing, unrepeatable epic."
4,100,"Riveting from beginning to end, featuring stellar performances, amazing cinematography, and a story without a trace of fat, the film does everything an epic is supposed to do - and more."
5,100,David Lean's splendid biography of the enigmatic T.E. Lawrence paints a complex portrait of the desert-loving Englishman who united Arab tribes in battle against the Ottoman Turks during WWI.
6,100,"Released in 1962, it was pretty clearly the most intelligent spectacular within living memory. On its 40th anniversary, it's even better."
7,100,"Lawrence is back on the big screen, and it simply demands to be seen. Yes, again."
8,100,"The movie manages both senses of scale—the intimate and the expansive—with equal majesty, merging them into something moving, mesmerizing, and poetic, in a way only Lean movies could really manage."
