id,rating,review_text
1,4.5,You will sit on the edge of your seat for this whole movie. Tremendously sad how slave owners treated the enslaved. Very well acted and produced. See it before the Trump administration bans it because it is DEI propaganda.
2,5,I regret not watching this sooner.
3,5,"Truely a tough watch. Honest, horrifying truth told as it is."
4,3,"A good film but would benefit from serving the dish colder and with less spoon-feeding. For instance the lingering, voyeuristic shots of misery. Something like this will naturally have an epic scope, but the pregnant pauses, acting that is sometimes too grand/stagey and overbearing score make this feel a bit too Hollywood. Synthesises the 'big picture' stuff with the daily indignities and human emotions - jealousy, resentment, self-preservation - extremely well."
5,4,Acting was phenomenal. The emotion and despair could be felt.
6,0.5,"Another reviewer said it well- torture porn. It’s made in hatred. And it’s pretty unbelievable that humans would act like animals to one another. I don’t buy it, I don’t care what the source is. Just glad I didn’t pay to sit through it. But I liked how the righteous Brad Pitt comes along to redeem the evil whites. Whew."
7,5,Brutally honest but worth the watch
8,5,"A tough movie to watch, but the acting by everyone was so good- esp Chiewetel Ejiofor. The last scene was emotional."
9,4.5,Important story that I hadn't heard of before. The acting was top notch.
10,4.5,"Ok, this isn't my cup of tea- I don't particularly care about the evils of white men of long ago- they are the evils of ALL men throughout the ages. This movie was excellent, to be sure, and I'm giving it 4 1/2 stars and it's a must have in your collection- but I think Amistad was probably a better 'slave' movie. I also think giving it the best movie oscar was kinda huh? when you look at a few of the contenders. Wolf shoulda got it. All that being said- it's a must watch. It's sad when you see the potential for the end of slavery in America and what black Americans could've become/ and what they actually became. Ugh!"
11,4,Una muy buena película si la recomiendo
12,5,2 hours and 14 minutes based on a true story. Academy Award winner in 2014 for Best Picture and Best Supporting Actress (Lupita Nyong'o).
13,4,"""Slavery is an evil that should befall none."" Not everyone will be able to stomach it but this is an outstanding film that deserves and needs to be seen."
14,0.5,"I didn't like the movie, really boring for me. But, what happened to the man was horrible..."
15,4.5,I watched this because the youtube algorithm was throwing me clips of it - I'm glad. Powerful movie. Horrific story.
16,5,"All Time Classic and a deserving Best Picture Winner. The acting is excellent. Ejiofor does an excellent job along with everyone with amazing physical acting as well. Solomon is a great vessel to take us into a different time, place, and world. When we see brutality or things that just seem foreign to us his emotional response is exactly what we would have seeing it for the first time just like him. It's something I thought was a really nice touch. Fassbender is amazing as the villian and truly dispicable. I appreciate how Cumberbatch's character showed not every single white slave owner was a monster as well. And that's something I appreciate how it doesn't make the people involved with slavery so bad and evil that they come off as cartoonish. The cinematography is first rate as well. The direction is really good, the production, sets, costumes are first rate and truly make you feel your back in the 1840's. This is a brutal film to watch pretty much from the moment Solomon is whipped and never lets up. It's a slow burn brutal journey that is unrelenting in showing the brutality and compassion of people in the South. This makes the pacing excellent though. Everything else is really good. Once he's sold to Fassbender it can feel like stuff just happens a bit before coming back to him trying to get a letter out. But the relationship building with others, the exploration of the morality of slavery, and culture of the South is so layered and so well done it carries through those moments easily. The folk music and cinematic tracks are excellent too and blend perfectly. the songs the slaves sing are super catchy and memorable also. Everyone should give this a try once. I can't state enough though this is a brutal film to watch."
17,5,"A masterpiece of visual storytelling and emotional gravity. 12 Years a Slave doesn’t wallow in sadness - it illuminates, disturbs and ultimately uplifts. Steve McQueen directs with a painter’s eye and a surgeon’s precision, letting scenes breathe while never letting them drift. Chiwetel Ejiofor is quietly devastating in the lead role, anchoring the film with dignity and restraint. Michael Fassbender’s portrayal of raw, unhinged brutality adds a visceral layer of menace that lingers. Every frame feels earned, every moment lands with weight. It’s not just great cinema - it’s required viewing."
18,5,Powerful story hands down the acting is sensational this well done movie deserves praise on all counts it is a must see have this masterpiece in your library
19,1.5,"An angry film made by an angry filmmaker. Just like Mel Gibson seemed more interested in the torture of Jesus than in the teachings of the prophet, McQueen seems more interested in making torture porn than saying anything interesting or original about slavery in America. The overrated darling of film critics seems to mistake uncomfortable, gory violence for saying something profound. A big budget, award begging slog of a film."
20,5,"Once in a blue moon, a movie comes along that becomes an instant classic. A powerful biopic that contrasts humanity and evil with exceptional performances by an outstanding cast."
21,5,"An ingenious recreation of the atrocities Solomon Northup and his fellow slaves endured throughout their lives of darkness and oppression. The screenplay was immaculately detailed, the cast were thoroughly committed to their roles and the lack of discretion when portraying the appalling conditions which slaves were forced into was astonishingly authentic. If you want to further your education on slavery, I'd whole-heartedly recommend watching this film, but brace yourself for the monstrosities you'll see and hear."
22,5,"Filme pesado, porém retrata uma realidade passada que deve ter atenção para que não se repita futuramente. Ótima direção e elenco, filme incrível!!!"
23,2.5,I do not understand the point of this movie. It does not do a good job at teaching history. I feel it is just 2 hours of trying to to make the audience uncomfortable and it does not do a good job at that either.
24,5,"This movie left me speechless. It’s the kind of movie that is amazing in every way, but you never want to watch again. It’s that effective with its emotional brutality. It doesn’t shy away from the sheer horrors of American slavery. It shows you how slavery can strip away even the tiniest perks of everyday life that we take for granted. How nearly each and every moment in this inhumane lifestyle is teetering on the edge of brutality. Your livelihood in the hands of someone else. Someone who is delusional and drunk with power. Solomon Northup is such a compelling protagonist that goes through such turmoil as he is stripped of his freeman status and essentially kidnapped into slavery. It really puts things into perspective with the stark contrast between his normal residential family life and the psychotic abusive unnatural state of slavery. It really hammers home how psychotic the concept of slavery really is. Scenes of businessmen displaying and selling human beings like they’re nothing but sentient farm equipment. It’s massively disturbing, especially with just how damn casual and normalized the white people are about the situation all while you have people screaming and begging for mercy right behind their ears. Not to hear even a wince of regret. The actors are all amazing and are doing their absolute best to bring this true story to life. Chiwetel Ejiofor, Michael Fassbender, and Lupita Nyong’o are the standout performances and really sell the emotional core of the movie. The sweeping score by Hans Zimmer and the hauntingly gorgeous cinematography elevate an already amazing movie even further into greatness. Despite all its vicious brutality, there is still an undercurrent of humanity and hope that flows throughout the narrative and eventually culminates in the satisfyingly heart wrenching resolution of the movie when Solomon is finally freed. His rescue is so bittersweet as he has to leave Patsy behind, only to finally reunite with his long-lost family that welcome him home in open arms back to the home he was taken from for 12 excruciating years. It’s a heart wrenching ending where Solomon can finally brush off the heavy emotional burdens of his enslavement and relish in the freedom and comfort of his old family. It’s tragic that he missed 12 years of his children’s childhood. They look so different by the end of the movie. Yet they still remember him and welcome him home in open arms. The movie sticks with you like a molten wad of gum caught in your hair. 12 Years a Slave opens a window wide open to the harsh reality of slavery and forces you into their shoes for over 2 hours. It drags out with little levity, and it really solidifies your perspective and lingers in your mind well after the movie is over. It’s the kind of important historical movie that I believe every white person in America should see at least once in their lifetime. One that will stand the test of time and will continue to remind us of the ugly side of our nation’s history and how we once operated, whether we like it or not. An amazing piece of cinema that has so much to say and yet it will leave you speechless."
25,4.5,"12 Years a Slave is an absolute masterpiece. It’s a powerful and unflinching portrayal of the brutal reality of slavery, delivering its message with raw, confronting intensity. The performances by the entire cast are outstanding, making this film both compelling and impactful. Although difficult to watch at times, it’s a vital and unforgettable cinematic experience."
26,5,"Special Effects: 1,0/Sound Effects: 1,0/Acting: 1,0/Story: 2,0"
27,4.5,Unbelievable film amazing acting!
28,5,"One the best script ive seen, this movie really gives you emotion (from hate, laugh, joy, sadness)... really deep story and the actors were 10/10"
29,3.5,good film hard to watch and depressing good acting
30,5,This showcase of absolute human cruelty will leave you speach-less and devastated.
31,4,"A really difficult movie to watch, but great crafted. Kudos for this Mexican actress Lupita Nyong'o it is superb her interpretation."
32,5,"One of the most rememberable movies I remember watching when it first came out, this movie expertly tells the story behind a dark time in American history. It's got some of the best performances from it's cast, it's got so many interesting and heart breaking shots. On top of all that, it respectful tells the story lost to time. There's little to fault with this classic."
33,4,"This is a really good film. Chiwetel Ejiofor and Michael Fassbender give great performances. It's a hard film to watch at time, but with a powerful, emotional true story this is a must see."
34,5,Brilliant movie. Great ensemble cast. Truly a one of a kind.
35,4.5,"Directional brilliance and a moving piece. I was captivated by the incredible performances of Chiwetel Ejiofor, Lupita Nyong'o, Michael Fassbender and Paul Dano. There's lots of amazing and patient shots and really nice scenery to see. The score was pretty good and placed right for the most part. The violence feels very authentic. Especially the scene in which Patsey gets whipped by both Salomon and Epps was very effective and brutal. A historic yet almost unbelievable odyssey which has been directed astoundingly and produced with much care. The movie ends with a last scene that almost had me in tears."
36,5,One of my top 10 favorite movies ever
37,4.5,"Muito além de uma simples biografia, ""12 anos de escravidão"" é uma verdadeira aula de história, não apenas pela sua precisão histórica, como também por toda sua produção. Sua direção é extremamente sagaz, mas o brilho do filme está mesmo em suas atuações, o elenco entrega toda dor e ódio necessários para nos fazer sentir e imaginar tudo aquilo que os personagem estão passando."
38,3.5,"I've seen this film twice. Loved it both times. Written in book format by the free man who was forced into slavery, this is the movie version. No matter how many films show the reality of slavery, it still tears me up."
39,5,A perfectly executed heart wrenching absolutely devastating movie! It's a must see!
40,5,"Amazing movie, sad and heard to watch but a must see."
41,5,"A classic. Steve McQueen shows why he is one of the most influential film makers of his generation. Confronting, gripping and powerful. Is to slavery, as ""Schindler's List"" is to the holocaust, as ""Requiem For A Dream"" is to drug use."
42,5,"An uncompromising masterpiece. Powerhouse performance across the board eerily recreate such a dark period in American history. This isn't ""torture porn"" as the direction is handled with the car wand dignity such a heavy subject deserves"
43,5,"""12 Years a Slave"" is an unflinching and masterful depiction of a dark chapter in American history. Director Steve McQueen's powerful storytelling combined with an exceptional ensemble cast delivers a haunting and emotionally resonant cinematic experience. Chiwetel Ejiofor's remarkable portrayal of Solomon Northup anchors the film with a depth of emotion that is truly captivating, while Lupita Nyong'o's heart-wrenching performance earned her well-deserved accolades. The film's unrelenting honesty and stunning cinematography transport viewers into the brutal world of slavery, shedding light on the painful realities faced by millions. It's an important and necessary film that demands attention, serving as a reminder of the strength of the human spirit and the ongoing fight for justice and equality."
44,5,"Hard to watch, but such a beautiful and emotional movie. One of the best films I have ever seen."
45,3.5,"This movie is hard to watch. It's so sad to think that actually happened to someone. Lupita Ny'ongo is incredible in this movie, and so is the rest of the cast. I wouldn't say it's one of my favorite movie, because of its theme that is very sensitive, but it's a good movie overall."
46,5,"Fantastic movie. Good acting, tragic but very touching story. Everyone should see this film."
47,3,"Amazing casts, superb acting."
48,5,Well done film that tugged at my heart strings and made me thankful for what I have. I love this genre and historical films.
49,5,Disturbing but brilliant. You feel like you are there.
50,1.5,"""The Passion of the Christ"" set in the old south. Like James Gray, Steve McQueen fills his movies with one-dimensional characters and lead-handed storytelling, and audiences confuse its pessimistic misery-porn for truth."
