id,rating,review_text
1,0.5,DO NOT WATCH IT. A colossal waste of time.
2,3.5,"73%. 2/15/26. Film starts off good with the interview and the loud music, the death boy taking the dog out and then the dead husband. I like the setting up in the French Alps. It was interesting to see a French trial portrayed in a film to see how it was conducted. Cool how the defendant guys to rebuttal more often. Sad how the death son gets put in a terrible position. It was an interesting trial, but there wasn't quiet enough tension or excitement for me to get on the edge of my seat. Solid film, but long. Unlikely to rewatch. 2/5 rewatch"
3,5,Masterpiece! 10 out of 10!
4,3,To darn long. Great acting but just long. If you don’t watch it you won’t miss anything. Trust me.
5,5,"Fabulous move with breathtaking acting. I was on the edge of my seat through every bit of dialogue, even though I do not understand French or German"
6,5,I loved this movie and the actor who played the son was outstanding.
7,4,"Five stars for the movie, which is probably great. Minus one star for the distributer feeding me a dubbed German version only (without English as an option). Only afterwards would I learn that language is absolutely key for this movie, so WTF?!"
8,3.5,Solid courtroom drama with stellar performances particularly from Sandra Huller.
9,4.5,A superior screenplay to match Sandra Huller's masterful performance. This the greatest courtroom film of all time.
10,4.5,"Schrödinger's cat was already dead. Without knowing whether it was murdered by the cyanide gas prepared by mad scientists, or whether it committed suicide, disillusioned with a world that plunged it into such an ordeal, The time for a sad solution seeking a single value for the equation of superposed Fall."
11,4.5,This was a bit difficult to watch and a slow burn but very thought provoking.
12,3.5,For a dialogue based drama - Anatomy of a Fall keeps you engaged and wondering what actually happened between two writers and their blind boy.
13,5,This movie is incredible. It's absolutely unforgettable and definitely rewatchable.
14,5,Heads up: you will NEED to discuss this movie with someone else — ANYONE else —- after viewing. That feeling of intense need may persist a full week. I was lucky enough to have two friends who had seen it.
15,5,"Que peliculón absoluto, las actuaciones, el guion y como te muestra la historia sin estar cayendo en constantes flashbacks y centrándose en el juicio, la fotografía, todo es perfecto."
16,5,"Despite its length, the film embraces ambiguity—a deliberate choice by Triet and Harari that challenges conventional narrative closure and underscores its commitment to realism."
17,3.5,"B- i really enjoyed this more than i thought i would. so much dialogue,long silences and subtitles but i could look past that. was worth the watch. probably best for people who appreciate film as an art form and dont mind long overdrawn films. definitely not for anyone who hates subtitles or long overdrawn films."
18,4.5,A spectacular run with a lengthy runtime that keeps you engaged with the story in telling the story with bits and pieces unraveling the mystery of the murder with intense court scenes that can make anyone sway their mind. I’m truly happy to have finally watched this film and would recommend this to every film lover if possible.
19,3,Worth a watch. Not my fav.
20,5,everyone in this movie was great. the actor who played daniel honestly deserved best supporting actor over RDJ. im baffled he wasnt even nominated
21,3,Huller rocks but the rest of the movie is too carefully calibrated to keep the mystery in unrealistic ways
22,0.5,A writer and her teacher husband and blind son live in a cabin in France when the father dies from suicide or was it murdered by the wife ? This movie has great reviews on rotten tomatoes but it was a huge waste of time for me. Most of the film is on the trial. They speak both in French and English. Very very very chatty. Very fast dialog. Long movie. 2:34. Long chatty and With an unsatisfying ending. 🍿/5 on Hulu
23,5,So perfectly acted and written that even the dog becomes an important and moving character—remarkable for a thriller.
24,4.5,"Esse filme "" Anatomia de uma Queda"" tem uns dos melhores roteiros, investigação e analises de comportamento, não e apenas falacias, e sim bons diálogos. Depende do tipo de publico, mas particularmente gostei bastante do mistério ! nota 8.0"
25,2,"Superb acting, especially from Sandra Huller. However, it’s supposed to be a masterpiece of perceptions and realities. My perception was that it was boring and the reality was that it was too long. Not sure what I missed."
26,3.5,"It's an interesting film, it's easy to watch, the interpretations are good, but I didn't find anything exceptional."
27,5,The Best film of 2023. The best screenplay in years and one of the greatest performances ever by Sandra Huller. A great adult film.
28,3.5,"Although this is an intense and well-acted movie, it's surprising how much buzz it generated during awards season, as it's just another courtroom drama. Sure, it's got an impeccable screenplay with intricate dynamics, but it drags on the simple question of whether she killed her husband or not. The actors were amazing though, and played their roles so believably, even the dog deserved an Oscar."
29,1.5,"Yes the film is well acted, yes the dialogue is good but nothing really happens. In the first 10 minutes you realise there's two ways the film can go and you're waiting for a twist, or a turn, but nothing. I like well acted family dramas, but it's no Kramer VS Kramer. It's too long, and boring"
30,4.5,"Du grand cinéma ! Ne pas connaître la vérité frustre mais permet au spectateur de se faire sa propre opinion. Une histoire touchante. Bravo, oscar mérité !"
31,5,"What a film. So happy I stumbled upon this one rainy afternoon. I was mesmerised. Sublime acting w outstanding writing and direction. The scene towards the end where the court listens to the secretly recorded fight is so beautifully written & intellectual that it made me blush at how infantile some of the arguments I've had in previous relationships, I felt like a proper dummy. It's one of the best films I've seen in ages. It starts in English and swiftly moves into french but I could grasp most of it but did use the subtitles, it moves back & forth between languages. The young actor that plays the son is phenomenal, I barely breathed when he spoke in court, it was just beautiful and so haunting at the same time. For anyone that has experienced grief, breakdown of relationships etc it is a film you must see."
32,5,"This film does have a slightly long run time, but it's genuinely hard to take your eyes off. It managed to maintain all of my attention, even after finishing all my popcorn, with over an hour left! 😂"
33,5,"Totally brilliant, but intense and disturbing. There are few films which expose raw emotions in family relations so deeply and honestly. And there's a dog in it who also plays a not negligible part."
34,1.5,2 hours too see what I knew when started the movie
35,3,"Although I enjoy movies based on family drama, this one in particular did not please me. The movie is way too long and the story development too slow. There is really no need for it to be that long."
36,2,Shut off about 15 minutes in. Unless you speak French its terrible to watch because its 90% in French with no Sub-Titles and you have to guess what is happening.
37,5,Totally engaging unfeigned film making...a gem absolute
38,1,I wasted my time watching Anatomy of a fall. I never review any movie but after watching this I can't stop. First I thought it is best movie but very disappointed. There is nothing to watch in the movie. I thought atleast in the end there may be any suspense in the movie but there is nothing to watch. The movie just got rating and awards but don't know how. The movie should complete only in 5 - 10 minutes but The writer and Director expand it to more than 2 hours. I can't stop myself from writing the review first time in my life because I completely disappointed and wasted my 2 and 1/2 hour. PLEASE DON'T WASTE YOUR TIME TO WATCH THIS MOVIE.
39,3.5,"The most striking element of this film is the script. Sandra Hüller takes the script and puts every ounce of passion she has into her character. Her performance is moving and believable. With each scene, she peels back the layers of humanity for all to see. Her portrayal of the character's belief in her own innocence contrasts with the evidence of her husband's death that seemingly condemns her. The surrounding cast plays off of her desperate energy. Her chemistry with Milo Machado-Graner is particularly precious. CONTINUE READING ON LETTERBOXD: https://boxd.it/66BjTb"
40,3,Needed to watch this in theaters for my rating to be higher but I wasn't able to so I couldn't fully appreciate it.
41,2,"I always rely on this site for reviews but no more. This was dull and not a psychological thriller at all. From 20 mns in, there were 2 possible outcomes, and I watched for 2 hrs to watch one come to fruition, reading half of it in subtitles. Nothing psychological, nothing thrilling at all. Embarrassed I wasted my date night movie choice on this."
42,2.5,"There are a lot of scenes that take place in a court, so I guess you can categorise this as a court room drama, but for me it wasn't. It was more of an art house study of a troubled marriage and the reasons behind it, wrapped up in a ""did she or didn't she?"" murder mystery. Overall I found it slow but was aware that was the nature of the type of movie I was watching. A more intriguing plot or more interesting characters may have made the slow pace less noticeable, but it fell short on those elements. The directing and performances created an unsettling, anxious atmosphere throughout, and I often felt the story was going to reveal something dark or unexpectedly shocking, but it never did. The most compelling aspect that kept me watching was to learn the truth behind the aforementioned mystery, but even that was left ambiguous and consequently there was no pay off or strong argument for giving this movie 2 hours of your time. Despite this I thought it was ok, the story was original and for the most part interesting. It's well made and the actors playing the Mother and Son gave strong performances. Perhaps the fact that the story remained grounded (if somewhat underwhelming) as opposed to having a Hollywood ending with a big reveal or preposterous twist, is part of its appeal."
43,3,The movie is good but lacks of a “rising action” point. Also I don’t think it keeps you into it the whole way. The acting was good.
44,4,"***SPOILERS*** Calmly serious, like Tár (2022) or Three Colors: Red (1994), it was obvious from the beginning this movie was for real. I don't speak French though, and they speak so damn fast in the courtroom that I felt like I was taking a speed reading exam—The effect was that, by the end, I was exhausted of the experience, but not in a bad way. I've never been one to mind an open ending, as long as it's not a cop out, and I thought the third person objective POV worked well in this case since the point of the movie isn't to place blame but to explore the nuances of truth and perspective. Also, I don't hate the theory that the dog did it."
45,4.5,"Ambientada en el frío paisaje de un remoto pueblo francés, este absorbente drama se despliega con una exploración metódica y escalofriante de la fracturada relación de una pareja y el intenso escrutinio de un juicio. La historia se centra en Sandra, interpretada por la excepcional Sandra Hüller, cuya vida da un vuelco tras un trágico incidente. A medida que el caso avanza, la narrativa profundiza en las complejidades de la verdad, la percepción y las intrincadas dinámicas de las relaciones humanas. La dirección de Justine Triet es deliberada y paciente, sumergiendo a la audiencia en una narrativa que equilibra perfectamente la profundidad emocional y el rigor intelectual. La sala del tribunal se convierte en un escenario donde cada palabra y gesto es analizado al detalle, haciendo que la película sea no solo un drama legal, sino también un profundo estudio de personajes. La capacidad de Triet para mantener la tensión mientras deja preguntas clave sin responder añade capas al relato, manteniendo al espectador en vilo de principio a fin. Las interpretaciones son una lección magistral de sutileza e intensidad. Sandra Hüller brilla con una actuación matizada que captura tanto la vulnerabilidad como la fortaleza. Sus interacciones con Milo Machado Graner, quien interpreta a su hijo Daniel, son especialmente conmovedoras, añadiendo un peso emocional que ancla la película. El reparto secundario enriquece aún más la narrativa, contribuyendo a la exploración multifacética de la verdad y la perspectiva. La cinematografía y el diseño de sonido también son destacados, realzando la atmósfera de la película y sumergiendo al espectador en su mundo. Los visuales contenidos y el paisaje sonoro envolvente amplifican la tensión, haciendo que incluso los momentos más silenciosos resuenen profundamente. Este cuidado en los detalles subraya el compromiso de la película con el realismo y su rechazo al melodrama. Los temas de ambigüedad y complejidad moral impregnan la historia, invitando al público a cuestionar sus suposiciones y prejuicios. La película no ofrece respuestas fáciles ni resoluciones claras, sino que deja que los espectadores enfrenten la incertidumbre que define tanto las relaciones humanas como el sistema judicial. Este enfoque por capas asegura que la historia permanezca en la mente mucho tiempo después de que terminen los créditos. Con su intrincada narrativa, actuaciones contundentes y temas que invitan a la reflexión, esta película se destaca como un testimonio del poder de un cine sutil pero impactante. Desafía al espectador a involucrarse activamente con la historia, recompensando su atención con una experiencia cinematográfica profundamente satisfactoria."
46,4,"An enthrallingly immaculate, intellectually structural exemplar of a procedural courtroom drama that captivates in jointed dissection with mostly thorough complexity exquisitely written and mesmerizingly performed, bolstering further talented compel. (A-)"
47,5,A cult film that is not boring and keeps you connected with the history all the time!
48,4.5,"So gripping. 150 minutes, and it wasn't just the subtitles that kept me bound to the screen. Fantastic acting, and man, what a screenplay. It deserved every one of those (major) screenplay awards that it won. Excellent dialog, multilingual, perfectly fit together."
49,3,"The movie is what you expect it to be. Drama unfolds as we get to know the couple's troubles. The acting is great and if you re interested in romantic dramas, I 'd say go ahead and watch it."
50,5,Dog is the scene stealer. Movie treats our intelligence well.
