id,rating,review_text
1,3,"While you cannot doubt Saoirse Roman’s portrayal as Jo March, this film is all over the place. There is some fantastic acting, and I’ve watched all of the other films countless times but this 2019 film will be a one time only event. I’m also not sure why it won a costume award, because although the costumes are wonderful, they are far from the Civil War period. It’s hard to like and dislike such a film at the same time, but that’s what Little Women 2019 has done to me. From a casting perspective, Jo and Laurie’s roles were perfectly cast. Florence Pugh was a wonderful Amy and the actress who played Beth was excellent. Emma Watson’s portrayal of Meg was disappointing, and to be honest, when I first read that she was in the film, I couldn’t think who she would have played; Amy perhaps. I also found it hard to watch Laura Dern after Susan Sarandon did such a fine job as Marmie. I remain a fan of Saoirse and Timothy however. They continue to be the finest actors of their time."
2,5,"""Ultimately, people's lifestyles and personal histories dictate which films they gravitate toward and which they reject. Your favorite movie reflects your own personality rather than the objective merit of the film itself. Just because you found it worth watching doesn't mean I will; I might find it entirely dull and uninspiring."" ""As for me, my favorite film is Little Women (2019). To me, it is one of the most profound human creations. I have wept from the bottom of my heart watching it—seventeen times, to be exact—until I memorized every scene as well as my own name and the tears finally stopped. But when I did cry, it was deeply sincere, for it touches the very core of my being."""
3,3.5,"Finally dropped the gatekeeping for the 1994 version and gave this a fair shot. It hits so much harder. Greta Gerwig really sharpened the focus on Jo’s defiance and the gray areas of her heart. Some might call it surface-level, but to me, it felt incredibly powerful. Saoirse Ronan is a force of nature—she’s the definitive Jo. “I'm so sick of that love is just all a woman is fit for...but I'm so lonely”"
4,3.5,"Great acting all around, beautifully shot. Wish they had progressed chronological instead of the cut-up timeline."
5,5,Only the best movie you will ever watch.
6,5,"La película es hermosa de único a fin, no tengo nada más que decir, llore todo el rato, la ame y me identifique muchas veces con la protagonista"
7,1.5,"The worst of all of the renditions of the film. Cast and acting were good, but the constant chopping and changing through the longtime, with no obvious transition made it impossible to follow. If I didn’t know the story I would’ve been truly lost. I was most disappointed."
8,5,"An absolute must see- I will never stop talking about this movie. Beautiful, winding, heartbreaking and yet incredibly warm and comforting. Every character, clothing item, shadow and whispering note of music are incomparable to any other and completely breathtaking. Sweet, cozy, and real. Unbelievably relatable and foreign in all the best ways. Perfectly executed and quotable- a movie everyone should see and all feminists should be able to quote. A tear-jerker and a work of art. Definitely in my top 20 favorite movies of all time."
9,5,"I saw this movie in theaters back in early 2020. A month after it was released being Christmas, 2019 but man did I enjoy it the first time. I loved it ever since, the vibe, characters, the story, the film look, the music, everything was GREAT. Better yet, it is still GREAT. Rewatching ow in theaters for its rerelease six years later was GREAT to enjoy again."
10,5,"A formidable and enchanting adaptation that surpasses any other made before. A range of truly incredible performances that bring life to the cinematography and adapted screenplay with magical subtlety. The power of the female cast overflows from the screen and reaches our eyes like a rare jewel. From beginning to end, there is no boredom or even a yawn; the story is captivating and the ending is a gem, all this nestled within a richness of detail and costumes that transcend eras. Greta Gerwig, you made a extraordinary work."
11,5,Almost as excellent as the woman who recommended it to me
12,4.5,"Little Women (2019) a captivating story of incredible women who can overcome any barrier together. The wonderful cast is a great highlight for the story, director Greta made a beautiful film."
13,5,"Greta Gerwig’s Little Women is a beautiful adaptation of the classic novel by Louisa May Alcott, the film is excellent in terms of cinematography, acting, and accuracy to the books. The movie accomplishes many purposes, but the most important is that it brings and connects a classic work to a modern audience. Emma Watson, Florence Pugh, Saoirse Ronan, and Eliza Scanlen bring so much life to the March sisters, as well as the entirety of the cast. Gerwig remains true to the cherished novel, but she brings her own touch to the film, particularly in the way she chose to portray each of the sisters’ domestic struggles in a flashback/flash-forward format."
14,4,"I was really impressed with how the film managed to balance a strong female message with timeless themes of ambition, love, and family. Each March sister represents the different struggles and choices that women face, proving that there is more than one path to success or happiness.Jo March's expression of freedom in Little Women (2019) is one of my favorite moments. I was especially touched by her passionate speech to Marmee when she admits to being ""so sick of people saying that love is all a woman is fit for."" This is powerful because Jo is aware of the isolation that goes with being independent while at the same time insisting on women being able to be described as something more than love. The situation was deeply moving and meaningful due to this tension between her deep desire for independence and the common human desire for connection. It made it clear to me that feminism is all about the richness of women's choices and feelings as well as challenging socially imposed boundaries. Overall, Little Women amazed and inspired me. Aside from being a beautifully photographed historical drama, it is also a timely reminder of the worth of women's rights, personal freedom, and pursuing one's dreams."
15,0.5,"Filme fraco, o roteiro é fraco, as cenas são fracas, a história é fraca, o elenco é fraco, e ninguém ajuda a melhorar o filme, os personagens são fracos, e o filme deveria ter cenas bem melhores e relevantes, para fazer o filme ser bom"
16,5,It was beautiful in every way. Everyone must see it
17,3,"Nicely constructed, elegantly staged, well acted but . . .whisper it quietly . . . just a little bit boring"
18,5,"Little Women surprised me when I saw Bob Odenkirk playing the father — an unexpected but delightful detail. I love how the film uses cool or warm tones in certain scenes, depending on the emotional meaning of each moment, beautifully conveying the characters’ feelings and different stages of life. Greta Gerwig breathes new life into this classic story, staying true to its essence while making it feel fresh and relevant. The performances are outstanding, the art direction is gorgeous, and the non-linear narrative works perfectly to explore the emotions and memories of each sister in depth."
19,5,Favorite movie of all time❤️
20,5,"A masterpiece, I'm a man and at first I thought this would be a cheesey Victorian era movie that my sisters show me, I watch and, I forget. I've never cried so much from a movie, this movie to me personally touches my soul, the characters are written so well and remind me of my own family. Alongside it's powerful themes, perfect cast, and heart touching story, makes one of my favorite movies ever. This is a must watch even if you're a guy."
21,5,"Success in 2.25 hours!!!!!!!!! Rated PG for Thematic Elements and Brief Smoking!!!!!!!! Starring ""Harry Potter"" movie franchise star Emma Watson!!!!!!!!!!!!!!!!!!!!!!!!! The worldwide gross is $332,103,783.00!!!!!!!!!!!!!!!!!!!!!!!!!!!!!!!!!!!!!!!!!!!!!!!!!!!!!"
22,5,แค่รักเรื่องนี้เพราะรักตัวละครอย่างโจที่ดูแล้วรู้สึกเหมือนเห็นตัวเองในบางมุมและรักในความเด็ดเดี่ยว รวมถึงเรื่องที่หนังอยากจะถ่ายทอดออกมาให้เราได้เห็น ทำได้ดีมากจริงๆค่ะ
23,1,"Terrible movie, this makes leo the lion and joshua and the promised land look like hollywood movies."
24,4,"One of the most beautiful films of the year, heartwarming and moving. ""Women, they have minds and they have souls as well as just hearts. And they've got ambition and they've got talent as well as just beauty. I am so sick of people saying that love is just all a woman is fit for. I'm so sick of it."""
25,0.5,Little Women meets Quentin Tarantino editing. No thanks. Emma Watson is so bad in this. She doesn’t act. So bad. Chris Cooper rocked as always though.
26,5,love this telling. would watch it over and over again 😭 adore the cast so much
27,4,Greta Gerwig really is that girl.
28,5,Sometimes i wish i could see a movie again fully.
29,5,"Best movies I’ve ever seen, so touching and relatable and so many moving quotes “I have been second to Jo my whole life and I will not be the one you settle for because you cannot have her”"
30,4.5,"Every time i watch this movie it fills me with joy and than rips that all out to make me bawl some minutes later. It really makes me think about life and how we need to praise our happiest days. I love the portrayal of each sisters’ personalities, the differences but also the likenesses. Definitely recommend!"
31,4,The retelling of a classic. Great little women.
32,4.5,"A very sweet and faithful adaptation of the classic novel. The characters are all so likeable and unique with their strong, memorable personalities always clashing or complimenting each other. The cast all knock it out of the park with their performances, especially Saoirse Ronan as Jo, Florence Pugh as Amy, and Timothee Chalamet as Theodore. It's a great slice-of-life story that takes it easy and let's the characters breath as you get to see their routines, aspirations, and romance develop over the course of several years. There's also a nice metatextual plotline with Jo being a clear parallel to author Louisa May Alcott, which I appreciate. I was always interested in the author Louisa May Alcott ever since my family told me I'm apparently related to her on my mother's side of the family. So it was cool finally getting to see her work on the big screen, and it definitely delivered!"
33,4.5,"A utterly warm and cosy picture. Remakes or renditions of classic story’s can oftentimes fall short on the mark- by either changing too much and taking away from the original story or trying to replicate too much. Greta however, mastered creating such a beautiful rendition of this story that is close to perfection. Every single one of the actors gave a stellar performance that did their iconic characters justice . The subtlest micro expressions and verbal choices made the scenes feel natural and genuine to the audience. The costumes were stunning and i love how each sister had a specific colour pallet that complimented another sibling wonderfully. Greta added her modern individual flair to the film which didn’t go unnoticed. Specifically Amy March’s (Florence Pugh) monologue a third of the way through the film. That touched audiences with a raw and delicate speech on the struggles of women in regards to societal norms during the time of the American Civil War. An overall stunning piece of cinema, that i wish i could go back and watch in the theatre-to really take in all of the beauty that it provides. A definite watch for any mother, daughter, grandmother , sister, niece and friend."
34,5,"I find Little Women movie very heartbreaking as it presented the Doubts in a women's heart because of the complexity of love they were experienced. Jo as a woman highlighted in this story, close to a man named Laurie. I feel like Jo and Laurie are so happy and compatible as a couple that the happiness they create is truly felt. Unfortunately, they were born into very different social classes. Jo is a poor woman with many siblings while Laurie is a rich man. And when Laurie expressed his feelings, Jo, who is suppossed to accept his love, rejects it instead. It caught my emotions that she would reject him so easily. Actually, I can relate to what she thought about how she should fight the feelings she had with the reality that the caste differences between them were a barrier. However I did not expected the plot that Jo rejected Laurie. I did not expect that the plot would be this painful. I thought that as two people who have a very close relationship and spend a lot of time together they will fight for it. In my imagination, they will be very happy when they are tried to. However, Jo feels very unworthy to be with Laurie. As seen in the dialogue, Laurie: ""you know I figured you love me, Jo"", Jo: ""I don't see why I can't love you the way you want me to"", Laurie: ""I can't love anyone else I only love you"", Jo: ""Teddy it would be a disaster if we married"". The idea that she mentioned it as a disaster if they getting married is insanely painful. I saw that Jo also loved Laurie very much but reality made that love buried. Indeed, the plot wist was very heartbreaking as Jo rejects Laurie because she realizes the differences between them. The contrast between them in their social class causes Jo to save her love for Laurie to herself. The plot made me think deeply about how the harsh reality of love cannot be denied, especially in differences. I was hoping that she was just being honest with her feeling instead of giving up. However, I believe that she did it for the good of both of them."
35,5,"I’m not sure any other movie will make me feel the way this one does, something so special about the dynamic between them all. Something I wish I had"
36,5,"What a gorgeous movie, one of my all time favs. The actors are amazing performers and the way they express their emotions is very touching. This movie is a must watch."
37,3.5,It was good!!! But still can't beat the 1994 version!! That was better!!
38,5,"This is one of the best movie adaptations of a book I have ever seen. I absolutely adore the book, and I was slightly apprehensive about the movie, but my expectations were absolutely blown away! I felt ALL the emotions watching this film. There is not a single bad actor in this movie. Every single actor absolutely killed their role, beautifully embodying the character, including capturing some emotions that are very hard to capture on camera. I have literally no criticisms about this film (that hardly ever happens with me). The director absolutely killed it with capturing the atmosphere and magic of the book in the movie. The outfits and sets of this movie are so gorgeous. Obviously the original story is fantastic and this movie managed to capture it on screen! While watching this I cried multiple times. I have never related to a character such as I relate to Jo March. I understand her, and I relate to her. Saoirse Ronan delivered SUCH A BEAUTIFUL PERFORMANCE. She captured the spirit and character of Jo March so well, I don't even know what more to say. She fucking killed it. The scene where she's talking with her mother after rejecting Laurie and not wanting to get married because she's being told it's her duty as a woman, but being so lonely. That is such an important scene to me. This movie captures so many emotions and raw, human experiences perfectly on screen, like death of a loved one, anger, glee, jealousy, love. This is such a meaningful and important book turned into a meaningful and important movie. It's so beautifully emotional and honestly just a beautiful movie through and through- GOD I could talk about this film all day. Saoirse Ronan, Timotheé Chalamet and Florence Pugh delivered beautifully acted scenes that made me cry. Fantastic movie, definitely in my top 5 of all time. %100 would watch again and probably will."
39,5,"If you need a good cry, watch little woman. It’s beautiful, and heart wrenching at the same time."
40,2.5,"While the performances and technical aspect are strong, nothing can make me forget it’s atrocious ending. I don’t care whether or not it’s accurate to the book, the ending is completely anticlimactic, uncalled for, and utterly distasteful."
41,4.5,"Little Women (Mulherzinhas), is a charming cinematic adaptation, where Greta Gerwig perfectly balances the drama and lightness of the story, bringing a new dimension to Louisa May Alcott's classic. With careful direction, Gerwig brings forth deep characters, with lines that resonate. The film transcends a simple literary adaptation, transforming into a reflection on the dreams and sacrifices of a woman. Saoirse Ronan's performance as Jo March is, without a doubt, captivating. Her portrayal of a young woman struggling to reconcile her independence with societal expectations is striking. And Timothée Chalamet shines as Laurie, the romantic, whose intense emotions are expressed with delicacy. It is in these two characters that we realize that not all love needs to be reciprocated in the way we expect, but it always leaves its mark. Gerwig, with her vision, offers a story of love and a vibrant, strong portrayal of family, friendship, and the search for personal fulfillment. She transforms what could have been a simple drama into a deeply human work of art. No matter how the world changes, deep feelings and struggles remain the same. It is a film that envelops us and leaves a warmth in our chest. Without a doubt, a manifestation of female strength and love in its many forms."
42,5,"Little Women is a life changing movie for people of all ages. It doesn’t matter your gender, there are relatable characters for everyone. The different personalities of all the characters makes a viewer go towards one. For me, I’ve never seen a character like Jo March in a movie. I’m very independent and adventurous. Sometimes I struggle with the idea of love and to be loved. This movie helped me believe in myself and that love is all around. The movie contains all kinds of emotions including frustration and sadness. It shows a real human life. I read the book and I think this a great movie adaptation."
43,4,"Remaking Little Women seems a little lazy to me, but I guess really good, tried-and-true stories are hard to come by. Any time you've got Saoirse Ronan, Florence Pugh, Timothy Chalamet and Meryl Streep in a movie together there's no way I'm going to miss that! Best Actress and Best Supporting Actress Oscar nominations followed, obviously... A must see."
44,5,"Saoirse Ronan, Emma Watson, Florence Pugh and Greta Gerwig absolutely stun in this movie. Their raw talent just absolutely leaves a viewer breathless and is the beating heart of this movie. The pacing offers a 'slice-of-life' feel while still keeping an absolutely beautiful film. Offers such a wonderful take on the story, offering Amy as an almost new addition. Great job, all around."
45,1.5,Not as good as The 1994 version. Florence Pugh as Amy was a terrible casting decision. She looks swollen and 30 years old playing a teenager. Completely unbelievable. Kirsten Dunst was a way better fit. That bad casting choice ruined the movie for me.
46,5,"This adaptation of Little Women is bringing something new to the table - while reconnecting with the original intention of the book. Greta Gerwig's Little Women acknowledges the four March sisters as human characters with dreams, failures, and tenderness, above the romance they might live and that was highlighted in previous cinema versions. On that matter, this adaptation might be the most loyal one to Louisa May Alcott, whose book truly put light on the personalities and endeavors of the four sisters before insisting on their relationships with men. Louisa May Alcott stayed single all her life and meant for her book to present consistent feminine characters more than ""mary them off"". In this movie, there is tenderness and love - of all kinds, not only romantic. Love is everywhere in Greta Gerwig's version, through friendships, family, and romance. It is thus loyal to Alcott's book, which presented the four sisters as four versions of little women who inherited the same love of two kind parents and experienced tenderness in childhood. Greta Gerwig's version is also the most loyal depiction of women's friendships and sisterhood I have witnessed in cinema. Being a young woman, I remember experiencing being a girl with sisters before gaining consciousness of the weight of ""being a woman"": laughing, sharing secrets, playing roles, imagining ourselves everywhere and in every role, creating shows and dances, in the comfort of a home. This movie also brought me joy and consciousness of humankind in the best way possible thanks to the light and witty music composed by Alexandre Desplat and the visual choices of Greta Gerwig. It is my new favorite movie and I would recommend it to anyone new to the story or unconviced by its previous adaptations."
47,4.5,Losing half a star because Timothee should never be cast in a period piece.
48,5,"A movie worth rewatching. The use of warm and cool tones to create a contrast really depicts the moods the characters are feeling. One of the few adaptations I've seen that has done Frederich Bhaer justice. The joys of childhoods and the sorrows of growing up are expressed phenomenally through Joe March. The movie would inspire anyone to read the book, as it did me."
49,5,"Gerwig's visionary brings a unique perspective to the timeless tale that is Little Women, with each of the roles having its own special story to tell, it's a poignant and beautiful character study that spans many directions"
50,4,"Just a really great movie! I didn't know anything about the original Louisa May Alcott novel and haven't seen any of the other six (!) film adaptations. 2019's 'Little Women' evidently makes for the perfect introduction to this story. All events here are nicely portrayed, I found the pacing a little slow in the beginning as well as some tiny timeline issues, but once things get going it's very much a pleasant watch. It's a really touching and, in the end, surprisingly wholesome movie, I was waiting for exaggerated drama and antagonists to appear but they never really come, which is quite refreshing. The cast is stacked. Saoirse Ronan and Florence Pugh are the obvious standouts, though the likes of Timothée Chalamet, Emma Watson, Eliza Scanlen and Meryl Streep all stick out in my memory too. My only criticism would be how the sisters don't always act how the look, a very quick glance at Wikipedia suggests the sisters in the book are all under-16 but visually here they don't seem that young; so there are some moments where you have adults acting like 14 year olds, which is a bit odd. This isn't a major criticism of mine, mind."
